"About the data: Exported on Sep 30, 2024. Criteria: '""Universidad del Norte"" OR ""universidad del norte"" OR ""University of the North"" OR ""university of the north"" OR ""Uninorte"" OR ""uninorte""' in full data; Publication Year is 2008.  Note: For hyper-authorship publications with more than 100 authors the export does not include author names and affiliations. © 2024 Digital Science &amp; Research Solutions Inc. All rights reserved. Parts of this work may also be protected by copyright of content providers and other third parties, which together with all rights of Digital Science, user agrees not to violate. Redistribution / external use of this work (or parts thereof) is prohibited without prior written approval. Please contact info@dimensions.ai for further information.",,,,,,,,,,,,,,,,,,,,,,,,,,,,,,,,,
Rank,Publication ID,DOI,PMID,PMCID,Title,Abstract,Acknowledgements,Funding,Source title,Anthology title,Book editors,MeSH terms,Publication date,PubYear,Publication date (online),Publication date (print),Volume,Issue,Pagination,Open Access,Publication Type,Authors,Authors (Raw Affiliation),Corresponding Authors,Authors Affiliations,Times cited,Recent citations,RCR,FCR,Source Linkout,Dimensions URL,Fields of Research (ANZSRC 2020),Sustainable Development Goals
7454,pub.1018727128,10.1097/rhu.0b013e31816b1931,18525434,,"Prevention, Diagnosis, and Treatment of Glucocorticoid Induced Osteoporosis by Rheumatologists in a Latin-American City","OBJECTIVES: To examine current practices for the diagnosis and therapy for glucocorticoid-induced osteoporosis (GIOP) in patients under treatment with corticosteroids at outpatient clinics of rheumatologists in a Colombian Caribbean city.
METHODS: All patients noted to be using of glucocorticoids (GC) on an index consult from February to May 2004 were included in a descriptive cross sectional study. Criteria for inclusion of patients were to have had, at least, one previous visit to the service. We evaluated the study population for osteoporosis diagnosis, procedures, and treatment.
RESULTS: Of the 121 patients included, 103 (85.1%) were female and 18 (14.9%) were male; 76 patients (62.8%) were under 50 years, and 45 (37.2%) were over 50 years. Main reasons for corticosteroid use were rheumatoid arthritis in 68 patients (56.2%) and systemic lupus erythematous (SLE) in 31 patients (25.6%). Diagnostic testing for osteoporosis was reported on 50.1% of patients. Peripheral dual energy x-ray absorptiometry was the most frequently used method (52.6%). Therapeutic agents for GIOP were used in 96 patients (79.3%), with Calcium plus Vitamin D (55.2%) the principal treatments prescribed.
CONCLUSIONS: We found similar rates of diagnosis and treatment for GIOP to those reported in North America and Europe, although in this study treatment was mainly with calcium and vitamin D. There was a statistically significant relationship between being studied with any diagnostic method and being treated for GIOP. There may be undertreatment for GIOP in Latin America. Local interventions to improve care for patients in chronic use of steroids are needed.",,,JCR Journal of Clinical Rheumatology,,,"Absorptiometry, Photon; Bone Density Conservation Agents; Colombia; Cross-Sectional Studies; Female; Glucocorticoids; Humans; Male; Medical Audit; Middle Aged; Osteoporosis; Rheumatic Diseases",2008-06,2008,,2008-06,14,3,153-155,Closed,Article,"Caballero-Uribe, Carlo V.; Acosta-Velez, Juan G.; Hernandez-Ruiz, Eder A.; Rodado, Fernando M. Andrade; Peñuela-Epalza, Martha","Caballero-Uribe, Carlo V. (From the &amp;ast;Rheumatology Unit, †Community Health Department, Universidad del Norte, Barranquilla, Colombia, South America.); Acosta-Velez, Juan G. (From the &amp;ast;Rheumatology Unit, †Community Health Department, Universidad del Norte, Barranquilla, Colombia, South America.); Hernandez-Ruiz, Eder A. (From the &amp;ast;Rheumatology Unit, †Community Health Department, Universidad del Norte, Barranquilla, Colombia, South America.); Rodado, Fernando M. Andrade (From the &amp;ast;Rheumatology Unit, †Community Health Department, Universidad del Norte, Barranquilla, Colombia, South America.); Peñuela-Epalza, Martha (From the &amp;ast;Rheumatology Unit, †Community Health Department, Universidad del Norte, Barranquilla, Colombia, South America.)",,"Caballero-Uribe, Carlo V. (Universidad del Norte); Acosta-Velez, Juan G. (Universidad del Norte); Hernandez-Ruiz, Eder A. (Universidad del Norte); Rodado, Fernando M. Andrade (Universidad del Norte); Peñuela-Epalza, Martha (Universidad del Norte)",11,1,0.21,1.92,,https://app.dimensions.ai/details/publication/pub.1018727128,32 Biomedical and Clinical Sciences; 3202 Clinical Sciences,
6221,pub.1060401765,10.1099/vir.0.83648-0,18559931,,Use of synthetic peptides to represent surface-exposed epitopes defined by neutralizing dengue complex- and flavivirus group-reactive monoclonal antibodies on the native dengue type-2 virus envelope glycoprotein,"The reactions of neutralizing monoclonal antibodies (mAbs) that defined dengue virus (DENV) complex, flavivirus subgroup or group neutralizing epitopes were tested against synthetic peptide sequences from domains I, II and III of the envelope (E) glycoproteins of different DENV-2 genotypes/strains. The DENV complex-reactive mAb identified the surface-exposed 304-GKFKV/IVKEIA-313 peptides and the DENV complex-conserved 393-KKGSSIGQ/KM-401 peptides in domain III, which were located adjacently in the native glycoprotein. Both flavivirus group-reactive mAbs reacted most strongly with fusion sequence peptides from domain II when they contained a cysteine (C) by glycine (G) substitution (underlined) (101-WGNGGGLFG-109) to represent the native rotated C side chain. The 393-401 sequence represents a newly identified epitope, present as a highly flexible coil located between the 385 and 393 cell-binding sequence and the 401 and 413 sequence involved in the E glycoprotein homo-trimer formation. The 101-109 sequence containing 105-C by G substitution and the 393-401 sequence are good candidates for diagnostic assays and cross-protection experiments.",,,Journal of General Virology,,,"Animals; Antibodies, Monoclonal; Antibodies, Viral; Dengue Virus; Epitope Mapping; Epitopes; Neutralization Tests; Peptides; Viral Envelope Proteins",2008-07-01,2008,,2008-07-01,89,7,1616-1621,All OA; Bronze,Article,"Falconar, Andrew K I","Falconar, Andrew K I (Grupo de Investigaciones en Enfermedades Tropicales, Departamento de Ciencias Basicas Medicas, Universidad del Norte, Km 5 Antigua via Puerto Colombia, Barranquilla, Colombia.; Department of Infectious and Tropical Diseases, London School of Hygiene and Tropical Medicine, Keppel Street, London WC1E 7HT, UK.)",,"Falconar, Andrew K I (Universidad del Norte; London School of Hygiene & Tropical Medicine)",9,1,0.25,0.69,https://doi.org/10.1099/vir.0.83648-0,https://app.dimensions.ai/details/publication/pub.1060401765,32 Biomedical and Clinical Sciences; 3207 Medical Microbiology,3 Good Health and Well Being
5517,pub.1067826009,10.1542/peds.2007-0117,18450890,,Pulse Oxygen Saturation Levels and Arterial Oxygen Tension Values in Newborns Receiving Oxygen Therapy in the Neonatal Intensive Care Unit: Is 85% to 93% an Acceptable Range?,"OBJECTIVE: Our aim was to define the relationship of PaO(2) and pulse oxygen saturation values during routine clinical practice and to evaluate whether pulse oxygen saturation values between 85% and 93% were associated with PaO(2) levels of <40 mmHg.
METHODS: Prospective comparison of PaO(2) and pulse oxygen saturation values in 7 NICUs at sea level in 2 countries was performed. The PaO(2) measurements were obtained from indwelling arterial catheters; simultaneous pulse oxygen saturation values were recorded if the pulse oxygen saturation values changed <1% before, during, and after the arterial gas sample was obtained.
RESULTS: We evaluated 976 paired PaO(2)/pulse oxygen saturation values in 122 neonates. Of the 976 samples, 176 (18%) from infants breathing room air had a mean pulse oxygen saturation of 93.9 +/- 4.3% and a median of 95.5%. The analysis of 800 samples from infants breathing supplemental oxygen revealed that, when pulse oxygen saturation values were 85% to 93%, the mean PaO(2) was 56 +/- 14.7 mmHg and the median 54 mmHg. At this pulse oxygen saturation level, 86.8% of the samples had PaO(2) values of 40 to 80 mmHg, 8.6% had values of <40 mmHg, and 4.6% had values of >80 mmHg. When the pulse oxygen saturation values were >93%, the mean PaO(2) was 107.3 +/- 59.3 mmHg and the median 91 mmHg. At this pulse oxygen saturation level, 39.5% of the samples had PaO(2) values of 40 to 80 mmHg and 59.5% had values of >80 mmHg.
CONCLUSIONS: High PaO(2) occurs very rarely in neonates breathing supplemental oxygen when their pulse oxygen saturation values are 85% to 93%. This pulse oxygen saturation range also is infrequently associated with low PaO(2) values. Pulse oxygen saturation values of >93% are frequently associated with PaO(2) values of >80 mmHg, which may be of risk for some newborns receiving supplemental oxygen.",The study was supported in part by a Goodard Scholarship (Dr Sola) and by funds from the Mid-Atlantic Neonatology Associates and Atlantic Neonatal Research Institute (Dr Sola). We thank the anonymous reviewers who contributed to substantial improvements in the manuscript. We give special thanks to Dr Marta Rogido for her outstanding help during this study and to Dr Ronald Goldberg for his assistance in the preparation of the revised manuscript. We are thankful to the nurses and respiratory therapists who cared for these infants and notified us at the time of planned blood gas measurements.,,Pediatrics,,,"Humans; Infant, Newborn; Intensive Care Units, Neonatal; Oximetry; Oxygen; Oxygen Inhalation Therapy; Oxyhemoglobins",2008-05-01,2008,2008-05-01,2008-05-01,121,5,882-889,Closed,Article,"Castillo, Armando; Sola, Augusto; Baquero, Hernando; Neira, Freddy; Alvis, Ramiro; Deulofeut, Richard; Critz, Ann","Castillo, Armando (Division of Neonatal-Perinatal Medicine, Emory University, Atlanta, Georgia); Sola, Augusto (Mid-Atlantic Neonatology Associates and Atlantic Neonatal Research Institute, Morristown Memorial Hospital, Morristown, New Jersey); Baquero, Hernando (Department of Pediatrics, University of the North, Barranquilla, Colombia); Neira, Freddy (Department of Pediatrics, University of the North, Barranquilla, Colombia); Alvis, Ramiro (Department of Pediatrics, University of the North, Barranquilla, Colombia); Deulofeut, Richard (Pediatrix Medical Group, Neonatology, Dallas, Texas); Critz, Ann (Division of Neonatal-Perinatal Medicine, Emory University, Atlanta, Georgia)",,"Castillo, Armando (Emory University); Sola, Augusto (Morristown Medical Center); Baquero, Hernando (Universidad del Norte); Neira, Freddy (Universidad del Norte); Alvis, Ramiro (Universidad del Norte); Deulofeut, Richard (Pediatrix Medical Group, Neonatology, Dallas, Texas); Critz, Ann (Emory University)",145,11,3.23,28.64,,https://app.dimensions.ai/details/publication/pub.1067826009,32 Biomedical and Clinical Sciences; 3213 Paediatrics,
5384,pub.1042869673,10.1586/1744666x.4.3.305,20476919,,Designer monoclonal antibodies as drugs: the state of the art,,"SS Mohapatra is supported by grants from NIH-5RO1HL71101-01A2 and Department of Veterans’ Affairs Merit Review and Senior Career Scientist Awards. Also, the support from the Mabel &amp; Ellsworth Simmons Professorship and the Joy McCann Culverhouse and endowments to the Division of Allergy and Immunology is also gratefully acknowledged. The authors have no other relevant affiliations or financial involvement with any organization or entity with a financial interest in or financial conflict with the subject matter or materials discussed in the manuscript apart from those disclosed. No writing assistance was utilized in the production of this manuscript.",,Expert Review of Clinical Immunology,,,,2008-05,2008,2014-01-10,2008-05,4,3,305-307,All OA; Bronze,Article,"Mohapatra, Shyam; San Juan, Homero","Mohapatra, Shyam (Department of Internal Medicine Division of Allergy & Immunology, JMC Airway Disease & Nanomedicine Center, JAH VA Hospital & USF College of Medicine, Tampa, FL, USA., smohapat@health.usf.edu); San Juan, Homero (Department of Medicine, Universidad del Norte, Km 5 Via Puerto Colombia, Barranquilla, Colombia)","Mohapatra, Shyam (University of South Florida)","Mohapatra, Shyam (University of South Florida); San Juan, Homero (Universidad del Norte)",3,0,0.05,0.34,https://www.tandfonline.com/doi/pdf/10.1586/1744666X.4.3.305?needAccess=true,https://app.dimensions.ai/details/publication/pub.1042869673,32 Biomedical and Clinical Sciences; 3204 Immunology,
