360,pub.1009807287,10.1080/0309877x.2014.953456,,,To grade or not to grade: balancing formative and summative assessment in post-16 teacher trainee observations,"The issue of whether trainee teachers in the post-16 sector should have their classroom practice graded has been debated for a number of years. The case for training courses retaining an emphasis on written and verbal ‘developmental’ feedback at the expense of ‘judgements’ appears to be lost. This article is set within the context of an ever-growing culture of performativity in English further education colleges, where grading is regarded as an essential requirement to ensure high quality teaching. Tensions are explored between stakeholders who call for graded observations of trainees’ classroom performance (e.g. Ofsted and FEC quality assurance managers), and classroom-based trainers and researchers who argue that grading is too judgemental and compromises the formative and developmental progress of trainees. The rationale for trainee teachers to have their classroom practice graded is contrasted with evidence that highlights the negative results of grading. This article reports findings from the evaluation of an innovative, alternative strategy that addresses Ofsted’s central requirement for trainees to know ‘where they are’ in their development by offering a middle way between grading and not grading trainees’ classroom performance.",,,Journal of Further and Higher Education,,,,2014-10-09,2014,2014-10-09,2016-03-03,40,2,247-261,All OA; Green,Article,"Matthews, Richard; Noyes, Andrew","Matthews, Richard (School of Education, University of Nottingham, Nottingham, UK); Noyes, Andrew (School of Education, University of Nottingham, Nottingham, UK)","Matthews, Richard (University of Nottingham)","Matthews, Richard (University of Nottingham); Noyes, Andrew (University of Nottingham)",6,3,,1.9,https://nottingham-repository.worktribe.com/preview/980208/Matthews%20%20Noyes%202015%20post-print.pdf,https://app.dimensions.ai/details/publication/pub.1009807287,39 Education; 3901 Curriculum and Pedagogy; 3903 Education Systems,4 Quality Education
344,pub.1051432738,10.1016/j.rehah.2014.05.004,,,Hernia incisional lumbar complicada originada en el sitio quirúrgico de una artroplastia de cadera,"ResumenEn el presente artículo se discute un caso muy raro de hernia incisional lumbar complicada, secundaria a artroplastia total de cadera. Se trata de una paciente con el antecedente de artroplastia bilateral de cadera (5 años atrás en otra institución), hospitalizada por pancreatitis aguda edematosa que se trató en forma conservadora. En el momento del ingreso se tomó una tomografía abdominal que describía, como hallazgo incidental, la presencia de una hernia lumbar izquierda en estrecha relación con una prótesis de cadera. Notablemente, la paciente refería solo ocasionales molestias inespecíficas en el sitio de su hernia. En el día 30.̊ de hospitalización la hernia se incarceró y posteriormente se estranguló. La severidad de esta complicación llevó al fallecimiento de la paciente. A pesar de su rareza, estas hernias deben incluirse dentro del diagnóstico diferencial de cualquier masa lumbar y de las complicaciones tardías en pacientes sometidos a artroplastia de cadera.AbstractThis article discusses an uncommon case of complicated incisional lumbar hernia secondary to total hip arthroplasty. A female patient with the antecedent of bilateral total hip arthroplasty 5 years ago at another institution was hospitalized for acute edematous pancreatitis, conservative treatment was instituted. An initial abdominal computerized tomography showed the incidental finding of a left lumbar hernia in close relationship with a hip prosthesis. Remarkably, the patient had only occasional unspecific nuisances located over her hernia. During the 30th day of hospital stay, the incisional hernia became incarcerated and the intestinal contents strangulated. The severity of this complication, finally lead to the patient's decease. Despite its rarity, these hernias should be included within the differential diagnosis of flank masses and late hip arthroplasty symptomatic complications.",,,Revista Hispanoamericana de Hernia,,,,2014-10,2014,,2014-10,2,4,173-176,All OA; Hybrid,Article,"Rojas, Luis Jaramillo; Vega, Catalina Valenzuela; Saavedra, Marcelo A. Beltrán; Beaumont, Eduardo A. Olivares; Palominos, Javier Arcos; Menares, Tatiana Fuentes","Rojas, Luis Jaramillo (Servicio de Cirugía, Hospital San Juan de Dios, La Serena, Chile; Departamento de Clínicas, Facultad de Medicina, Universidad Católica del Norte, IV Región, Chile); Vega, Catalina Valenzuela (Servicio de Cirugía, Hospital San Juan de Dios, La Serena, Chile); Saavedra, Marcelo A. Beltrán (Servicio de Cirugía, Hospital San Juan de Dios, La Serena, Chile; Departamento de Clínicas, Facultad de Medicina, Universidad Católica del Norte, IV Región, Chile); Beaumont, Eduardo A. Olivares (Departamento de Clínicas, Facultad de Medicina, Universidad Católica del Norte, IV Región, Chile); Palominos, Javier Arcos (Departamento de Clínicas, Facultad de Medicina, Universidad Católica del Norte, IV Región, Chile); Menares, Tatiana Fuentes (Departamento de Clínicas, Facultad de Medicina, Universidad Católica del Norte, IV Región, Chile)","Saavedra, Marcelo A. Beltrán (Hospital San Juan de Dios; Catholic University of the North)","Rojas, Luis Jaramillo (Hospital San Juan de Dios; Catholic University of the North); Vega, Catalina Valenzuela (Hospital San Juan de Dios); Saavedra, Marcelo A. Beltrán (Hospital San Juan de Dios; Catholic University of the North); Beaumont, Eduardo A. Olivares (Catholic University of the North); Palominos, Javier Arcos (Catholic University of the North); Menares, Tatiana Fuentes (Catholic University of the North)",0,0,,,https://doi.org/10.1016/j.rehah.2014.05.004,https://app.dimensions.ai/details/publication/pub.1051432738,,
335,pub.1031661063,10.1063/1.4868902,,,Single-parameter spin-pumping in driven metallic rings with spin-orbit coupling,"We consider the generation of a pure spin-current at zero bias voltage with a single time-dependent potential. To such end we study a device made of a mesoscopic ring connected to electrodes and clarify the interplay between a magnetic flux, spin-orbit coupling, and non-adiabatic driving in the production of a spin and electrical current. By using Floquet theory, we show that the generated spin to charge current ratio can be controlled by tuning the spin-orbit coupling.","We acknowledge support of the SPU-Argentina (Project PPCP-025), SeCyT-UNC, ANPCyT-FonCyT, FONDECYT Project No. 1100560, CONICYT (Project PSD-65), and the scholarship CONICYT academic year 2012 No. 22121816.",,Journal of Applied Physics,,,,2014-03-27,2014,2014-03-27,2014-03-28,115,12,124507,All OA; Green,Article,"Ramos, J. P.; Torres, L. E. F. Foa; Orellana, P. A.; Apel, V. M.","Ramos, J. P. (Departamento de Física, Universidad Católica del Norte, Angamos 0610, Casilla 1280, Antofagasta, Chile); Torres, L. E. F. Foa (Instituto de Física Enrique Gaviola (CONICET) and FaMAF, Universidad Nacional de Córdoba, Ciudad Universitaria 5000, Córdoba, Argentina); Orellana, P. A. (Departamento de Física, Universidad Técnica Federico Santa María, Avenida Vicuña Mackenna 3939, San Joaquin, Santiago, Chile); Apel, V. M. (Departamento de Física, Universidad Católica del Norte, Angamos 0610, Casilla 1280, Antofagasta, Chile)",,"Ramos, J. P. (Catholic University of the North); Torres, L. E. F. Foa (National University of Córdoba); Orellana, P. A. (Federico Santa María Technical University); Apel, V. M. (Catholic University of the North)",2,0,,0.44,https://rdu.unc.edu.ar/bitstream/11086/19856/1/Ramos2014.pdf,https://app.dimensions.ai/details/publication/pub.1031661063,51 Physical Sciences; 5104 Condensed Matter Physics,
330,pub.1033392435,10.1016/j.optcom.2014.06.068,,,Dicke and Fano effects in single photon transport,"The single photon transport through a one dimensional array of cavities is studied theoretically. Analytic expressions of the reflection and transmission are given. The transmission shows an energy spectrum with forbidden and allowed bands that depend on the detuning parameter of the system. We show that the allowed mini band is formed due to the indirect coupling between the atoms in each cavity. In addition, the band edges can be controlled by the degree of detuning of the level of the atoms. We discuss the analogy between this phenomenon with the Fano and Dicke effects.","AcknowledgmentsThe authors would like to thank financial support from FONDECYT under Grants nos. 1080660 and 1140567, and CONICYT ACT 1204.",,Optics Communications,,,,2014-12,2014,,2014-12,332,,366-369,All OA; Green,Article,"Ahumada, Maritza; Cortés, Natalia; de Guevara, M.L. Ladrón; Orellana, P.A.","Ahumada, Maritza (Departamento de Física, Universidad Católica del Norte, Casilla 1280, Antofagasta, Chile); Cortés, Natalia (Departamento de Física, Universidad Católica del Norte, Casilla 1280, Antofagasta, Chile); de Guevara, M.L. Ladrón (Departamento de Física, Universidad Católica del Norte, Casilla 1280, Antofagasta, Chile); Orellana, P.A. (Departamento de Física, Universidad Técnica Federico Santa María, P.O. Box 110 V, Valparaíso, Chile)","Orellana, P.A. (Federico Santa María Technical University)","Ahumada, Maritza (Catholic University of the North); Cortés, Natalia (Catholic University of the North); de Guevara, M.L. Ladrón (Catholic University of the North); Orellana, P.A. (Federico Santa María Technical University)",1,0,,0.29,https://arxiv.org/pdf/1201.3675,https://app.dimensions.ai/details/publication/pub.1033392435,"51 Physical Sciences; 5102 Atomic, Molecular and Optical Physics",
329,pub.1045916792,10.1016/j.laa.2014.01.013,,,A decreasing sequence of upper bounds for the Laplacian energy of a tree,"Let R be a nonnegative Hermitian matrix. The energy of R, denoted by E(R), is the sum of absolute values of its eigenvalues. We construct an increasing sequence that converges to the Perron root of R. This sequence yields a decreasing sequence of upper bounds for E(R). We then apply this result to the Laplacian energy of trees of order n, namely to the sum of the absolute values of the eigenvalues of the Laplacian matrix, shifted by −2(n−1)/n.",,,Linear Algebra and its Applications,,,,2014-04,2014,,2014-04,446,,304-313,All OA; Bronze,Article,"Carmona, Juan; Gutman, Ivan; Tamblay, Nelda Jaque; Robbiano, María","Carmona, Juan (Departamento de Matemáticas, Universidad Católica del Norte, Av. Angamos, 0610 Antofagasta, Chile); Gutman, Ivan (Faculty of Science, University of Kragujevac, P.O.B. 60, 34000 Kragujevac, Serbia); Tamblay, Nelda Jaque (Departamento de Matemáticas, Universidad Católica del Norte, Av. Angamos, 0610 Antofagasta, Chile); Robbiano, María (Departamento de Matemáticas, Universidad Católica del Norte, Av. Angamos, 0610 Antofagasta, Chile)","Gutman, Ivan (University of Kragujevac)","Carmona, Juan (Catholic University of the North); Gutman, Ivan (University of Kragujevac); Tamblay, Nelda Jaque (Catholic University of the North); Robbiano, María (Catholic University of the North)",3,1,,1.38,https://doi.org/10.1016/j.laa.2014.01.013,https://app.dimensions.ai/details/publication/pub.1045916792,49 Mathematical Sciences; 4901 Applied Mathematics; 4904 Pure Mathematics,
327,pub.1149787165,10.11144/javeriana.10554.9900,,,Teorías implícitas del talento en profesores de educación básica de la ciudad de Bogotá,,,,,,,,2014-09,2014,,,,,,All OA; Hybrid,Article,"del Pilar Barrero Tapias, Victoria; Lara, Javier Enrique Muñoz","del Pilar Barrero Tapias, Victoria (); Lara, Javier Enrique Muñoz ()",,"del Pilar Barrero Tapias, Victoria (); Lara, Javier Enrique Muñoz ()",0,0,,,http://repository.javeriana.edu.co/bitstream/10554/9900/4/BarreroTapiasVictoriadelPilar2012.pdf,https://app.dimensions.ai/details/publication/pub.1149787165,,
323,pub.1071115432,10.3184/174751914x14107905836359,,,Synthesis and Antifungal activity of Phenacyl Azoles,"A new N-(4-methoxyphenacyl)imidazole and three new substituted N-(phenacyl)triazoles were prepared by reaction of the heterocycle with a phenacyl halide. The former ketone and one example of the latter were reduced to the corresponding alcohols. All six compounds were screened in vitro for antifungal activity against two pathogenic fungal strains, Candida albicans (fluconazole-resistant) and Aspergillus fumigatus. The results revealed that most of the compounds showed activity against both strains at 100 μg mL -1 and 80 μg mL -1 , some comparable with control compound fluconazole. The alcohols were less active than the corresponding ketones.",,,Journal of Chemical Research,,,,2014-09-01,2014,2014-09-01,2014-09,38,9,549-552,All OA; Hybrid,Article,"Nelson, Ronald; Kesternich, Víctor; Pérez-Fehrmann, Marcia; Salazar, Fernanda; Marcourt, Laurence; Christen, Philippe; Godoy, Patricio","Nelson, Ronald (Departamento de Química, Facultad de Ciencias, Universidad Católica del Norte, Antofagasta, Chile); Kesternich, Víctor (Departamento de Química, Facultad de Ciencias, Universidad Católica del Norte, Antofagasta, Chile); Pérez-Fehrmann, Marcia (Departamento de Química, Facultad de Ciencias, Universidad Católica del Norte, Antofagasta, Chile); Salazar, Fernanda (Departamento de Química, Facultad de Ciencias, Universidad Católica del Norte, Antofagasta, Chile); Marcourt, Laurence (School of Pharmaceutical Sciences, University of Geneva, University of Lausanne, Quai Ernest-Ansermet 30, CH-1211 Geneva 4, Switzerland); Christen, Philippe (School of Pharmaceutical Sciences, University of Geneva, University of Lausanne, Quai Ernest-Ansermet 30, CH-1211 Geneva 4, Switzerland); Godoy, Patricio (Instituto de Microbiología Clínica, Facultad de Medicina, Universidad Austral de Chile, Valdivia, Chile)","Kesternich, Víctor (Catholic University of the North)","Nelson, Ronald (Catholic University of the North); Kesternich, Víctor (Catholic University of the North); Pérez-Fehrmann, Marcia (Catholic University of the North); Salazar, Fernanda (Catholic University of the North); Marcourt, Laurence (University of Geneva); Christen, Philippe (University of Geneva); Godoy, Patricio (Austral University of Chile)",6,2,,0.77,https://journals.sagepub.com/doi/pdf/10.3184/174751914X14107905836359,https://app.dimensions.ai/details/publication/pub.1071115432,31 Biological Sciences; 3107 Microbiology; 32 Biomedical and Clinical Sciences; 3202 Clinical Sciences,
323,pub.1026905957,10.4067/s0718-19572014000200018,,,Actividad antibacteriana de extractos crudos del crustceo Austromegabalanus psittacus (Cirripedia: Balanidae),"Antibacterial activity in crude extracts of Austromegabalanus psittacus soft tissue, originating from 2 coastal localities in the north and south of Chile, was evaluated in 7 solvents. Antibacterial activity was determined using the disk diffusion method to test 7 bacterial strains (ATCC). Evidence of inhibition was found in Escherichia coli, Salmonella enteritidis, Staphylococcus aureus, Aeromonas hydrophila and Yersinia ruckeri, with high variability, depending on the solvent utilized. No differential patterns were recorded according to specimen origin. Results are discussed in terms of their potential application to the aquaculture and food industries.",,,Revista de biología marina y oceanografía,,,,2014-08,2014,2014-08,,49,2,385-392,All OA; Bronze,Article,"Trujillo, Lilian E.; Uribe, Jos M.; Lpez, Boris A.; Lpez, Daniel A.","Trujillo, Lilian E. (Universidad de Los Lagos Departamento de Salud, Osorno, Chile); Uribe, Jos M. (Universidad de Los Lagos Departamento de Salud, Osorno, Chile); Lpez, Boris A. (Universidad de Los Lagos Departamento de Acuicultura y Recursos Agroalimentarios, Osorno, Chile; Universidad Catlica del Norte Facultad de Ciencias del Mar, Coquimbo, Chile); Lpez, Daniel A. (Universidad de Playa Ancha Centro de Estudios Avanzados, Via del Mar, Chile)",,"Trujillo, Lilian E. (University of Los Lagos); Uribe, Jos M. (University of Los Lagos); Lpez, Boris A. (University of Los Lagos; Catholic University of the North); Lpez, Daniel A. (Playa Ancha University of Educational Sciences)",0,0,,0.0,http://www.scielo.cl/pdf/revbiolmar/v49n2/art18.pdf,https://app.dimensions.ai/details/publication/pub.1026905957,31 Biological Sciences; 3107 Microbiology,
322,pub.1020711149,10.1016/j.physb.2014.07.047,,,Bound states in the continuum and spin filter in quantum-dot molecules,"In this paper we study the formation of bound states in the continuum in a quantum dot molecule coupled to leads and their potential application in spintronics. Based on the combination of bound states in the continuum and Fano effect, we propose a new design of a spin-dependent polarizer. By lifting the spin degeneracy of the carriers in the quantum dots by means of a magnetic field the system can be used as a spin-polarized device. A detailed analysis of the spin-dependent conductance and spin polarization as a function of the applied magnetic field and gate voltages is carried out.",,,Physica B Condensed Matter,,,,2014-12,2014,,2014-12,455,,66-70,All OA; Green,Article,"Ramos, J.P.; Orellana, P.A.","Ramos, J.P. (Departamento de Física, Universidad Católica del Norte, Casilla 1280, Antofagasta, Chile); Orellana, P.A. (Departamento de Física, Universidad Técnica Federico Santa María, Vicuña Mackenna 3939, Santiago, Chile)","Orellana, P.A. (Federico Santa María Technical University)","Ramos, J.P. (Catholic University of the North); Orellana, P.A. (Federico Santa María Technical University)",15,1,,3.33,https://arxiv.org/pdf/1304.8059,https://app.dimensions.ai/details/publication/pub.1020711149,51 Physical Sciences; 5104 Condensed Matter Physics,
316,pub.1058944907,10.1088/0004-637x/785/1/68,,,ON THE AGE OF GLIESE 86,"Gliese 86 is a nearby planet hosting a visual binary consisting of a K-type primary, Gl 86 A, and a white dwarf secondary, Gl 86 B. In this work, we present a model atmosphere analysis of the MA = 0.83 M☉ primary, whose chemistry unambiguously identifies it as a 10 Gyr old disk star. For the secondary, this gives rise to a progenitor mass Mprog = 1.11 ± 0.05 M☉, and—by inference with its local sibling o2 Eri—a white dwarf mass MB = 0.49 ± 0.02 M☉. The discrepancy with the 2–3 Gyr chromospheric age of Gl 86 A, as first noted by Rocha-Pinto, Castilho & Maciel, is thus most plausibly the result of a former accretion of mass and angular momentum from the distant degenerate. In consequence, this also implies that with respect to shorter-period systems, like Sirius or Procyon, one must expect significant wind accretion when they evolve through the planetary nebula phase, such that the system ages cannot be reliably determined from their currently bright primaries.",This publication is supported as a project of the Nordrhein-Westfälische Akademie der Wissenschaften und der Künste in the framework of the academy program by the Federal Republic of Germany and the state Nordrhein-Westfalen. It is a pleasure to thank Jay Holberg for a constructive and helpful review. K.F. acknowledges support from the DFG grant FU 198/10-1.,,The Astrophysical Journal,,,,2014-03-26,2014,2014-03-26,2014-04-10,785,1,68,All OA; Bronze,Article,"Fuhrmann, K.; Chini, R.; Buda, L.-S.; Nuñez, F. Pozo","Fuhrmann, K. (Astronomisches Institut, Ruhr-Universität Bochum, Universitätsstraße 150, D-44801 Bochum, Germany;, klaus@ing.iac.es; Isaac Newton Group of Telescopes, Apartado 321, E-38700 Santa Cruz de La Palma, Spain); Chini, R. (Astronomisches Institut, Ruhr-Universität Bochum, Universitätsstraße 150, D-44801 Bochum, Germany;, klaus@ing.iac.es; Instituto de Astronomía, Universidad Católica del Norte, Avenida Angamos 0610, Casilla 1280, Antofagasta, Chile); Buda, L.-S. (Astronomisches Institut, Ruhr-Universität Bochum, Universitätsstraße 150, D-44801 Bochum, Germany;, klaus@ing.iac.es); Nuñez, F. Pozo (Astronomisches Institut, Ruhr-Universität Bochum, Universitätsstraße 150, D-44801 Bochum, Germany;, klaus@ing.iac.es)",,"Fuhrmann, K. (Ruhr University Bochum; Isaac Newton Group); Chini, R. (Ruhr University Bochum; Catholic University of the North); Buda, L.-S. (Ruhr University Bochum); Nuñez, F. Pozo (Ruhr University Bochum)",16,4,,3.87,https://iopscience.iop.org/article/10.1088/0004-637X/785/1/68/pdf,https://app.dimensions.ai/details/publication/pub.1058944907,51 Physical Sciences; 5101 Astronomical Sciences,
315,pub.1062065399,10.11144/javeriana.iyu18-2.cvso,,,"Computer vision system for the optimization of the color generated by the coffee roasting process according to time, temperature and mesh size","This article describes the implementation of a computer vision system to determine the effect of time and temperature on the color generated by the roasting of coffee, for which a software tool in the mathematical software Matlab, previously parameterized using color data for the roasting process was developed and implemented. The color was measured in CIEL*a*b* space and the data were analyzed using the statistical response surface design. The result of this work is a system that allows for realtime sensory information about color and therefore has an advantage over existing traditional systems. The study shows that computer vision system could distinguish different shades during roasting of coffee depending on process parameters and good capacity for generalization.",,,Ingenieria y Universidad,,,,2014-11-20,2014,2014-11-20,,18,2,355-368,All OA; Bronze,Article,"Cruz, Jimy Frank Oblitas; Castro-Silupu, Wilson","Cruz, Jimy Frank Oblitas (Universidad Privada del Norte); Castro-Silupu, Wilson (Universidad Privada del Norte)",,"Cruz, Jimy Frank Oblitas (Private University of the North); Castro-Silupu, Wilson (Private University of the North)",6,1,,0.58,https://revistas.javeriana.edu.co/index.php/iyu/article/download/5617/9022,https://app.dimensions.ai/details/publication/pub.1062065399,"30 Agricultural, Veterinary and Food Sciences; 3006 Food Sciences; 46 Information and Computing Sciences",
311,pub.1072195631,10.4067/s0718-16202014000100002,,,Formulated diets for giant Chilean frog Calyptocephalella gayi tadpoles,"In this study, we conducted an experiment to evaluate the overall effect of novel diets on the growth, metamorphosis and survival of tadpoles of the endangered giant Chilean frog Calyptocephalella gayi (previously known as Caudiverbera caudiverbera) to evaluate the potential of this species for culture and repopulation purposes. Using fishmeal as the main protein source with a substitution of either scallop viscera or Spirulina meal, three treatments were formulated to contain similar amounts of protein and energy. The experiment was run for 75 days, after which the tadpoles showed no significant differences among treatments in terms of their growth or survival. This is the first study to report positive effects of different diets on the growth and survival of tadpoles of the giant Chilean frog. Therefore, it might be possible to extend the farming of Calyptocephalella gayi for human consumption and repopulation. Nevertheless, more efforts are needed to understand their nutritional requirements to formulate appropriate diets for this endangered frog. Este es el primer estudio de alimentacin con dietas formuladas para evaluar la factibilidad y su efecto en el crecimiento, metamorfosis y supervivencia de renacuajos de la rana grande chilena Calyptocephalella gayi (anteriormente Caudiverbera caudiverbera) y valorar el potencial de esta especie en peligro, para desarrollar la acuicultura y la repoblacin. Se realizaron tres tratamientos con dietas que contenan similares niveles de protena y energa, utilizando harina de pescado como principal fuente proteica y con sustituciones parciales con harina de vscera de ostin y Spirulina. El experimento dur 75 das, en el transcurso de los cuales los renacuajos no mostraron diferencias significativas entre los tratamientos en trminos de crecimiento y supervivencia. Este es el primer estudio que reporta efectos positivos de dietas formuladas sobre el crecimiento y supervivencia de renacuajos de la rana gigante chilena en cautiverio. Por lo tanto, se concluye que es factible cultivar, utilizando alimento formulado, renacuajos de Calyptocephalella gayi. Sin embargo, se requiere realizar ms esfuerzos y profundizar en el conocimiento de los requerimientos nutricionales para generar una dieta apropiada para esta especie en peligro.",,,Ciencia e investigación agraria,,,,2014-04,2014,2014-04,,41,1,13-20,All OA; Bronze,Article,"Toledo, Pedro H; Suazo, Ricardo; Viana, Maria T","Toledo, Pedro H (Universidad Catlica del Norte Facultad de Ciencias del Mar Departamento de Acuicultura, Coquimbo, Chile; Centro de Estudios Avanzados en Zonas ridas, Coquimbo, Chile); Suazo, Ricardo (Cultivos Marinos Chilo S.A., Ancud, Chile); Viana, Maria T (Universidad Autnoma de Baja California Instituto de Investigaciones Oceanolgicas, Tijuana-Ensenada Baja California, Mexico)",,"Toledo, Pedro H (Catholic University of the North; Centro de Estudios Avanzados en Zonas ridas, Coquimbo, Chile); Suazo, Ricardo (Cultivos Marinos Chilo S.A., Ancud, Chile); Viana, Maria T (Universidad Autnoma de Baja California Instituto de Investigaciones Oceanolgicas, Tijuana-Ensenada Baja California, Mexico)",4,2,,0.41,http://www.scielo.cl/pdf/ciagr/v41n1/art02.pdf,https://app.dimensions.ai/details/publication/pub.1072195631,"30 Agricultural, Veterinary and Food Sciences; 3005 Fisheries Sciences; 31 Biological Sciences; 3109 Zoology; 41 Environmental Sciences; 4102 Ecological Applications",15 Life on Land
