"About the data: Exported on Oct 01, 2024. Criteria: '""Universidad del Norte"" OR ""universidad del norte"" OR ""University of the North"" OR ""university of the north"" OR ""Uninorte"" OR ""uninorte""' in full data; Publication Year is 2014; Publication Type is Article; Open Access is Bronze or Hybrid or Green.  Note: For hyper-authorship publications with more than 100 authors the export does not include author names and affiliations. © 2024 Digital Science &amp; Research Solutions Inc. All rights reserved. Parts of this work may also be protected by copyright of content providers and other third parties, which together with all rights of Digital Science, user agrees not to violate. Redistribution / external use of this work (or parts thereof) is prohibited without prior written approval. Please contact info@dimensions.ai for further information.",,,,,,,,,,,,,,,,,,,,,,,,,,,,,,,,,
Rank,Publication ID,DOI,PMID,PMCID,Title,Abstract,Acknowledgements,Funding,Source title,Anthology title,Book editors,MeSH terms,Publication date,PubYear,Publication date (online),Publication date (print),Volume,Issue,Pagination,Open Access,Publication Type,Authors,Authors (Raw Affiliation),Corresponding Authors,Authors Affiliations,Times cited,Recent citations,RCR,FCR,Source Linkout,Dimensions URL,Fields of Research (ANZSRC 2020),Sustainable Development Goals
7705,pub.1038556161,10.1111/tmi.12431,25418067,,The single water‐surface sweep estimation method accurately estimates very low (n = 4) to low–moderate (n = 25–100) and high (n > 100) Aedes aegypti (Diptera: Culicidae) pupae numbers in large water containers up to 13 times faster than the exhaustive sweep and total count method and without any sediment contamination,"OBJECTIVE: To confirm that a single water-surface sweep-net collection coupled with three calibration factors (2.6, 3.0 and 3.5 for 1/3, 2/3 and 3/3 water levels, respectively) (WSCF) could accurately estimate very low to high Aedes aegypti pupae numbers in water containers more rapidly than the exhaustive 5-sweep and total count (ESTC) method recommended by WHO.
METHODS: Both methods were compared in semi-field trials using low (n = 25) to moderate (n = 50-100) pupae numbers in a 250-l drum at 1/3, 2/3 and 3/3 water levels, and by their mean-time determinations using 200 pupae in three 220- to 1024-l water containers at these water levels. Accuracy was further assessed using 69.1% (393/569) of the field-based drums and tanks which contained <100 pupae.
RESULTS: The WSCF method accurately estimated total populations in the semi-field trials up to 13.0 times faster than the ESTC method (all P < 0.001); no significant differences (all P-values ≥ 0.05) were obtained between the methods for very low (n = 4) to low-moderate (n = 25-100) and high (n > 100) pupae numbers/container and without sediment disturbance.
CONCLUSION: The simple WSCF method sensitively, accurately and robustly estimated total pupae numbers in their principal breeding sites worldwide, containers with >20 l water volumes, significantly (2.7- to 13.0-fold: all P-values <0.001) faster than the ESTC method for very low to high pupae numbers/container without contaminating the clean water by sediment disturbance which is generated using the WHO-recommended ESTC method. The WSCF method seems ideal for global community-based surveillance and control programmes.","We thank Rosmery Llanos for her technical support, Pedro Arango Padilla from the Secretaría Distrital de Salud de Barranquilla, two anonymous reviewers for their suggestions for improving the content of this paper and Professor Sherry Towers (Arizona State University and Towers Consulting LLC, USA) for additional expert statistical advice and for performing the Spearman rho statistical analyses from the data presented in this paper and from our previous studies (Romero‐Vivas et al. 2007). This study received financial support from Universidad del Norte.",,Tropical Medicine and International Health,,,Aedes; Animals; Dengue; Environmental Monitoring; Household Articles; Insect Vectors; Population Density; Pupa; Water,2014-12-11,2014,2014-12-11,2015-03,20,3,326-333,All OA; Bronze,Article,"Romero‐Vivas, C. M.; Llinás, H.; Falconar, A. K.","Romero‐Vivas, C. M. (Grupo de Investigaciones en Enfermedades Tropicales, Departamento de Medicina, Universidad del Norte, Barranquilla, Colombia); Llinás, H. (Grupo de Investigaciones en Enfermedades Tropicales, Departamento de Medicina, Universidad del Norte, Barranquilla, Colombia; Departamento de Matemáticas y Estadística, Universidad del Norte, Barranquilla, Colombia); Falconar, A. K. (Grupo de Investigaciones en Enfermedades Tropicales, Departamento de Medicina, Universidad del Norte, Barranquilla, Colombia)","Romero‐Vivas, C. M. (Universidad del Norte)","Romero‐Vivas, C. M. (Universidad del Norte); Llinás, H. (Universidad del Norte; Universidad del Norte); Falconar, A. K. (Universidad del Norte)",3,2,0.16,0.65,https://onlinelibrary.wiley.com/doi/pdfdirect/10.1111/tmi.12431,https://app.dimensions.ai/details/publication/pub.1038556161,32 Biomedical and Clinical Sciences; 3202 Clinical Sciences,
6421,pub.1044241801,10.1111/jeb.12446,25056484,,Male facial attractiveness and masculinity may provide sex‐ and culture‐independent cues to semen quality,"Phenotype-linked fertility hypothesis (PLFH) predicts that male secondary sexual traits reveal honest information about male fertilization ability. However, PLFH has rarely been studied in humans. The aim of the present study was to test PLFH in humans and to investigate whether potential ability to select fertile partners is independent of sex or cultural background. We found that on the contrary to the hypothesis, facial masculinity was negatively associated with semen quality. As increased levels of testosterone have been demonstrated to impair sperm production, this finding may indicate a trade-off between investments in secondary sexual signalling (i.e. facial masculinity) and fertility or status-dependent differences in investments in semen quality. In both sexes and nationalities (Spanish and Colombian), ranked male facial attractiveness predicted male semen quality. However, Spanish males and females estimated facial images generally more attractive (gave higher ranks) than Colombian raters, and in both nationalities, males gave higher ranks than females. This suggests that male facial cues may provide culture- and sex-independent information about male fertility. However, our results also indicate that humans may be more sensitive to facial attractiveness cues within their own populations and also that males may generally overestimate the attractiveness of other men to females.",We would like to thank P. Buendía and C. Gago for their technical advice. The study was financially supported by Kone Foundation (to JK).,,Journal of Evolutionary Biology,,,Adult; Colombia; Cues; Cultural Characteristics; Face; Female; Humans; Male; Masculinity; Phenotype; Regression Analysis; Semen Analysis; Spain; Young Adult,2014-07-24,2014,2014-07-24,2014-09,27,9,1930-1938,All OA; Bronze,Article,"Soler, C.; Kekäläinen, J.; Núñez, M.; Sancho, M.; Álvarez, J. G.; Núñez, J.; Yaber, I.; Gutiérrez, R.","Soler, C. (Departament de Biologia Funcional i Antropologia Física Universitat de València Burjassot Spain); Kekäläinen, J. (Centre for Evolutionary Biology School of Animal Biology University of Western Australia Crawley WA Australia; Department of Biology University of Eastern Finland Joensuu Finland); Núñez, M. (Departament de Biologia Funcional i Antropologia Física Universitat de València Burjassot Spain); Sancho, M. (Departament de Biologia Funcional i Antropologia Física Universitat de València Burjassot Spain); Álvarez, J. G. (Centro de Infertilidad Masculina ANDROGEN A Coruña Spain); Núñez, J. (Departament de Biologia Funcional i Antropologia Física Universitat de València Burjassot Spain); Yaber, I. (Facultad de Ciencias Básicas Universidad Tecnológica de Bolívar Cartagena Colombia); Gutiérrez, R. (División de Ciencias Básicas Departamento de Química y Biología Universidad del Norte Barranquilla Colombia; Departament de Biologia Funcional i Antropologia Física Universitat de València Burjassot Spain)","Soler, C. (University of Valencia); Kekäläinen, J. (University of Western Australia; University of Eastern Finland); Gutiérrez, R. (Universidad del Norte; University of Valencia)","Soler, C. (University of Valencia); Kekäläinen, J. (University of Western Australia; University of Eastern Finland); Núñez, M. (University of Valencia); Sancho, M. (University of Valencia); Álvarez, J. G. (Centro de Infertilidad Masculina ANDROGEN A Coruña Spain); Núñez, J. (University of Valencia); Yaber, I. (Universidad Tecnológica de Bolívar); Gutiérrez, R. (Universidad del Norte; University of Valencia)",16,3,0.27,1.91,https://onlinelibrary.wiley.com/doi/pdfdirect/10.1111/jeb.12446,https://app.dimensions.ai/details/publication/pub.1044241801,31 Biological Sciences; 3103 Ecology; 3104 Evolutionary Biology; 3109 Zoology,
5295,pub.1056225849,10.1021/nn406532z,24400916,,Quantitative Chemistry and the Discrete Geometry of Conformal Atom-Thin Crystals,"When flat or on a firm mechanical substrate, the atomic composition and atomistic structure of two-dimensional crystals dictate their chemical, electronic, optical, and mechanical properties. These properties change when the two-dimensional and ideal crystal structure evolves into arbitrary shapes, providing a direct and dramatic link among geometry and material properties due to the larger structural flexibility when compared to bulk three-dimensional materials. We describe methods to understand the local geometrical information of two-dimensional conformal crystals quantitatively and directly from atomic positions, even in the presence of atomistic defects. We then discuss direct relations among the discrete geometry and chemically relevant quantities--mean bond lengths, hybridization angles, and σ-π hybridization. These concepts are illustrated for carbon-based materials and ionic crystals. The pyramidalization angle turns out to be linearly proportional to the mean curvature for relevant crystalline configurations. Discrete geometry provides direct quantitative information on the potential chemistry of conformal two-dimensional crystals.",We thank NSF-XSEDE TACC’s Stampede (Grant TG-PHY090002) and Arkansas (Razor II) for computational support.,,ACS Nano,,,,2014-01-13,2014,2014-01-13,2014-02-25,8,2,1136-1146,All OA; Green,Article,"Pacheco Sanjuan, Alejandro A.; Mehboudi, Mehrshad; Harriss, Edmund O.; Terrones, Humberto; Barraza-Lopez, Salvador","Pacheco Sanjuan, Alejandro A. (Department of Physics, University of Arkansas, Fayetteville, Arkansas 72701, United States; Department of Mechanical Engineering, Universidad del Norte, Barranquilla, Colombia); Mehboudi, Mehrshad (Department of Physics, University of Arkansas, Fayetteville, Arkansas 72701, United States); Harriss, Edmund O. (Department of Mathematical Sciences, University of Arkansas, Fayetteville, Arkansas 72701, United States); Terrones, Humberto (Department of Physics and Center for 2-Dimensional and Layered Materials, The Pennsylvania State University, University Park Pennsylvania 16802, United States); Barraza-Lopez, Salvador (Department of Physics, University of Arkansas, Fayetteville, Arkansas 72701, United States)","Barraza-Lopez, Salvador (University of Arkansas at Fayetteville)","Pacheco Sanjuan, Alejandro A. (University of Arkansas at Fayetteville; Universidad del Norte); Mehboudi, Mehrshad (University of Arkansas at Fayetteville); Harriss, Edmund O. (University of Arkansas at Fayetteville); Terrones, Humberto (Pennsylvania State University); Barraza-Lopez, Salvador (University of Arkansas at Fayetteville)",28,0,0.36,4.36,https://arxiv.org/pdf/1401.2698,https://app.dimensions.ai/details/publication/pub.1056225849,34 Chemical Sciences; 3403 Macromolecular and Materials Chemistry; 51 Physical Sciences; 5104 Condensed Matter Physics,
5106,pub.1004074861,10.1111/apa.12692,24838096,PMC4225465,Safe oxygen saturation targeting and monitoring in preterm infants: can we avoid hypoxia and hyperoxia?,"Oxygen is a neonatal health hazard that should be avoided in clinical practice. In this review, an international team of neonatologists and nurses assessed oxygen saturation (SpO2 ) targeting in preterm infants and evaluated the potential weaknesses of randomised clinical trials.
CONCLUSION: SpO2 of 85-89% can increase mortality and 91-95% can cause hyperoxia and ill effects. Neither of these ranges can be recommended, and wider intermediate targets, such as 87-94% or 88-94%, may be safer.",Acknowledgements The authors are very grateful to Annette Whibley for her extensive effort and commitment to review and improve the English language of this manuscript.,,Acta Paediatrica,,,"Humans; Hyperoxia; Hypoxia; Infant, Newborn; Infant, Premature; Intensive Care, Neonatal; Monitoring, Physiologic; Oxygen; Randomized Controlled Trials as Topic",2014-07-28,2014,2014-07-28,2014-10,103,10,1009-1018,All OA; Hybrid,Article,"Sola, Augusto; Golombek, Sergio G; Bueno, María Teresa Montes; Lemus-Varela, Lourdes; Zuluaga, Claudia; Domínguez, Fernando; Baquero, Hernando; Sarmiento, Alejandro E Young; Natta, Diego; Perez, Jose M Rodriguez; Deulofeut, Richard; Quiroga, Ana; Flores, Gabriel Lara; Morgues, Mónica; Pérez, Alfredo García-Alix; Van Overmeire, Bart; van Bel, Frank","Sola, Augusto (Ibero American Society of Neonatology (SIBEN), Dana Point, CA, USA; New York Medical College, Valhalla, NY, USA); Golombek, Sergio G (Ibero American Society of Neonatology (SIBEN), Dana Point, CA, USA; New York Medical College, Valhalla, NY, USA; Maria Fareri Children's Hospital at Westchester Medical Center, Valhalla, NY, USA); Bueno, María Teresa Montes (Nursing Council, SIBEN, Hospital La Paz, Madrid, Spain); Lemus-Varela, Lourdes (Ibero American Society of Neonatology (SIBEN), Dana Point, CA, USA; Hospital de Pediatría del Centro Médico Nacional de Occidente, IMSS, Guadalajara, Jalisco, México); Zuluaga, Claudia (Pediatric Ophthalmology, Universidad del Valle, Cali, Colombia); Domínguez, Fernando (Ibero American Society of Neonatology (SIBEN), Dana Point, CA, USA; Pediatrics, Hospital González Coro, Universidad De La Habana, Habana, Cuba); Baquero, Hernando (Ibero American Society of Neonatology (SIBEN), Dana Point, CA, USA; Neonatology Department, Universidad del Norte, Barranquilla, Colombia); Sarmiento, Alejandro E Young (Ibero American Society of Neonatology (SIBEN), Dana Point, CA, USA; Neonatal ICU, Hospital Escuela Universitario, Tegucigalpa, Honduras); Natta, Diego (Ibero American Society of Neonatology (SIBEN), Dana Point, CA, USA; Pediatrics, Hospital Privado de la Comunidad, Mar del Plata, Argentina); Perez, Jose M Rodriguez (Ibero American Society of Neonatology (SIBEN), Dana Point, CA, USA; Stella Maris Hospital, International Neurodevelopment Neonatal Center (CINN), Sao Paulo, Brazil); Deulofeut, Richard (Neonatology, Pediatrix Medical Group North Dallas Practice, Dallas, TX, USA); Quiroga, Ana (Nursing Council of SIBEN, Universidad Austral, Buenos Aires, Argentina); Flores, Gabriel Lara (Ibero American Society of Neonatology (SIBEN), Dana Point, CA, USA; Neonatology, Hospital Ginecología-Obstetricia 4 IMSS, Mexico City, Mexico); Morgues, Mónica (Ibero American Society of Neonatology (SIBEN), Dana Point, CA, USA; Pediatrics and Neonatology, Master in Epidemiology, University of Chile, North Campus, Santiago, Chile); Pérez, Alfredo García-Alix (Hospital Sant Joan de Déu, Pediatrics, Barcelona University, Barcelona, Spain); Van Overmeire, Bart (Neonatology, Erasme University, Brussels, Belgium); van Bel, Frank (Perinatal Center, University Medical Center Utrecht, Utrecht, The Netherlands)","Sola, Augusto (Ibero American Society of Neonatology (SIBEN), Dana Point, CA, USA; New York Medical College)","Sola, Augusto (Ibero American Society of Neonatology (SIBEN), Dana Point, CA, USA; New York Medical College); Golombek, Sergio G (Ibero American Society of Neonatology (SIBEN), Dana Point, CA, USA; New York Medical College; Maria Fareri Children's Hospital); Bueno, María Teresa Montes (Hospital Universitario La Paz); Lemus-Varela, Lourdes (Ibero American Society of Neonatology (SIBEN), Dana Point, CA, USA; Mexican Social Security Institute); Zuluaga, Claudia (University of Valle); Domínguez, Fernando (Ibero American Society of Neonatology (SIBEN), Dana Point, CA, USA; University of Havana); Baquero, Hernando (Ibero American Society of Neonatology (SIBEN), Dana Point, CA, USA; Universidad del Norte); Sarmiento, Alejandro E Young (Ibero American Society of Neonatology (SIBEN), Dana Point, CA, USA; Neonatal ICU, Hospital Escuela Universitario, Tegucigalpa, Honduras); Natta, Diego (Ibero American Society of Neonatology (SIBEN), Dana Point, CA, USA; Hospital Privado de Comunidad); Perez, Jose M Rodriguez (Ibero American Society of Neonatology (SIBEN), Dana Point, CA, USA; Stella Maris Hospital, International Neurodevelopment Neonatal Center (CINN), Sao Paulo, Brazil); Deulofeut, Richard (Neonatology, Pediatrix Medical Group North Dallas Practice, Dallas, TX, USA); Quiroga, Ana (Austral University); Flores, Gabriel Lara (Ibero American Society of Neonatology (SIBEN), Dana Point, CA, USA; Mexican Social Security Institute); Morgues, Mónica (Ibero American Society of Neonatology (SIBEN), Dana Point, CA, USA; University of Chile); Pérez, Alfredo García-Alix (Hospital Sant Joan de Déu, Pediatrics, Barcelona University, Barcelona, Spain); Van Overmeire, Bart (Neonatology, Erasme University, Brussels, Belgium); van Bel, Frank (University Medical Center Utrecht)",108,19,3.25,27.83,https://onlinelibrary.wiley.com/doi/pdfdirect/10.1111/apa.12692,https://app.dimensions.ai/details/publication/pub.1004074861,32 Biomedical and Clinical Sciences; 3213 Paediatrics,3 Good Health and Well Being
3759,pub.1053289482,10.1002/ajpa.22614,25234247,,"Coastal, valley, and oasis interaction: Impact on the evolution of ancient populations in the South Central Andes","The existing biocultural links are analyzed among ancient inhabitants of the Cochabamba valleys (Bolivia) from the Formative and Tiwanaku periods, coastal and inland Azapa region (Chile) from the Late Archaic to the Late periods, and the Atacama Desert oases (Chile) from the Formative period to the time of European contact. Craniometric information obtained from a sample of 565 individuals from different sites of the studied regions was evaluated using methods derived from quantitative genetics and multivariate statistical analysis techniques. It is shown that during the Formative and Tiwanaku periods inhabitants of the Cochabamba valleys maintained contact with the population of northern Chile. This contact was more fluid with the people from the interior valley of Azapa than it was with the settlers of San Pedro Atacama (SPA). An important biological affinity in the Late Period between the inhabitants of the Azapa valley and the late SPA groups is also examined. The Late-Inca Catarpe SPA sample shows a broad genetic variability shared with the majority of the groups studied. The results reaffirm the differences between the coastal and interior Azapa valley groups and strengthen the hypothesis of two pathways to populating the south central Andean area. The divergence observed among subpopulations can be explained by the spatiotemporal dispersion between them, genetic drift dispersion compensated by the action of gene flow, and cultural norms that regulate within group mating.","The authors wish to thank the directors and personnel of several museums (RP Gustavo Le Paige Archaeological San Pedro de Atacama and Archaeological and Anthropological de San Miguel de Azapa de Arica in Chile and el Museo Arqueológico de Cochabamba and Sucre, Bolivia) for the assistance during our times working there. We would also like to acknowledge the assistance of Julian Valetti in developing the images, and Ingrid Carlstein for translation assistance. The authors thank the editors and reviewers for their comments and suggestions.",,American Journal of Biological Anthropology,,,"Adult; Anthropology, Physical; Archaeology; Biological Evolution; Chile; Female; Gene Flow; Genetic Drift; History, Ancient; Human Migration; Humans; Indians, South American; Male; Multivariate Analysis; Phenotype; Skull",2014-09-19,2014,2014-09-19,2014-12,155,4,591-599,All OA; Green,Article,"Varela, Héctor H.; Cocilovo, Jose A.; Fuchs, María L.; O'Brien, Tyler G.","Varela, Héctor H. (Departamento de Ciencias Naturales, Facultad de Ciencias Exactas, Físico‐Química y Naturales, Universidad Nacional de Río Cuarto, 5800, Río Cuarto, Argentina); Cocilovo, Jose A. (Departamento de Ciencias Naturales, Facultad de Ciencias Exactas, Físico‐Química y Naturales, Universidad Nacional de Río Cuarto, 5800, Río Cuarto, Argentina); Fuchs, María L. (Departamento de Ciencias Naturales, Facultad de Ciencias Exactas, Físico‐Química y Naturales, Universidad Nacional de Río Cuarto, 5800, Río Cuarto, Argentina); O'Brien, Tyler G. (Department of Sociology, Anthropology and Criminology, University of Northern Iowa, Cedar Falls, IA)","Varela, Héctor H. (National University of Río Cuarto)","Varela, Héctor H. (National University of Río Cuarto); Cocilovo, Jose A. (National University of Río Cuarto); Fuchs, María L. (National University of Río Cuarto); O'Brien, Tyler G. (University of Northern Iowa)",5,0,0.06,1.05,https://ri.conicet.gov.ar/bitstream/11336/100026/2/CONICET_Digital_Nro.98201603-6f3c-48c7-b2b4-b69d2fa55e37_A.pdf,https://app.dimensions.ai/details/publication/pub.1053289482,"31 Biological Sciences; 3105 Genetics; 43 History, Heritage and Archaeology; 4301 Archaeology; 44 Human Society; 4401 Anthropology",
