366,pub.1009999107,10.1088/1742-6596/134/1/012003,,,Speed of quantum evolution of entangled two qubits states: Local vs. global evolution,"There is a lower bound for the 'speed' of quantum evolution as measured by the time needed to reach an orthogonal state. We show that, for two-qubits systems, states saturating the quantum speed limit tend to exhibit a small amount of local evolution, as measured by the fidelity between the initial and final single qubit states after the time τ required by the composite system to reach an orthogonal state. Consequently, a trade-off between the speed of global evolution and the amount of local evolution seems to be at work.",,,Journal of Physics Conference Series,,,,2008-11-01,2008,2008-11-10,2008-11-01,134,1,012003,All OA; Gold,Article,"Curilef, S; Zander, C; Plastino, A R","Curilef, S (Departamento de Física, Universidad Católica del Norte, Antofagasta, Chile); Zander, C (Physics Department, University of Pretoria, Pretoria 0002, South Africa); Plastino, A R (Physics Department, University of Pretoria, Pretoria 0002, South Africa)",,"Curilef, S (Catholic University of the North); Zander, C (University of Pretoria); Plastino, A R (University of Pretoria)",2,0,,0.5,https://iopscience.iop.org/article/10.1088/1742-6596/134/1/012003/pdf,https://app.dimensions.ai/details/publication/pub.1009999107,"51 Physical Sciences; 5102 Atomic, Molecular and Optical Physics; 5108 Quantum Physics",
366,pub.1032079508,10.4067/s0718-40262008000200013,,,Diverticulitis apendicular como causa de apendicectoma: Reporte de un caso,"Introduccin: La incidencia de diverticulitis apendicular es de 0,004% a 2,1% en diferentes series. Reporte de caso: Paciente masculino de 30 aos de edad que consulta por un cuadro de 7 das de evolucin con dolor abdominal localizado en la fosa ilaca derecha. Con el diagnstico de apendicitis aguda es sometido a apendicectoma encontrndose un apndice inflamado en la punta y cubierto de fibrina. A la histologa se observa un divertculo apendicular edematoso e infiltrado por polimorfonucleares y peritonitis periapendicular. La pared del apndice se encuentra sin signos inflamatorios y el lumen es de dimetro normal. El paciente evoluciona sin complicaciones en el postoperatorio y es dado de alta en buenas condiciones. Discusin: La diverticulitis apendicular se manifiesta con dolor abdominal insidioso que puede preceder hasta en 14 das a la ciruga. Algunos pacientes mencionan episodios de dolor previo similares al actual. La ecografa y la tomografa abdominal son inespecficas para el diagnstico, y el tratamiento es el mismo de la apendicitis: la apendicectoma. Debido a que el tratamiento es tardo comparado con la apendicitis aguda, los pacientes que sufren de diverticulitis apendicular tienen una mayor incidencia de complicaciones en el postoperatorio. Nuestro paciente present algunas de estas caractersticas y curs un postoperatorio sin complicaciones The incidence of appendiceal diverticulitis varies from 0.004% to 2.1% in different series. We report a 30 years old male that consulted for 7 days of abdominal pain located at the right lower quadrant. He was operated with the diagnosis of acute appendicitis. During surgery, a distally inflamed appendix covered with fibrin was observed. Pathology reported an edematous diverticulum infiltrated by polymorphonuclear cells and periappendiceal peritonitis. The appendiceal wall was normal and the appendiceal lumen diameter was preserved. Postoperative evolution was uneventful and the patient was discharged in good conditions. Appendiceal diverticulitis manifest as insidious abdominal pain lasting 1 to 14 days before surgery. Some patients had previous episodes of pain. Abdominal ultrasound and computed tomography are unspecific for the diagnosis of appendiceal diverticulitis and the treatment is just the same as for acute appendicitis: appendectomy",,,Revista Chilena de Cirugía,,,,2008-04,2008,2008-04,,60,2,154-157,All OA; Gold,Article,"BARRA, CARLOS; PUJADO, BLAZENKO; ZEPEDA, NELSON; BELTRN, MARCELO A","BARRA, CARLOS (Hospital de La Serena Unidad de Patologa, Chile); PUJADO, BLAZENKO (Hospital de La Serena Servicio de Ciruga, Chile); ZEPEDA, NELSON (Universidad Catlica del Norte Sede La Serena, Chile); BELTRN, MARCELO A (Hospital de La Serena Servicio de Ciruga, Chile; Universidad Catlica del Norte Sede La Serena, Chile)",,"BARRA, CARLOS (Hospital la Serena); PUJADO, BLAZENKO (Hospital la Serena); ZEPEDA, NELSON (Catholic University of the North); BELTRN, MARCELO A (Hospital la Serena; Catholic University of the North)",4,0,,1.47,http://www.scielo.cl/pdf/rchcir/v60n2/art13.pdf,https://app.dimensions.ai/details/publication/pub.1032079508,"47 Language, Communication and Culture; 4704 Linguistics",
358,pub.1072129069,10.4028/www.scientific.net/msf.591-593.477,,,"Mineral Constituents of a Clay from Campos dos Goytacazes, Brazil","The mineral constituents of a typical clay from Campos dos Goytacazes, Brazil, were investigated in terms of their nature and morphology by analytical methods including transmission electron microscopy and energy dispersive spectroscopy. The clay was found to have a large amount of finer, < 2 μm, aluminumsilicate particles of kaolinite and, in smaller proportion, halloysite, which is also an aluminumsilicate. At 1050oC the clay shows a consolidated structure with continuous glassy matrix in which Ti, Fe and Si oxides as well as mullite crystals are thoroughly embedded.",,,Materials Science Forum,,,,2008-08,2008,2008-08,2008-10-03,591-593,,477-481,Closed,Article,"Terrones, L.A.H.; Rocha, Ana L.A.; Vieira, Carlos Maurício Fontes; Monteiro, Sérgio Neves","Terrones, L.A.H. (State University of North Fluminense - UENF, LAMAV - Advanced Materials Laboratory, Rio de Janeiro, Brazil, Avenue Alberto Lamego, 2000, Parque Califórnia, 28013-602); Rocha, Ana L.A. (Catholic University of Rio de Janeiro - PUC-RIO, Department of Materials Science and Metallurgy, Rio de Janeiro-RJ, Brazil, R. Marquês de São Vicente, 225, Gávea, 22453-900); Vieira, Carlos Maurício Fontes (State University of North Fluminense - UENF, LAMAV - Advanced Materials Laboratory, Rio de Janeiro, Brazil, Avenue Alberto Lamego, 2000, Parque Califórnia, 28013-602); Monteiro, Sérgio Neves (Universidade Estadual do Norte Fluminense, Centro de Ciências e Tecnologia, Lamego, Brazil, Avenue Alberto Lamego 2000, 28013-602)",,"Terrones, L.A.H. (State University of Norte Fluminense); Rocha, Ana L.A. (Pontifical Catholic University of Rio de Janeiro); Vieira, Carlos Maurício Fontes (State University of Norte Fluminense); Monteiro, Sérgio Neves (State University of Norte Fluminense)",3,1,,0.56,,https://app.dimensions.ai/details/publication/pub.1072129069,40 Engineering; 4019 Resources Engineering and Extractive Metallurgy,
358,pub.1043932373,10.1016/j.colsurfa.2008.07.042,,,Measurement of flow visualized on surface of bubble blown in air,Bubbles blown in surfactant (frother) solution reveal surface flows attributed to gravity drainage and opposing Marangoni Effect. A technique is introduced to visualize the flows and estimate trajectory velocity. The flow pattern and velocity depend on frother type (pentanol vs. a polyglycol) and concentration but no correlation with surface tension was found. The relevance of the observations to the action of frother in flotation is briefly discussed.,"AcknowledgementsThe work was funded through the Mineral Processing Chair Renewal program, co-sponsored (2008) by Vale Inco, Teck Cominco, Xstrata Process Support, Agnico-Eagle, Shell Canada, Corem, SGS Lakefield Research and Flottec through an NSERC (Natural Sciences and Engineering Research Council of Canada) CRD (Collaborative Research and Development) grant. C. Acuna also acknowledges the scholarship from Universidad Católica del Norte and MECESUP project UCN104 (2003–2006).",,Colloids and Surfaces A Physicochemical and Engineering Aspects,,,,2008-12,2008,,2008-12,330,2-3,112-115,Closed,Article,"Acuña, C.A.; Radman, J.; Finch, J.A.","Acuña, C.A. (Chemical Engineering Department, Universidad Católica del Norte, Antofagasta, Chile); Radman, J. (Department of Mining and Materials Engineering, McGill University, Montreal, QC, Canada); Finch, J.A. (Department of Mining and Materials Engineering, McGill University, Montreal, QC, Canada)","Finch, J.A. (McGill University)","Acuña, C.A. (Catholic University of the North); Radman, J. (McGill University); Finch, J.A. (McGill University)",2,0,,0.24,,https://app.dimensions.ai/details/publication/pub.1043932373,34 Chemical Sciences; 3406 Physical Chemistry; 40 Engineering; 4019 Resources Engineering and Extractive Metallurgy,
358,pub.1072129068,10.4028/www.scientific.net/msf.591-593.471,,,Characterization of Granulometric Fractions of Ash from Boiler Burnt Sugarcane Bagasse,"In the municipal area of Campos dos Goytacazes–RJ several ceramic industries are involved with a significant production of bricks and tiles. These ceramic products can serve as matrices for the incorporation of industrial residues such as the ash of sugarcane bagasse used as fuel in the boilers of the sugar and alcohol plants. The incorporation of ashes in ceramics is a solution that eventually can cause an improvement on the properties of the material. The objective of this work is to characterize granulometric fractions of sugarcane bagasse ash with particle sizes less than 149, 75 and 44 μm aiming at the ash incorporation into red ceramics. Chemical, mineralogical and microstructural characterization were carried out in the granulometric fractions. The results showed that the granulometric fractions present as main crystalline phase the cristobalite and that the ashes with smaller particle sizes can improve the densification of the ceramic body by the formation of more liquid phase during firing, due to the presence of less silica and more alkaline- and alkaline-earth oxides than the original ash.",,,Materials Science Forum,,,,2008-08,2008,2008-08,2008-10-03,591-593,,471-476,Closed,Article,"Gadioli, Monica Castoldi Borlini; Vieira, Carlos Maurício Fontes; Rodríguez, Rubén Jesus Sánchez; Conte, R.A.; Pinatti, Daltro Garcia; Monteiro, Sérgio Neves","Gadioli, Monica Castoldi Borlini (Mineral Technology Center – CETEM/MCT, Advanced Campus of Cachoeiro de Itapemirim - CACI, Morro Grande, Cachoeiro de Itapemirim, ES, Brazil, Rodovia Cachoeiro-Alegre, km 05, Bloco 10, 29300-970); Vieira, Carlos Maurício Fontes (State University of North Fluminense - UENF, LAMAV - Advanced Materials Laboratory, Rio de Janeiro, Brazil, Avenue Alberto Lamego, 2000, Parque Califórnia, 28013-602); Rodríguez, Rubén Jesus Sánchez (State University of North Fluminense - UENF, LAMAV - Advanced Materials Laboratory, Rio de Janeiro, Brazil, Avenue Alberto Lamego, 2000, Parque Califórnia, 28013-602); Conte, R.A. (Faculdade de Engenharia Química de Lorena-FAENQUIL, Departamento de Engenharia de Materiais-DEMAR, Lorena, Brazil, Caixa Postal 116, 12600-000 SP); Pinatti, Daltro Garcia (Faculdade de Engenharia Química de Lorena-FAENQUIL, Departamento de Engenharia de Materiais-DEMAR, Lorena, Brazil, Caixa Postal 116, 12600-000 SP); Monteiro, Sérgio Neves (Universidade Estadual do Norte Fluminense, Centro de Ciências e Tecnologia, Lamego, Brazil, Avenue Alberto Lamego 2000, 28013-602)",,"Gadioli, Monica Castoldi Borlini (Mineral Technology Center – CETEM/MCT, Advanced Campus of Cachoeiro de Itapemirim - CACI, Morro Grande, Cachoeiro de Itapemirim, ES, Brazil, Rodovia Cachoeiro-Alegre, km 05, Bloco 10, 29300-970); Vieira, Carlos Maurício Fontes (State University of Norte Fluminense); Rodríguez, Rubén Jesus Sánchez (State University of Norte Fluminense); Conte, R.A. (Faculdade de Engenharia Química de Lorena-FAENQUIL, Departamento de Engenharia de Materiais-DEMAR, Lorena, Brazil, Caixa Postal 116, 12600-000 SP); Pinatti, Daltro Garcia (Faculdade de Engenharia Química de Lorena-FAENQUIL, Departamento de Engenharia de Materiais-DEMAR, Lorena, Brazil, Caixa Postal 116, 12600-000 SP); Monteiro, Sérgio Neves (State University of Norte Fluminense)",2,1,,0.54,,https://app.dimensions.ai/details/publication/pub.1072129068,33 Built Environment and Design; 3302 Building; 40 Engineering,
358,pub.1037305088,10.1016/j.materresbull.2007.03.009,,,"EuCuOSe: Crystal structure refinement, electrical and magnetic properties","The europium copper oxyselenide EuCuOSe has been prepared by reacting Eu, CuO and Se in the ratio 1:1:1 at 1123K for a period of 10 days in sealed quartz ampoule. The structure has been determined by single-crystal X-ray methods. The compound crystallizes tetragonal in the space group P4/nmm (no. 129) with two formula units in the cell with dimensions a=393.65(8)pm and c=871.80(17)pm. The structure is composed of {[(Eu3+)(O2−)4/4(Se2−)4/4]−}∞2 double layers separated by copper atoms, which are tetrahedrally coordinated to Se2− anions. According to the resistivity measurements, EuCuOSe is a semiconductor. The magnetic susceptibility data shows the typical non-Curie–Weiss behavior of the 7FJ states of Eu in the 4f6 configuration.","AcknowledgementsThis work was supported by FONDECYT-CHILE (Grants 1050994 and 1020440). Authors thank also Dr. Raul Cardoso-Gil (Max Planck Institut fuer Chemische Physik fester Stoffe, Dresden, Germany) for the X-ray measurements, and Dr. Walter Schnelle (Max Planck Institut fuer Chemische Physik fester Stoffe, Dresden, Germany) for magnetic measurements and for helpful discussions.",,Materials Research Bulletin,,,,2008-02,2008,,2008-02,43,2,320-325,Closed,Article,"Llanos, Jaime; Cortés, Rodrigo; Sánchez, Víctor","Llanos, Jaime (Departamento de Química, Universidad Católica del Norte, Avda. Angamos 0610, Casilla 1280, Antofagasta, Chile); Cortés, Rodrigo (Departamento de Química, Universidad Católica del Norte, Avda. Angamos 0610, Casilla 1280, Antofagasta, Chile); Sánchez, Víctor (Departamento de Química, Universidad Católica del Norte, Avda. Angamos 0610, Casilla 1280, Antofagasta, Chile)","Llanos, Jaime (Catholic University of the North)","Llanos, Jaime (Catholic University of the North); Cortés, Rodrigo (Catholic University of the North); Sánchez, Víctor (Catholic University of the North)",6,1,,0.85,,https://app.dimensions.ai/details/publication/pub.1037305088,34 Chemical Sciences; 3402 Inorganic Chemistry,
358,pub.1106165023,10.22199/s07189753.2008.0002.00008,,,"EMBID IRUJO, ANTONIO.:","EMBID IRUJO, ANTONIO/ DE ALENCAR XAVIER, YANKO MARCIUS/SILVEIRA NETO, OTACÍLIO Dos SANTOS. Directores (2008). El Derecho de Aguas en Brasil y España. Un estudio de Derecho Comparado. Cizur Menor: Aranzadi, 356 pp.",,,Revista de derecho (Coquimbo),,,,2008-01-01,2008,2008-12-30,2008-01-01,15,2,203-208,All OA; Gold,Article,"Calderón, Christian Rojas","Calderón, Christian Rojas (Universidad Católica del Norte)",,"Calderón, Christian Rojas (Catholic University of the North)",0,0,,,https://revistaderecho.ucn.cl/index.php/revista-derecho/article/download/2911/2730,https://app.dimensions.ai/details/publication/pub.1106165023,,
358,pub.1008783890,10.1017/s1446181108000187,,,EXPANSION IN BELL POLYNOMIALS OF THE DISTRIBUTION OF THE TOTAL CLAIM AMOUNT WITH WEIBULL-DISTRIBUTED CLAIM SIZES,"Abstract
                  The total claim amount for a fixed period of time is, by definition, a sum of a random number of claims of random size. In this paper we explore the probabilistic distribution of the total claim amount for claims that follow a Weibull distribution, which can serve as a satisfactory model for both small and large claims. As models for the number of claims we use the geometric, Poisson, logarithmic and negative binomial distributions. In all these cases, the densities of the total claim amount are obtained via Laplace transform of a density function, an expansion in Bell polynomials of a convolution and a subsequent Laplace inversion.",,,The ANZIAM Journal,,,,2008-04-01,2008,2008-04-01,2008-04,49,4,495-501,All OA; Bronze,Article,"LACAYO, RAMON","LACAYO, RAMON (Escuela de Ingeniería Comercial, Universidad Católica del Norte, Larrondo 1281, Coquimbo, Chile, (email:, rlacayo@ucn.cl, ))",,"LACAYO, RAMON (Catholic University of the North)",0,0,,0.0,https://www.cambridge.org/core/services/aop-cambridge-core/content/view/C0585988F5414DEEDC9037EC25522EB4/S1446181108000187a.pdf/div-class-title-expansion-in-bell-polynomials-of-the-distribution-of-the-total-claim-amount-with-weibull-distributed-claim-sizes-div.pdf,https://app.dimensions.ai/details/publication/pub.1008783890,49 Mathematical Sciences; 4901 Applied Mathematics; 4905 Statistics,
353,pub.1003324887,10.1515/iabi.2008.034,,,Index of Other Names and Special Terms 2008,,,,International African Bibliography (IAB),,,,2008-12-01,2008,2009-07-07,2008-12-01,38,4,365-393,Closed,Article,,,,,0,0,,,,https://app.dimensions.ai/details/publication/pub.1003324887,,
352,pub.1031181341,10.1080/02582470802417557,,,Challenges to Repatriation and Preservation of Tangible Heritage in South Africa: Black Art and the Experiences of the Ifa Lethu Foundation,"This article argues that there are serious challenges to be faced in the repatriation and preservation of tangible heritage-township art. (Potential) problems faced by Ifa Lethu Foundation in the collection and preservation of artworks are sketched, and the Fort Hare experience in the repatriation of the African National Congress (ANC) archival material is examined as a case study. Although the repatriation of ANC material was a relatively successful initiative, the repatriation of black artwork presents greater challenges.",,,South African Historical Journal,,,,2008-09,2008,,2008-09,60,3,500-513,Closed,Article,"Maaba, Brown Bavusile","Maaba, Brown Bavusile (Ifa Lethu Foundation)",,"Maaba, Brown Bavusile (Ifa Lethu Foundation)",3,2,,1.49,,https://app.dimensions.ai/details/publication/pub.1031181341,"43 History, Heritage and Archaeology; 4302 Heritage, Archive and Museum Studies",
351,pub.1046630170,10.1016/j.materresbull.2007.10.023,,,"Preparation, characterization and luminescence of La2TeO6 phosphor doped with Eu3+","Phosphors of La2TeO6 doped with Eu3+ ions have been synthesized by the oxidation of the corresponding rare-earths oxytellurides of formula La2−xEuxO2Te (x=0.02, 0.06, and 0.1) at 1050K. Powder X-ray diffraction confirms that the as prepared materials consist of the orthorhombic La2TeO6 as main phase. The photoluminescence (PL) of red-emitting La2−xEuxTeO6 powder phosphors is reported. The emission spectrum, exhibits an intense emission peak due to 5D0→7F2 transition at 616nm, which indicates that the Eu3+ ion occupies a non-centrosymmetric site in the host lattice. These materials could find application for use as lamp phosphors in the red region.",AcknowledgmentThis work was supported by FONDECYT-CHILE (Grant 1050994).,,Materials Research Bulletin,,,,2008-10,2008,,2008-10,43,10,2763-2768,Closed,Article,"Llanos, Jaime; Cortes, Rodrigo","Llanos, Jaime (Departamento de Química, Universidad Católica del Norte, Avda. Angamos 0610, Casilla 1280, Antofagasta, Chile); Cortes, Rodrigo (Departamento de Química, Universidad Católica del Norte, Avda. Angamos 0610, Casilla 1280, Antofagasta, Chile)","Llanos, Jaime (Catholic University of the North)","Llanos, Jaime (Catholic University of the North); Cortes, Rodrigo (Catholic University of the North)",9,0,,1.27,,https://app.dimensions.ai/details/publication/pub.1046630170,34 Chemical Sciences; 3402 Inorganic Chemistry,
351,pub.1103981959,10.21608/ejabf.2008.2010,,,Redescription of the cestode Polyonchobothrium Clarias and its histopathological impact on the stomach of Clarias gariepinus,"This study was designed to redescribe the cestode Polyonchobothrium clarias that has been recovered from the stomach of Clarias gariepinus, in addition to the ultrastructure of the parasite and the histopathological changes of thestomach of Clarias gariepinus infected with this parasite. Samples of C.gariepinus were dissected and examined for parasites and prepared for SEM,while the stomach of the host was prepared for histological observations. Therewere significant differences between normal fish and infected ones, where the stomach of normal fish exhibited continuous mucosal layer with well developed tubules and ducts with little infiltration of lymphocytes, while a remarkabledamage was observed in the mucosal layer of the stomach of the infected fishwith excessive infiltration of lymphocytes in addition to excessive mucous secretion and subsequent fibrosis.This study has provided further information onPolyonchobothrium clarias that can reveal more information about host-parasite relationships, particularly its impact on the host fish.",,,Egyptian Journal of Aquatic Biology and Fisheries,,,,2008-09-01,2008,2008-09-01,2008-09-01,12,4,165-174,All OA; Gold,Article,"Ibrahim, Abdalla; Taha, Hoda; El-Naggar, Marwa","Ibrahim, Abdalla (); Taha, Hoda (); El-Naggar, Marwa ()",,"Ibrahim, Abdalla (); Taha, Hoda (); El-Naggar, Marwa ()",5,4,,0.48,https://ejabf.journals.ekb.eg/article_2010_cea59f4d5724c98acacf66cdc04ef2f2.pdf,https://app.dimensions.ai/details/publication/pub.1103981959,"30 Agricultural, Veterinary and Food Sciences; 3005 Fisheries Sciences",
350,pub.1054814003,10.1017/s0025315408001872,,,Aerobic and anaerobic enzymatic activities of Calyptogena gallardoi (Vesicomyidae): a clam associated with methane cold seeps off Chile,"Calyptogena gallardoi
                    is a recently described species of vesicomyid clam associated to the extensive gas-hydrate field reported for the Chilean margin along 35°S to 45°S. Enzymatic analysis in foot, gill and abductor muscle tissues of
                    C. gallardoi
                    collected in central-south Chile (~36°21′S 73°44′W), show high activities for malate dehydrogenase (MDH), strombine dehydrogenase (STRDH) and alanopine dehydrogenase (ALPDH) and a low activity of citrate synthase (CS) and ETS (electron transport system). Positive significant correlations (log–log scale) were found between enzymatic activities involved in anaerobic metabolism (MDH versus LDH and ALPDH versus STRDH), as well as between CS and opines dehydrogenases. The ratio MDH/LDH or any other opine dehydrogenase assayed was >> 1 in all tissues analysed. These results indicate that
                    C. gallardoi
                    is highly adapted to the harsh anaerobic conditions of marine chemosynthesis-based communities inhabiting a reduced environment.",,,Marine Biodiversity Records,,,,2008-07-25,2008,2008-07-25,2008-08,88,5,983-986,Closed,Article,"González, R.R.; Quiñones, R.A.; Quiroga, E.; Sellanes, J.","González, R.R. (Centro de Investigación Oceanográfica en el Pacífico Sur-Oriental (COPAS), Universidad de Concepción, Casilla 160C, Concepción, Chile; Departamento de Oceanografía, Facultad de Ciencias Naturales y Oceanográficas, Universidad de Concepción, Casilla 160C, Concepción, Chile); Quiñones, R.A. (Centro de Investigación Oceanográfica en el Pacífico Sur-Oriental (COPAS), Universidad de Concepción, Casilla 160C, Concepción, Chile; Departamento de Oceanografía, Facultad de Ciencias Naturales y Oceanográficas, Universidad de Concepción, Casilla 160C, Concepción, Chile); Quiroga, E. (Centro de Investigación en Ecosistemas de la Patagonia (CIEP), Bilbao 449, Coyhaique, Chile); Sellanes, J. (Centro de Investigación Oceanográfica en el Pacífico Sur-Oriental (COPAS), Universidad de Concepción, Casilla 160C, Concepción, Chile; Departamento de Biología Marina, Universidad Católica del Norte, Larrondo 1281, Coquimbo, Chile)","González, R.R. (University of Concepción; University of Concepción)","González, R.R. (University of Concepción; University of Concepción); Quiñones, R.A. (University of Concepción; University of Concepción); Quiroga, E. (Patagonian Ecosystems Investigation Research Center); Sellanes, J. (University of Concepción; Catholic University of the North)",2,0,,0.18,,https://app.dimensions.ai/details/publication/pub.1054814003,31 Biological Sciences; 3103 Ecology; 3108 Plant Biology; 3109 Zoology,
350,pub.1050698358,10.4067/s0718-00122008000100016,,,"COMENTARIO DE LA STC QUE DECLAR LA INAPLICABILIDAD DE LA EXPRESIN ""GRATUITAMENTE"" DEL ARTCULO 595, INC. I DEL CDIGO ORGNICO DE TRIBUNALES",,,,Ius et Praxis,,,,2008,2008,2008,,14,1,391-396,All OA; Gold,Article,"Torres, Fernando Orellana","Torres, Fernando Orellana (Universidad Catolica del Norte, Antofagasta, Chile)",,"Torres, Fernando Orellana (Catholic University of the North)",0,0,,0.0,http://www.scielo.cl/pdf/iusetp/v14n1/art16.pdf,https://app.dimensions.ai/details/publication/pub.1050698358,48 Law and Legal Studies; 4802 Environmental and Resources Law,
350,pub.1040588690,10.4067/s0718-00122008000200022,,,COMENTARIOS AL NUEVO PROCESO LABORAL,,,,Ius et Praxis,,,,2008,2008,2008,,14,2,667-670,All OA; Gold,Article,"Navarro, J. Bernardo Elgueta","Navarro, J. Bernardo Elgueta (Universidad Catlica del Norte, Coquimbo, Chile; Universidad Central, Chile; Universidad Santo Toms, Chile)",,"Navarro, J. Bernardo Elgueta (Catholic University of the North; Universidad Central de Chile; Universidad Santo Toms, Chile)",0,0,,,http://www.scielo.cl/pdf/iusetp/v14n2/art22.pdf,https://app.dimensions.ai/details/publication/pub.1040588690,,
