246,pub.1007055230,10.4067/s0718-19572014000200012,,,"Efecto de dietas en base a microalgas tradicionales, nativas y dietas artificiales sobre el crecimiento y supervivencia en larvas velgeras de la almeja taquilla, Mulinia edulis","Three sequential experiments were performed to assess the effect of 9 diets of traditionally used microalgae, native microalgae and artificial diets on the survival and growth rate of veliger larvae of the clam Mulinia edulis. Larvae were obtained from broodstock collected from natural banks in the Isla Grande de Chilo, Regin de Los Lagos, Chile. Diets were administrated as monospecific and mixed treatments. For traditional diets we used Isochrysis galbana (clone T) and Chaetoceros calcitrans; the mixed treatment (I.galbana/C.calcitrans) produced the greatest survival (13.6%) and daily growth rate (10.9 mm day-1). The native algae used were Chlamydomona sp. and the pennate diatom identified as ND2, isolated from the water column of a natural bank and the digestive tract of M. edulis, respectively. Both, the monospecific and mixed treatments with these 2 species produced 100% mortality. The experiment with artificial diet used a paste made from the diatom ND2 (PD) and a nutrient concentrate (NC) produced in a biodigestor. The treatments with NC and NC/PD produced 100% mortality, while withPD alone survival was 0.31% and the growth rate was 1.3 m day-1. The best results were obtained with a diet of the traditionally used microalgae; however, the effects of native microalgae and artificial diets should also be tested in the following stages of M. edulis, the post-larvae and seeds. Se realizaron 3 experimentos de manera secuencial para probar el efecto de 9 dietas basadas en microalgas tradicionales, microalgas nativas y dietas artificiales sobre la supervivencia y tasa de crecimiento en larvas velgeras de la almeja Mulinia edulis. Las larvas se obtuvieron de reproductores recolectados desde bancos naturales en la Isla Grande de Chilo, Regin de Los Lagos, Chile. Cada dieta fue suministrada como tratamiento monoespecfico y mixto. Para el experimento con microalgas tradicionales se utilizaron Isochrysis galbana (Clon T) y Chaetoceros calcitrans siendo el tratamiento mixto (I.galbana/C.calcitrans) la dieta con la cual se obtiene los mayores valores para la supervivencia (13,6%) y tasa diaria de crecimiento (10,9 mm da-1). Para el experimento con microalgas nativas se utilizaron las microalgas Chlamydomona sp. y una diatomea pennada (ND2), aisladas desde la columna de agua de un banco natural y del tracto digestivo de M. edulis, respectivamente. Tanto los tratamientos monoespecficos como el mixto generaron un 100% de mortalidad. Para el experimento con dietas artificiales se utilizaron una pasta de la diatomea ND2 (PD) y un concentrado nutritivo (CN) formulado mediante el uso de un biodigestor. Se obtuvo un 100% de mortalidad para los tratamientos CN y CN/PD, el tratamiento PD obtuvo una supervivencia de 0,31% y una tasa de crecimiento de 1,3 m da-1. Los resultados obtenidos indican que los mejores resultados se obtienen con las microalgas tradicionales, sin embargo, es necesario probar el efecto de las microalgas aisladas y dietas artificiales en las siguientes etapas del ciclo de vida de M. edulis, postlarvas y semillas.",,,Revista de biología marina y oceanografía,,,,2014-08,2014,2014-08,,49,2,339-349,All OA; Bronze,Article,"Vivanco, Giovanni; Oliva, Doris; Abarca, Alejandro","Vivanco, Giovanni (Universidad de Valparaso Facultad de Ciencias Instituto de Biologa, Centro de Investigacin y Gestin de los Recursos Naturales, Valparaso, Chile); Oliva, Doris (Universidad de Valparaso Facultad de Ciencias Instituto de Biologa, Centro de Investigacin y Gestin de los Recursos Naturales, Valparaso, Chile); Abarca, Alejandro (Universidad Catlica del Norte Facultad de Ciencias del Mar Programa de Magster en Acuicultura, Coquimbo, Chile)",,"Vivanco, Giovanni (University of Valparaíso); Oliva, Doris (University of Valparaíso); Abarca, Alejandro (Catholic University of the North)",3,0,,0.4,http://www.scielo.cl/pdf/revbiolmar/v49n2/art12.pdf,https://app.dimensions.ai/details/publication/pub.1007055230,"30 Agricultural, Veterinary and Food Sciences; 3005 Fisheries Sciences; 31 Biological Sciences",
245,pub.1056922513,10.1051/0004-6361/201424675,,,On the local dark matter density,"Context. In 2012, we applied a three-dimensional formulation to kinematic measurements of the Galactic thick disk and derived a surprisingly low dark matter density at the solar position. This result was challenged by Bovy & Tremaine (2012, ApJ, 756, 89), who claimed that the observational data are consistent with the expected local dark matter density if a one-dimensional approach is adopted. Aims. We aim at clarifying whether their work definitively explains our result by analyzing the assumption at the base of their formulation and their claim that this returns a lower limit for the local dark matter density, which is accurate within 20%. Methods. We find that the validity of their formulation depends on the underlying mass distribution. We therefore analyze the predictions that their hypothesis casts on the radial gradient of the azimuthal velocity ∂Rv̅ and compare it with observational data as a testbed for the validity of their formulation. Results. We find that their hypothesis requires too steep a profile of ∂Rv̅(Z), which is inconsistent with the observational data both in the Milky Way and in external galaxies. As a consequence, their results are biased and largely overestimate the mass density. Dynamical simulations also show that, contrary to their claims, low values of ∂Rv̅ are compatible with a Milky Way-like potential with radially constant circular velocity. We nevertheless confirm that, according to their criticism, our assumption ∂Rv̅ = 0 is only an approximation. If this hypothesis is released, and the available information about ∂Rv̅ in the thick disk is used, the resulting local dark matter density increases by a tiny amount, from 0 ± 1 to 2 ± 3 mM⊙ pc-3, with an upper limit of ~3.5 mM⊙ pc-3. Hence, this approximation has negligible influence on our results. Conclusions. Our analysis shows that their criticism is not a viable explanation for the inferred lack of dark matter at the solar position detected by us. More studies are required to understand these unexpected results.","R.A.M. acknowledges support from the Chilean Centro de Excelencia en Astrofísica y Tecnologías Afines (CATA) BASAL PFB/06, and by Project IC120009 “Millennium Institute of Astrophysics (MAS)” of the Iniciativa Científica Milenio del Ministerio de Economía, Fomento y Turismo de Chile. R.S. was financed by FONDECYT grant 3120135. Funding for SDSS-III has been provided by the Alfred P. Sloan Foundation, the Participating Institutions, the National Science Foundation, and the US Department of Energy Office of Science. R.A.M. acknowledges ESO/Chile for hosting him during his sabbatical leave.",,Astronomy & Astrophysics,,,,2014-12-23,2014,2014-12-23,2015-01,573,,a91,All OA; Bronze,Article,"Bidin, C. Moni; Smith, R.; Carraro, G.; Méndez, R. A.; Moyano, M.","Bidin, C. Moni (Instituto de Astronomía, Universidad Católica del Norte, Av. Angamos 0610, Antofagasta, Chile); Smith, R. (Departamento de Astronomía, Universidad de Concepción, Casilla 160-, C Concepción, Chile); Carraro, G. (European Southern Observatory, 3107 Alonso de Cordova, Vitacura, Santiago, Chile; Dipartimento di Fisica e Astronomia, Universitá di Padova, Vicolo Osservatorio 3, 35122, Padova, Italy); Méndez, R. A. (Universidad de Chile, Departamento de Astronomía, Casilla 36-, D Santiago, Chile); Moyano, M. (Instituto de Astronomía, Universidad Católica del Norte, Av. Angamos 0610, Antofagasta, Chile)",,"Bidin, C. Moni (Catholic University of the North); Smith, R. (University of Concepción); Carraro, G. (European Southern Observatory; University of Padua); Méndez, R. A. (University of Chile); Moyano, M. (Catholic University of the North)",15,1,,3.63,https://www.aanda.org/articles/aa/pdf/2015/01/aa24675-14.pdf,https://app.dimensions.ai/details/publication/pub.1056922513,51 Physical Sciences; 5101 Astronomical Sciences,
243,pub.1056920907,10.1051/0004-6361/201322339,,,Multiwavelength study of Cygnus A,"Context. Cygnus A, as the nearest powerful FR II radio galaxy, plays an important role in understanding jets and their impact on the surrounding intracluster medium. Aims. We explain why the nucleus is observed superposed onto the eastern lobe rather than in between the two lobes, and why the jet and counterjet are non-colinear. Methods. We made a comparative study of the radio images at different frequencies of Cygnus A, in combination with the published results on the radial velocities in the Cygnus A cluster. Results. From the morphology of the inner lobes we conclude that the lobes are not interacting with one another, but are well separated, even at low radio frequencies. We explain the location of the nucleus as the result of the proper motion of the galaxy through the cluster. The required proper motion is of the same order of magnitude as the radial velocity offset of Cygnus A with the sub-cluster it belongs to. The proper motion of the galaxy through the cluster likely also explains the non-colinearity of the jet and counterjet.","K.C.S. and S.P. gratefully acknowledge support from ALMA-CONICYT grant 31110019, and thank ESO for its flexibility (ESO project money could be used till CONICYT transferred the grant several months after the project started).",,Astronomy & Astrophysics,,,,2014-03-21,2014,2014-03-21,2014-03,563,,a131,All OA; Bronze,Article,"Steenbrugge, K. C.; Blundell, K. M.; Pyrzas, S.","Steenbrugge, K. C. (Instituto de Astronomía, Universidad Católica del Norte, Avenida Angamos 0610, Casilla 1280, Antofagasta, Chile; Department of Physics, University of Oxford, Keble Road, Oxford, OX1 3RH, UK); Blundell, K. M. (Department of Physics, University of Oxford, Keble Road, Oxford, OX1 3RH, UK); Pyrzas, S. (Instituto de Astronomía, Universidad Católica del Norte, Avenida Angamos 0610, Casilla 1280, Antofagasta, Chile)",,"Steenbrugge, K. C. (Catholic University of the North; University of Oxford); Blundell, K. M. (University of Oxford); Pyrzas, S. (Catholic University of the North)",4,1,,0.97,https://www.aanda.org/articles/aa/pdf/2014/03/aa22339-13.pdf,https://app.dimensions.ai/details/publication/pub.1056920907,51 Physical Sciences; 5101 Astronomical Sciences,
238,pub.1045847539,10.1112/jlms/jdu020,,,Topological conjugacy of real projective flows,"In this paper, we prove the following topological classification result for flows on real projective space induced by linear flows on Euclidean space: two flows on the projective space P(V) of a finite‐dimensional real vector space V, induced by endomorphisms A and B of V, are topologically conjugate if and only if the Jordan structures of A and B coincide except for the real parts of the eigenvalues, whose values may differ but whose order and multiplicities must agree. Our proof is mainly based on ideas of Kuiper who considered the discrete‐time analogue of this classification problem. We also correct a mistake in Kuiper's proof.",,,Journal of the London Mathematical Society,,,,2014-05-20,2014,2014-05-20,2014-08,90,1,49-66,All OA; Green,Article,"Ayala, V.; Kawan, C.","Ayala, V. (Departamento de Matemática, Universidad Católica del Norte, Antofagasta, Chile, vayala@ucn.cl); Kawan, C. (Courant Institute of Mathematical Sciences, New York University, 251 Mercer Street, New York, N.Y. 10012, USA)","Kawan, C. (Courant Institute of Mathematical Sciences)","Ayala, V. (Catholic University of the North); Kawan, C. (Courant Institute of Mathematical Sciences)",3,0,,1.38,https://arxiv.org/pdf/1311.0401,https://app.dimensions.ai/details/publication/pub.1045847539,49 Mathematical Sciences; 4901 Applied Mathematics; 4904 Pure Mathematics,
238,pub.1020615955,10.4067/s0718-10432014000100002,,,LEISHMANIASIS EN COYO ORIENTE: MIGRANTES TRASANDINOS EN SAN PEDRO DE ATACAMA,"En el cementerio arqueolgico de Coyo Oriente se detectaron crneos femeninos con extensas lesiones destructivas, especialmente en la rbita y nariz. Pequeas porciones de material seo de los bordes de las lesiones fueron sometidas a anlisis molecular por amplificacin del ADN de leishmaniasis, lo que hizo posible diagnosticar positivamente esta enfermedad. Se analiza la patologa de estos crneos y los elementos biolgicos y culturales asociados con ellos, as como el contexto bioantropolgico y cultural en que estos individuos se encontraban insertos. Dado que el vector de esta enfermedad nunca estuvo presente en el ambiente rido de San Pedro de Atacama, se postula que estas personas seran originarias de alguna zona trasandina, habiendo llegado a la localidad en calidad de migrantes, con el patgeno latente. El hecho de que todos los crneos correspondan a individuos del sexo femenino sugerira la posibilidad de que su presencia en San Pedro de Atacama obedeciera a un sistema patrilocal de alianzas matrimoniales. Female skulls with massive destructive lesions, especially in orbit and nose were found in San Pedro de Atacama in the archaeological Coyo Oriente cemetery. Bone fragments from the edges of the lesions were subjected to molecular analysis by PCR DNA amplification which enabled us to diagnose leishmaniasis disease. This article examines the pathology of these skulls and biological and cultural elements associated with them, as well, the cultural and bioantropological context in which these individuals were inserted. Since the vector of this disease was never present in the arid environment of San Pedro de Atacama, it is postulated that these people would be originating on the other side of the Andes, where this disease is endemic. They can arrived to the area with some latent stage of the disease. The fact that all of them are women, suggests that their presence in San Pedro de Atacama could obey to a patrilocal system of marriage alliances.",,,Estudios Atacameños,,,,2014,2014,2014,,,47,5-18,All OA; Hybrid,Article,"Costa, Mara Antonietta; Llagostera, Agustn","Costa, Mara Antonietta (Universidad Catlica del Norte Instituto de Investigaciones Arqueolgicas y Museo R. P. Gustavo Le Paige, San Pedro de Atacama, CHILE); Llagostera, Agustn (Universidad de Antofagasta Instituto de Investigaciones Antroplogicas, Antofagasta, CHILE)",,"Costa, Mara Antonietta (Catholic University of the North); Llagostera, Agustn (University of Antofagasta)",4,0,,,http://www.scielo.cl/pdf/eatacam/n47/art02.pdf,https://app.dimensions.ai/details/publication/pub.1020615955,,
238,pub.1056922339,10.1051/0004-6361/201424382,,,HD 152246: a new high-mass triple system and its basic properties⋆,"Analyses of multi-epoch, high-resolution (R ~ 50 000) optical spectra of the O-type star HD 152246 (O9 IV according to the most recent classification), complemented by a limited number of earlier published radial velocities, led to the finding that the object is a hierarchical triple system, where a close inner pair (Ba–Bb) with a slightly eccentric orbit (e = 0.11) and a period of 6.d0049 revolves in a 470-day highly eccentric orbit (e = 0.865) with another massive and brighter component A. The mass ratio of the inner system must be low since we were unable to find any traces of the secondary spectrum. The mass ratio A/(Ba+Bb) is 0.89. The outer system has recently been resolved using long-baseline interferometry on three occasions. The interferometry confirms the spectroscopic results and specifies elements of the system. Our orbital solutions, including the combined radial-velocity and interferometric solution indicate an orbital inclination of the outer orbit of 112° and stellar masses of 20.4 and 22.8 M⊙. We also disentangled the spectra of components A and Ba and compare them to synthetic spectra from two independent programmes, TLUSTY and FASTWIND. In either case, the fit was not satisfactory and we postpone a better determination of the system properties for a future study, after obtaining observations during the periastron passage of the outer orbit (the nearest chance being March 2015). For the moment, we can only conclude that component A is an O9 IV star with v sin i = 210 ± 10 km s-1and effective temperature of 33 000 ± 500 K, while component Ba is an O9 V object with v sin i = 65 ± 3 km s-1and Teff = 33 600 ± 600 K.","This publication is supported as a project of the Nordrhein-Westfälische Akademie der Wissenschaften und der Künste in the framework of the academy programme by the Federal Republic of Germany and the state Nordrhein-Westfalen. The research of P.H., P.M., and J.N. was supported by the grant P209/10/0715 of the Czech Science Foundation and from the research programme MSM0021620860. We are grateful for the help of A. Barr Domínguez, K. Fuhrmann, L. Kaderhandt and M. Ramolla during the observations and the reduction. We thank Universidad Católica del Norte in Antofagasta, Chile, for continuous support. The use of the NASA/ADS bibligraphical service and SIMBAD electronic database are gratefully acknowledged. PIONIER is funded by the Université Joseph Fourier (UJF), the Institut de Planétologie et d’Astrophysique de Grenoble (IPAG), the Agence Nationale pour la Recherche (ANR-06-BLAN-0421 and ANR-10-BLAN-0505), and the Institut National des Sciences de l’Univers (INSU PNPand PNPS).The integrated optics beam combiner result from a collaboration between IPAG and CEA=LETI based on CNRS R&amp;T funding.",,Astronomy & Astrophysics,,,,2014-08-27,2014,2014-08-27,2014-08,568,,a94,All OA; Bronze,Article,"Nasseri, A.; Chini, R.; Harmanec, P.; Mayer, P.; Nemravová, J. A.; Dembsky, T.; Lehmann, H.; Sana, H.; Le Bouquin, J.-B.","Nasseri, A. (Astronomisches Institut, Ruhr–Universität Bochum, Universitätsstr. 150, 44801, Bochum, Germany); Chini, R. (Astronomisches Institut, Ruhr–Universität Bochum, Universitätsstr. 150, 44801, Bochum, Germany; Instituto de Astronomía, Universidad Católica del Norte, Avenida Angamos 0610, Casilla 1280, Antofagasta, Chile); Harmanec, P. (Astronomical Institute of the Charles University, Faculty of Mathematics and Physics, V Holešovičkách 2, 180 00, Praha 8, Czech Republic); Mayer, P. (Astronomical Institute of the Charles University, Faculty of Mathematics and Physics, V Holešovičkách 2, 180 00, Praha 8, Czech Republic); Nemravová, J. A. (Astronomical Institute of the Charles University, Faculty of Mathematics and Physics, V Holešovičkách 2, 180 00, Praha 8, Czech Republic); Dembsky, T. (Astronomisches Institut, Ruhr–Universität Bochum, Universitätsstr. 150, 44801, Bochum, Germany); Lehmann, H. (Thüringer Landessternwarte Tautenburg, 07778, Tautenburg, Germany); Sana, H. (ESA/Space Telescope Science Institute, 3700 San Martin drive, MD, 21218, Baltimore, USA); Le Bouquin, J.-B. (Institut d’Astrophysique et de Planétologie de Grenoble, CNRS-UJF UMR 5571, 414 rue de la Piscine, 38400, St-Martin-d’Hères, France)",,"Nasseri, A. (Ruhr University Bochum); Chini, R. (Ruhr University Bochum; Catholic University of the North); Harmanec, P. (Charles University); Mayer, P. (Charles University); Nemravová, J. A. (Charles University); Dembsky, T. (Ruhr University Bochum); Lehmann, H. (Thüringer Landessternwarte Tautenburg); Sana, H. (ESA/Space Telescope Science Institute, 3700 San Martin drive, MD, 21218, Baltimore, USA); Le Bouquin, J.-B. (Institut d’Astrophysique et de Planétologie de Grenoble, CNRS-UJF UMR 5571, 414 rue de la Piscine, 38400, St-Martin-d’Hères, France)",8,1,,1.46,https://www.aanda.org/articles/aa/pdf/2014/08/aa24382-14.pdf,https://app.dimensions.ai/details/publication/pub.1056922339,51 Physical Sciences; 5109 Space Sciences,
238,pub.1006740141,10.1111/maec.12206,,,On the advantage of sharing a holdfast: effects of density and occurrence of kin aggregation in the kelp Lessonia berteroana,"Abstract  We investigated the density‐dependent and genetic relatedness that regulate the occurrence of inter‐individual (genet) fusion forming plurigenotypic organisms in the brown alga  L essonia berteroana  . Recruitment generally occurs at high densities in the inter‐tidal, allowing contact of neighbouring holdfasts as they grow and expand on the substrate. Algal density, by contrast, is regulated by the effects of herbivory and wave impact, which often lead to low holdfast density. Herein, we investigated whether the occurrence of plurigenotypic organisms and their genotypic composition (number of genotypes per plurigenotypic organism) are density dependent and affected by kin selection in the inter‐tidal kelp  L . berteroana  . Four microsatellite loci were used to analyse DNA from 260 samples obtained from shared and non‐shared holdfasts, at two sites with high and two site with low holdfast density. Analyses showed that fusions forming plurigenotypic organisms are extremely common. Interestingly, the frequency of fusions was higher in low‐density sites, in which 100% of the plants had at least two genotypes and the average was 3.5. In high‐density sites, 62% of plants were plurigenotypic, with an average of 2.8 genotypes per plant. Additionally, we found that genotypes that shared a holdfast had a significantly higher genetic relatedness than the average in the population, compatible with a kin structure. Density dependence and kin structure suggest that the occurrence of plurigenotypic organisms is linked to environmental quality, and that kin or multilevel selection may be favouring the fusion of genetically related genets.","Acknowledgements The authors thank Alonso Vega, Nicole Piaget, Alfonso Gonzalez, Horacio Bastías and Cristian Jofré for fieldwork assistance; Raúl Vera and Javier Tapia for laboratory assistance; and Marcelo Rivadeneira, Jacqui Shykoff and Florence Tellier for valued comments that improved this manuscript. This study was partially supported by FONDECYT 1090742 to S.F. and CEAZA and INCAR (FONDAP 15110027) to P.H.",,Marine Ecology,,,,2014-10-10,2014,2014-10-10,2015-12,36,4,1107-1117,All OA; Green,Article,"Segovia, Nicolás I.; Vásquez, Julio A.; Faugeron, Sylvain; Haye, Pilar A.","Segovia, Nicolás I. (Departamento de Biología Marina, Facultad de Ciencias del Mar, Universidad Católica del Norte & Centro de Estudios Avanzados en Zonas Áridas (CEAZA), Coquimbo, Chile; Doctorado en Ciencias M/ Biología y Ecología Evolutiva, Departamento de Ciencias Ecológicas, Facultad de Ciencias, Universidad de Chile); Vásquez, Julio A. (Departamento de Biología Marina, Facultad de Ciencias del Mar, Universidad Católica del Norte & Centro de Estudios Avanzados en Zonas Áridas (CEAZA), Coquimbo, Chile); Faugeron, Sylvain (Centro de Conservación Marina, Facultad de Ciencias Biológicas, Pontificia Universidad Católica de Chile, Santiago, Chile; UMI 3614 Evolutionary Biology and Ecology of Algae, CNRS, Sorbonne Universités UPMC Univ. Paris 06, Pontificia Universidad Católica de Chile, Universidad Austral de Chile); Haye, Pilar A. (Departamento de Biología Marina, Facultad de Ciencias del Mar, Universidad Católica del Norte & Centro de Estudios Avanzados en Zonas Áridas (CEAZA), Coquimbo, Chile; Interdisciplinary Center for Aquaculture Research (INCAR), Universidad de Concepción, Concepción, Chile)","Haye, Pilar A. (Catholic University of the North; University of Concepción)","Segovia, Nicolás I. (Catholic University of the North; University of Chile); Vásquez, Julio A. (Catholic University of the North); Faugeron, Sylvain (Pontificia Universidad Católica de Chile; Pontificia Universidad Católica de Chile); Haye, Pilar A. (Catholic University of the North; University of Concepción)",19,6,,1.9,https://hal.archives-ouvertes.fr/hal-01136148/file/MAE-1925%20Segovia%20ea%20Accepted%20Marine%20Ecology.pdf,https://app.dimensions.ai/details/publication/pub.1006740141,31 Biological Sciences; 3103 Ecology; 3105 Genetics,
