1195,pub.1020625862,10.1007/s00436-007-0869-0,18214540,,Morphometric and molecular characteristics of Labeonema synodontisi n. comb. (Nematoda: Atractidae) from the West African fishes,"Numerous nematodes were found in the rectum of three fish species Synodontis ocellifer, S. nigrita, and S. schall (Mochokidae, Siluriformes) from the Gambia River and Mare Simenti, National Park Niokolo Koba, Senegal. A nematode species Raillietnema synodontisi Vassiliadès, 1973 (host S. ocellifer), is redescribed using morphometric (including scanning electron microscopy) and molecular characteristics and transferred into the genus Labeonema Puylaert, 1970. It is morphologically and metrically similar to Labeonema intermedium Puylaert, 1970, the other congeneric species (L. bainae Baker, 1982; L. bakeri Van Waerebeke, Chabaud, Bain et Georges, 1988; and L. africanum Moravec et Van As, 2004) differ from them either by the spicule and gubernaculum lengths, distribution and number of pre-cloacal papillae, position of the vulva, as well as hosts and geographical distribution. The partial sequences of small ribosomal subunit rDNA of L. synodontisi were analyzed and compared with other nematode sequences. Molecular analyses seem to support the position of this nematode species based on the morphological observation.","The authors thank the management of the Senegal National Parks for logistic support and the guide Amadou Demba Ndiaye for assistance. They would also like to thank Martina Vyskočilová, from the Department of Botany and Zoology, Faculty of Science MU, Brno, Czech Republic for DNA analysis. Thanks are also due to Mr. Jimmy Cassone, Chargé des collections d&#x27;Helminthes Muséum National d&#x27;Histoire Naturelle, Paris for the loan of the type specimens of R. synodontisi Vassiliadès, 1973. This study was partly supported by grant No. IAA6093404 (B.K., V.B., A.S.) from the Grant Agency of the Academy of Science of the Czech Republic and by the Research Project of the Masaryk University No. MSM 0021622416 and Ichthyoparasitology Research Centre of the Ministry of Education, Youth and Sports of the Czech Republic (LC 522) (B.K., I.H., A.S.).",,Parasitology Research,,,"Africa, Western; Animals; Catfishes; DNA, Helminth; Female; Fish Diseases; Male; Microscopy, Electron, Scanning; Molecular Sequence Data; RNA, Ribosomal, 18S; Rhabditida; Rhabditida Infections; Rivers; Sequence Analysis, DNA",2008-01-24,2008,2008-01-24,2008-04,102,5,1013-1020,Closed,Article,"Koubková, Božena; Baruš, Vlastimil; Hodová, Iveta; Šimková, Andrea","Koubková, Božena (Department of Botany and Zoology, Faculty of Science, Masaryk University, Kotlářská 2, 611 37, Brno, Czech Republic); Baruš, Vlastimil (Institute of Vertebrate Biology, Academy of Sciences of the Czech Republic, Květná 8, 603 65, Brno, Czech Republic); Hodová, Iveta (Department of Botany and Zoology, Faculty of Science, Masaryk University, Kotlářská 2, 611 37, Brno, Czech Republic); Šimková, Andrea (Department of Botany and Zoology, Faculty of Science, Masaryk University, Kotlářská 2, 611 37, Brno, Czech Republic)","Koubková, Božena (Masaryk University)","Koubková, Božena (Masaryk University); Baruš, Vlastimil (Institute of Vertebrate Biology); Hodová, Iveta (Masaryk University); Šimková, Andrea (Masaryk University)",5,0,0.29,0.85,,https://app.dimensions.ai/details/publication/pub.1020625862,"30 Agricultural, Veterinary and Food Sciences; 3009 Veterinary Sciences; 31 Biological Sciences",
1194,pub.1012944450,10.1111/j.1365-2672.2008.03878.x,18828792,,Purification and characterization of antibacterial substances produced by a marine bacterium Pseudoalteromonas haloplanktis strain,"AIMS: To purify and characterize compounds with antimicrobial activity from Pseudoalteromonas haloplanktis inhibition (INH) strain.
METHODS AND RESULTS: The P. haloplanktis isolated from a scallop hatchery was used to analyse antibacterial activities. Crude extracts were obtained with ethyl acetate of the cultured broth, after separation of bacterial cells, and assays against six strains of marine bacteria and nine clinically important pathogenic bacteria. The active compounds were purified from ethyl acetate extracts, by a combination of SiO(2) column and thin layer chromatography. Two active fractions were isolated, and chemical structures of two products from the major one were unambiguously identified as isovaleric acid (3-methylbutanoic acid) and 2-methylbutyric acid (2-methylbutanoic acid), by comparing their mass spectra and (1)H- and (13)C-nuclear magnetic resonance spectra to those of authentic compounds.
CONCLUSIONS: In the antibacterial activity of P. haloplanktis INH strain, extra cell compounds are involucred, mainly isovaleric and 2-methylbutyric acids.
SIGNIFICANCE AND IMPACT OF THE STUDY: Production of antimicrobial compounds by marine micro-organisms has been widely reported; however, the efforts not always are conducted to purification and applications of these active compounds. This study is a significant contribution to the knowledge of compounds unique from marine bacteria as potential sources of new drugs in the pharmacological industry.","We thank to Dr Paula Díaz‐Palma, Dr Carlos Contreras, Dr Victor Kesternich and Dr Marta Hengst for their constructive comments on the manuscript. This study was carried out as postdegree research supported by the Japan Government MOMBUSHO scholarship.",,Journal of Applied Microbiology,,,"Anti-Bacterial Agents; Bacteria; Butyrates; Chromatography, High Pressure Liquid; Chromatography, Thin Layer; Hemiterpenes; Microbial Sensitivity Tests; Pentanoic Acids; Pseudoalteromonas",2008-10-01,2008,2008-10-01,2008-11,105,5,1672-1677,Closed,Article,"Hayashida‐Soiza, G.; Uchida, A.; Mori, N.; Kuwahara, Y.; Ishida, Y.","Hayashida‐Soiza, G. (Departamento de Ciencias Químicas y Farmacéuticas, Universidad Católica del Norte, Antofagasta, Chile); Uchida, A. (Department of Applied Biosciences, Faculty of Agriculture, Kyoto University, Sakyo Kyoto, Japan); Mori, N. (Department of Applied Lifesciences, Faculty of Agriculture, Kyoto University, Kyoto, Japan); Kuwahara, Y. (Department of Bioenvironmental Science, Kyotogakuen University, Kameoka, Kyoto, Japan); Ishida, Y. (Department of Marine Biotechnology, Faculty of Engineering, Fukuyama University, Fukuyama, Hiroshima, Japan)","Hayashida‐Soiza, G. (Catholic University of the North)","Hayashida‐Soiza, G. (Catholic University of the North); Uchida, A. (Kyoto University); Mori, N. (Kyoto University); Kuwahara, Y. (Department of Bioenvironmental Science, Kyotogakuen University, Kameoka, Kyoto, Japan); Ishida, Y. (Fukuyama University)",46,4,1.02,2.8,,https://app.dimensions.ai/details/publication/pub.1012944450,31 Biological Sciences; 3107 Microbiology,
1194,pub.1008765095,10.1080/09595230802245253,18825548,,"Adolescent methamphetamine use and sexual risk behaviour in secondary school students in Cape Town, South Africa","This study investigated involvement in substance use and sexual activities among adolescents in Cape Town, and specifically the associations between methamphetamine use and sexual risk behaviours. Data were collected from 15 randomly selected and 15 matched schools in Cape Town via quantitative questionnaires. Students used hand-held computers (PDAs) to answer the questions. A total of 4605 grade 9 students were sampled. Male and female students were almost equally likely to have used methamphetamine at least once (13% versus 12%). Students who had used methamphetamine in the past 30 days were significantly more likely to have had vaginal, anal or oral sex than students who had never used it, to have been pregnant/been responsible for a pregnancy and to have been diagnosed with a sexually transmitted infection. Logistic regression analysis indicated significant associations between methamphetamine use in the past 12 months and engaging in vaginal and anal sex. Drug abuse and sexually transmitted infections (STI) prevention services should incorporate the link between drugs and STI into their prevention and education strategies, especially those aimed at school-going adolescents.",,,Drug and Alcohol Review,,,"Adolescent; Adolescent Behavior; Amphetamine-Related Disorders; Central Nervous System Stimulants; Computers, Handheld; Female; Humans; Logistic Models; Male; Methamphetamine; Risk-Taking; Schools; Sex Education; South Africa; Students; Surveys and Questionnaires; Unsafe Sex",2008-11,2008,2009-05-29,2008-11,27,6,687-692,Closed,Article,"PLÜDDEMANN, ANDREAS; FLISHER, ALAN J.; MATHEWS, CATHERINE; CARNEY, TARA; LOMBARD, CARL","PLÜDDEMANN, ANDREAS (Alcohol and Drug Abuse Research Unit, Medical Research Council, Tygerberg, South Africa); FLISHER, ALAN J. (Division of Child and Adolescent Psychiatry and Adolescent Health Research Unit, University of Cape Town, South Africa and Research Centre for Health Promotion, University of Bergen, Norway, South Africa); MATHEWS, CATHERINE (Health Systems Research Unit, Medical Research Council, South Africa and School of Public Health and Family Medicine, University of Cape Town, South Africa); CARNEY, TARA (Alcohol & Drug Abuse Research Unit, Medical Research Council, South Africa); LOMBARD, CARL (Biostatistics Unit, Medical Research Council, South Africa)","PLÜDDEMANN, ANDREAS (South African Medical Research Council)","PLÜDDEMANN, ANDREAS (South African Medical Research Council); FLISHER, ALAN J. (University of Cape Town; University of Bergen); MATHEWS, CATHERINE (South African Medical Research Council; University of Cape Town); CARNEY, TARA (South African Medical Research Council); LOMBARD, CARL (South African Medical Research Council)",51,3,1.59,,,https://app.dimensions.ai/details/publication/pub.1008765095,42 Health Sciences; 44 Human Society; 52 Psychology,3 Good Health and Well Being
1157,pub.1045600290,10.1017/s0022149x07839745,18005464,,"Determinants of the parasite community of clariid fishes from Lake Victoria, Tanzania","The factors that determine parasite assemblages among the clariid fishes of Lake Victoria, Tanzania were studied between August 2003 and February 2005. Six hundred and fifty-six fish belonging to seven species were necropsied and examined for parasites, from which 31 species of metazoan parasites were recorded. The community was dominated by the nematodes both in species and numbers. Most species were generalists with only two trematodes, Diplostomum mashonense and Tylodelphys species, being specialists of Clarias gariepinus. Ten species were considered core and predictable. Parasite species richness, number of individuals per host and Shannon-Wiener diversity indices were generally high. At the compound community level, a mean number of 7.8 parasites were shared among different species of fish and the maximum number of parasites species per fish at the infracommunity level was seven. Levels of similarity in parasite species richness at the component community level ranged from 29.6 to 61.5%. The study concludes that parasite communities in clariid fishes of Lake Victoria are structured by ecological factors. At the infracommunity level, host size, diet and vagility promoted a richer parasite community. At the compound level, two factors were crucial, namely the intermixing of the waters in the lake and the predominant and mobile C. gariepinus.",,,Journal of Helminthology,,,Animals; Catfishes; Cestoda; Crustacea; Diet; Female; Fresh Water; Host-Parasite Interactions; Intestines; Leeches; Male; Mouth; Nematoda; Parasites; Skin; Species Specificity; Tanzania; Trematoda,2008-03-01,2008,2008-03-01,2008-03,82,1,7-16,Closed,Article,"Mwita, Chacha; Nkwengulila, Gamba","Mwita, Chacha (Department of Fisheries Science and Aquaculture, Faculty of Aquatic Sciences and Technology, University of Dar Es Salaam, PO Box 35064, Dar Es Salaam, Tanzania); Nkwengulila, Gamba (Department of Zoology and Wildlife Conservation, Faculty of Science, University of Dar Es Salaam, PO Box 35064, Dar Es Salaam, Tanzania)","Mwita, Chacha (University of Dar es Salaam)","Mwita, Chacha (University of Dar es Salaam); Nkwengulila, Gamba (University of Dar es Salaam)",28,3,0.39,2.45,,https://app.dimensions.ai/details/publication/pub.1045600290,"30 Agricultural, Veterinary and Food Sciences; 3005 Fisheries Sciences; 31 Biological Sciences; 3103 Ecology",14 Life Below Water
1147,pub.1107142239,10.7440/histcrit35.2008.16,,,Notilibros - Notired,,,,Historia Crítica,,,,2008-01,2008,,2008-01,,35,223-230,All OA; Gold,Article,"Lux, Martha; Laurent, Muriel","Lux, Martha (); Laurent, Muriel ()",,"Lux, Martha (); Laurent, Muriel ()",0,0,,,http://revistas.uniandes.edu.co/doi/pdf/10.7440/histcrit35.2008.16,https://app.dimensions.ai/details/publication/pub.1107142239,,
1132,pub.1036869503,10.1117/12.776958,,,An RSSI-based filter for mobility control of mobile wireless ad hoc-based unmanned ground vehicles,,,,Proceedings of SPIE--the International Society for Optical Engineering,"Sensors, and Command, Control, Communications, and Intelligence (C3I) Technologies for Homeland Security and Homeland Defense VII",Edward M. Carapezza,,2008-04-03,2008,2008-05-15,2008-04-03,6943,,694308-694308-10,Closed,Proceeding,"Wightman, Pedro; Jabba, Daladier; Labrador, Miguel A.","Wightman, Pedro (Univ. of South Florida); Jabba, Daladier (Univ. of South Florida); Labrador, Miguel A. (Univ. of South Florida)",,"Wightman, Pedro (University of South Florida); Jabba, Daladier (University of South Florida); Labrador, Miguel A. (University of South Florida)",2,0,,0.58,,https://app.dimensions.ai/details/publication/pub.1036869503,"40 Engineering; 4006 Communications Engineering; 4009 Electronics, Sensors and Digital Hardware; 51 Physical Sciences; 5102 Atomic, Molecular and Optical Physics",
1103,pub.1038800078,10.4067/s0718-10432008000200005,,,"La serpiente en el arte rupestre de Nocui, norte semirido de Chile","Damos a conocer el notable desarrollo tcnico e iconogrfico que alcanzaron los grabados rupestres de Nocui (regin de Coquimbo, Chile), confeccionados desde inicios del Alfarero Temprano (ca. 2000 AP) pero mayormente desarrollados por los diaguitas hasta tiempos tardos (1000-1536 DC). Su anlisis establecer que el referente serpentimorfo expresa significados que se encuadran en el mbito de lo simblico y lo sagrado, siendo el principal indicador de la unidad cultural local. Asimismo, proponemos que el lugar de tales grabados fue dotado de gran valor simblico, llegando incluso a ser sacralizado, por lo que fue parte esencial de los procesos de apropiacin del territorio, conformacin de identidad, as como de reafirmacin y promocin del imaginario sagrado. Rock art research recently conducted at the pastures of Nocui (region of Coquimbo, Chile) reveals the remarkable technical and iconographic development archieved in engravings during early ceramics period (ca. 2000 BP) and until the blossoming of Diaguita Culture (1000-1536 AD). This suggest that rupestrian expressions played a primary rol in the process of appropriation of the local territory, as carried out through a seasonal hunting and grazing economic strategies. We propose that the high symbolic value attributed in this way to specific locations became sacralized through time, making certaim places essential to the construction of local identity and the promotion of its cosmovision.",,,Estudios Atacameños,,,,2008,2008,2008,,,36,73-91,All OA; Hybrid,Article,"D, Jos Castelleti","D, Jos Castelleti (Universidad Catlica del Norte, CHILE)",,"D, Jos Castelleti (Catholic University of the North)",0,0,,,http://www.scielo.cl/pdf/eatacam/n36/art05.pdf,https://app.dimensions.ai/details/publication/pub.1038800078,,
1100,pub.1174313946,10.25100/cm.v39i1.547,,,Using biopsy for breast cancer diagnosis: an equity issue?.,"Objetive: This study aims to evaluating whether health insurance status determines access to biopsy for diagnose of breast cancer among women in Colombia. Materials and methods: A retrospective follow-up study was carried out in women on treatment for breast cancer, selected from public and private institutions in six cities. A survey to collect information about health insurance status and economic, geographic, organizational and administrative barriers that might constrain access to diagnosis by biopsy was applied. To evaluate equity logistic regression model to calculate odds ratios to establish the association between health insurance status and putative barriers was used. Finally a multivariate analysis to control for confounding factors of women sociodemographic conditions was performed. Additionally interaction with their educative level and their residence location was evaluated. Results: Higher probabilities of barriers to biopsy in women with subsidized health insurance (OR 3.8 CI 95% 2.65-5.49) and for those without insurance (OR 4.9 CI 95% 3.00-7.99), compared to the insured women to face economic barriers for accessing diagnosis services for breast cancer were found. Also, women with health subsidized by the government together with those living in rural areas have a greater probability of geographic barriers (OR 2.0; CI 1.31-3.22) and (OR: 11.0 CI 95% 6.45-18.51) respectively. Conclusions: The study suggests that the use of diagnosis services for breast cancer is inequitable because the differences in probabilities affect the most vulnerable groups. The health insurance model may be responsible for this inequity.",,,Colombia Medica,,,,2008-03-31,2008,2008-03-31,,39,1,24-32,All OA; Green,Article,"de Charry, Ligia Constanza; Roca, Sandra; Carrasquilla, Gabriel","de Charry, Ligia Constanza (Centro de Estudios e Investigación en Salud (CEIS)); Roca, Sandra (Centro de Estudios e Investigación en Salud (CEIS)); Carrasquilla, Gabriel (Universidad del Valle)",,"de Charry, Ligia Constanza (Centro de Estudios e Investigación en Salud (CEIS)); Roca, Sandra (Centro de Estudios e Investigación en Salud (CEIS)); Carrasquilla, Gabriel (University of Valle)",0,0,,0.0,http://www.bioline.org.br/pdf?rc08004,https://app.dimensions.ai/details/publication/pub.1174313946,32 Biomedical and Clinical Sciences; 3211 Oncology and Carcinogenesis; 42 Health Sciences; 4203 Health Services and Systems,3 Good Health and Well Being
1100,pub.1040669055,10.4067/s0717-73562008000200002,,,LOS INKAS EN EL ALTIPLANO SUR DE TARAPACA: EL TOJO REVISITADO,"Este artculo es una reevaluacin del sitio El Tojo y su zona aledaa en la depresin del Huasco, una aislada y escasamente poblada franja ganadera del altiplano sur de Tarapac, situada entre grandes nodos de poblacin agrcola. Se abordan tres principales temas: (1) la profundidad temporal y diversidad cultural de las ocupaciones prehispnicas tardas en el rea de estudio, (2) la largamente aceptada interpretacin de Hans Niemeyer del sitio El Tojo como un tampu inkaico y (3) la naturaleza y razones de la presencia inka en estos espacios internodales. Estos temas son abordados con datos obtenidos principalmente de prospecciones, recolecciones de cermica de superficie y sondeos efectuados en cinco sitios habitacionales, incluyendo El Tojo. Los datos son discutidos en un contexto ms amplio, que incluye a los complejos culturales tardos del Altiplano Meridional de Bolivia y de la Regin de Tarapac en Chile. This article is a reassessment of the El Tojo site and the surrounding area in the Huasco basin, an isolated, sparsely populated strip of land usedfor animal husbandry in the southem Altiplano of Tarapac, situated between large agricultural population nodes. The article addresses three main issues: (1) the time depth and cultural diversity ofthe late prehispanic occupations in the rea under study, (2) Hans Niemeyer's long-accepted interpretation ofthe El Tojo site as an Inka tampu, and (3) the nature and reasonsfor the Inkapresence at these internodal locations. Discussion ofthese tapies is addressed with data drawnfrom extensive field survey surface collections, and testpits excavated atfive residential sites, including El Tojo. The information is examined in a broader context that includes the late cultural complexes of Bolivia 's Southem Altiplano and those of Chile 's Tarapac Regin.",,,Chungara - Revista de Antropología Chilena,,,,2008-12,2008,2008-12,,40,2,121-143,All OA; Gold,Article,"R, Jos Berenguer; R, Ivn Cceres","R, Jos Berenguer (Museo Chileno de Arte Precolombino, Santiago, Chile); R, Ivn Cceres (Applus Corp, Santiago, Chile)",,"R, Jos Berenguer (Museo Chileno de Arte Precolombino, Santiago, Chile); R, Ivn Cceres (Applus Corp, Santiago, Chile)",9,1,,5.33,http://www.scielo.cl/pdf/chungara/v40n2/art02.pdf,https://app.dimensions.ai/details/publication/pub.1040669055,"47 Language, Communication and Culture; 4702 Cultural Studies",
1098,pub.1010187360,10.1016/j.sna.2007.05.004,,,Localized-mass detection based on thin-film bulk acoustic wave resonators (FBAR): Area and mass location aspects,"Localized-mass sensors using thin-film bulk acoustic resonators (FBAR) have been implemented for the study of sensitivity and possible configurations in biological applications. In a first experiment, a group of resonators are loaded with the same amount of mass but different contact areas, achieving responsivities as high as 10−19g/Hz, and potential sensitivities in the order of 10−14g. These numbers are at least one order of magnitude higher than those obtained for uniform thin-film loadings, although it is clear that sensitivity decreases with the area of the localized-mass. The current phase-noise levels and the quality factor of resonators would allow measuring frequency changes of 30kHz – the minimum measured frequency shifting has been 500kHz so far – due to a mass deposition of 9.0×10−15g. In a second experiment, localized-loadings with the same mass are located in different positions of the top electrodes of the corresponding FBARs. It was found out that a location change of the mass in the electrode causes different magnitudes of frequency shifting. A discussion on these topics is opened, in order to define future applications and research lines concerning localized-mass sensing in FBARs.","AcknowledgementsThis work has been supported by Seiko EPSON Corporation, through its European branch EPSON Europe Electronics GmbH and EPSON&#x27;s Barcelona Research and Development Laboratory (BRDL). H. Campanella would like to thank to C. Golden for fruitful discussions and helpful guidance.",,Sensors and Actuators A Physical,,,,2008-03,2008,,2008-03,142,1,322-328,Closed,Article,"Campanella, Humberto; Uranga, Arantxa; Romano-Rodríguez, Albert; Montserrat, Josep; Abadal, Gabriel; Barniol, Nuria; Esteve, Jaume","Campanella, Humberto (Centro Nacional de Microelectrónica CNM-CSIC, Campus UAB, 08193 Bellaterra, Barcelona, Spain; Universitat Autònoma de Barcelona, School of Engineering, Department of Electronics Engineering, Edifici Q, 08193 Bellaterra, Barcelona, Spain); Uranga, Arantxa (Universitat Autònoma de Barcelona, School of Engineering, Department of Electronics Engineering, Edifici Q, 08193 Bellaterra, Barcelona, Spain); Romano-Rodríguez, Albert (Universitat de Barcelona, Department of Electronics, c/Martí i Franquès, 1, Barcelona E-08028, Spain); Montserrat, Josep (Centro Nacional de Microelectrónica CNM-CSIC, Campus UAB, 08193 Bellaterra, Barcelona, Spain); Abadal, Gabriel (Universitat Autònoma de Barcelona, School of Engineering, Department of Electronics Engineering, Edifici Q, 08193 Bellaterra, Barcelona, Spain); Barniol, Nuria (Universitat Autònoma de Barcelona, School of Engineering, Department of Electronics Engineering, Edifici Q, 08193 Bellaterra, Barcelona, Spain); Esteve, Jaume (Centro Nacional de Microelectrónica CNM-CSIC, Campus UAB, 08193 Bellaterra, Barcelona, Spain)","Campanella, Humberto (Centro Nacional de Microelectrónica; Autonomous University of Barcelona)","Campanella, Humberto (Centro Nacional de Microelectrónica; Autonomous University of Barcelona); Uranga, Arantxa (Autonomous University of Barcelona); Romano-Rodríguez, Albert (University of Barcelona); Montserrat, Josep (Centro Nacional de Microelectrónica); Abadal, Gabriel (Autonomous University of Barcelona); Barniol, Nuria (Autonomous University of Barcelona); Esteve, Jaume (Centro Nacional de Microelectrónica)",24,2,,5.2,,https://app.dimensions.ai/details/publication/pub.1010187360,"40 Engineering; 4008 Electrical Engineering; 4009 Electronics, Sensors and Digital Hardware; 4017 Mechanical Engineering",
