252,pub.1044227790,10.1093/icesjms/fsn152,,,"Interactions between the South American sea lion (Otaria flavescens) and the artisanal fishery off Coquimbo, northern Chile","Abstract
                  Goetz, S., Wolff, M., Stotz, W., and Villegas, M. J. 2008. Interactions between the South American sea lion (Otaria flavescens) and the artisanal fishery off Coquimbo, northern Chile. – ICES Journal of Marine Science, 65: 1739–1746. The South American sea lion (Otaria flavescens) forages in coastal waters, where it interacts with fisheries and causes considerable economic loss by removing some catch and damaging gear. This study describes for the fishery region of Coquimbo (Chile) where, when, and with what type of gear interactions occur, characterizes the animals involved (group size, sex, and age), and derives some management recommendations. The study was based on 55 interviews with fishers and observations aboard fishing vessels in the main fishing sectors between October 2003 and March 2004. Interactions were primarily at night (88% of interviewees fished at night), in the bay (“Bahía”) of Coquimbo (81% of interviewees fished in this sector), where shoaling fish were abundant, and with purse-seines (100% of interviewees used this gear). Although some large groups of sea lions were seen, most comprised 1–10 animals. Most animals that interacted with the fishing gear were males (67%), probably because of the different feeding strategies of the two sexes. Management options discussed include the adjustment of fisheries to foraging behaviour of sea lions, and the controlled elimination of conflicting animals.","This article is dedicated to the memory of our friend and co-author MJV, who unexpectedly passed away in March 2008 and without whose dedication and insights this work would not have been possible. We thank the fishers of Coquimbo, especially Renato Laferte, Juan Arenas, the crew of FVs “Don Gustavo” and “Vicho”, the working group ECOLMAR (Grupo de Ecología y Manejo de Recursos), and the staff of the University Católica del Norte for technical support and cooperation. We also appreciate the help of Gerardo Cerda from SERNAPESCA in providing us up-to-date fisheries statistics, the DAAD (German Academic Exchange Service) for financial support, and Walter Sielfeld, Graham Pierce, and Begoña Santos for suggestions and corrections on the draft manuscript.",,ICES Journal of Marine Science,,,,2008-09-22,2008,2008-09-22,2008-12-01,65,9,1739-1746,Closed,Article,"Goetz, Sabine; Wolff, Matthias; Stotz, Wolfgang; Villegas, Mario J.","Goetz, Sabine (Centro Oceanográfico de Vigo, Instituto Español de Oceanografía (IEO), Cabo Estay-Canido, Apartado 1552, 36200 Vigo, Spain); Wolff, Matthias (Charles Darwin Foundation, Santa Cruz, Galapagos, Casilla, 17-01-3891 Quito, Ecuador); Stotz, Wolfgang (Grupo de Ecología y Manejo de Recursos (ECOLMAR), Departamento de Biología Marina, Universidad Católica del Norte, Casilla 117, Coquimbo, Chile); Villegas, Mario J. (Departamento de Ciencias del Mar, Universidad Arturo Prat, Casilla 121, Iquique, Chile)","Goetz, Sabine (Centro Oceanográfico de Murcia)","Goetz, Sabine (Centro Oceanográfico de Murcia); Wolff, Matthias (Charles Darwin Foundation); Stotz, Wolfgang (Catholic University of the North); Villegas, Mario J. (Arturo Prat University)",28,4,,6.91,,https://app.dimensions.ai/details/publication/pub.1044227790,41 Environmental Sciences; 4104 Environmental Management; 48 Law and Legal Studies; 4803 International and Comparative Law,14 Life Below Water
251,pub.1051396952,10.1080/02533950802078889,,,‘A good measure of sacrifice’: Botswana and the liberation struggles of southern Africa (1965–1985),"The government of Botswana had to strike a fine balance between not isolating the liberation movements, not letting them use Botswana as a military base and not appearing to harbour ‘terrorists’. The government realised that overtly supporting the liberation movements was potentially suicidal, for the country could easily be punished by South Africa: trade links could be severed and communication networks paralysed. The settler regimes did try to infiltrate and weaken the liberation movements in Botswana and carried out acts such as kidnapping, intimidation and deportation, to try to prevent the liberation movements from threatening the status quo in southern Africa. Using evidence from the Botswana National Archives, oral interviews, and newspaper reports, the article examines the means the Botswana government adopted to deal with the situation and safeguard the security of its citizens.",,,Social Dynamics,,,,2008-03,2008,,2008-03,34,1,5-16,Closed,Article,"Mgadla, Part T.","Mgadla, Part T. (History Department, University of Botswana, Gaborone, Botswana)","Mgadla, Part T. (University of Botswana)","Mgadla, Part T. (University of Botswana)",5,0,,2.1,,https://app.dimensions.ai/details/publication/pub.1051396952,44 Human Society; 4404 Development Studies,
251,pub.1086628881,10.1515/9783110978513.500,,,ASRA – BDVZ-Nachrichten,,,,,ITA,,,2008-12-31,2008,2008-12-31,2008-12-31,,,500-600,Closed,Chapter,,,,,0,0,,,,https://app.dimensions.ai/details/publication/pub.1086628881,,
245,pub.1016051089,10.1016/j.jsames.2008.08.006,,,"Structural control of the emplacement of the Portrerillos porphyry copper, central Andes of Chile","The Potrerillos porphyry is located in the Late Eocene–Oligocene metallogenic belt of porphyry copper deposits of Chile, Cordillera de Domeyko, central Andes. It is formed of a porphyritic biotite–hornblende monzonite that was emplaced at less than 1000m depth. The intrusion has a cylindrical vertical form at depth, whereas its uppermost section resembles a mushroom whose stem is inclined 20–25° to the northwest. The location of the Potrerillos porphyry coincides with a major facies and east–west thickness change in Jurassic to Late Cretaceous marine sedimentary and Tertiary volcanic host rocks. Structurally, the porphyry was emplaced at the intersection between the northeast-oriented Potrerillos fold-and-thrust belt, and a system of northwest-trending strike-slip faults of the Ciénaga fault system. Both structural elements are related to a sinistral regional transpression that was active during the Middle to Late Eocene. The north–northeast trending Sierra Castillo-Agua Amarga fault system was trench-linked with an oblique subduction along the Peru–Chile trench in the southwestern part of South America at this time. One of the main structural elements of the Potrerillos fold-and-thrust belt is the eastward verging Potrerillos Mine reverse fault. We demonstrate a syntectonic relationship between the Potrerillos porphyry emplacement and the onset of the Potrerillos Mine fault. The control at the shallowest levels of the Potrerillos porphyry emplacement was studied by means of a structural analysis of folds, cleavage and deformed oolites in the country rock. This analysis suggests that the porphyry occupied the core of an anticline. The form of this anticline was modeled as a fault-propagation-fold taking into account a 200m displacement along the basal fault and a local shortening of 45.5% occurred. This model is compatible with a limited displacement along the Potrerillos Mine fault under hot, ductile conditions. The remaining displacement of 1600m would have taken place afterwards under cold, brittle conditions. The Potrerillos porphyry was emplaced during a transpressional regime within the Potrerillos fold-and-thrust belt. The fact that the cleavage does not show a concentric distribution around the Potrerillos porphyry, discounts the possibility of a forced emplacement of the porphyry, pushing aside its wall rocks. This is reinforced by the deformed oolites which do not show a strain gradient from outside towards the edge of the body. The clockwise transection of the fold axes by the cleavage and the southeast direction of displacement along the Potrerillos Mine fault are interpreted as related to the regional sinistral transpression related to the Sierra Castillo Fault movement.","AcknowledgmentsThe authors are greatly indebted to Victor Maksaev (Universidad de Chile), Tim Marsh (Arizona, USA), Steve Olson (APO, USA) and Jeremy Richards (University of Alberta, Canada) for contributing to improve this paper. Also they wish to thank the following people of CODELCO-Chile Mining Company: Hernán Correa for the financial support of the field studies, Román Flores for the hospitality and Francisco Camus, who reviewed a preliminary version of the manuscript. José Blondel, of CODELCO-Salvador, authorized the publication of this paper. Leonel Jofré of the Universidad Católica del Norte (Chile) made the drawings for this publication.",,Journal of South American Earth Sciences,,,,2008-11,2008,,2008-11,26,3,261-270,Closed,Article,"Niemeyer, Hans; Munizaga, Rodrigo","Niemeyer, Hans (Departamento de Ciencias Geológicas, Universidad Católica del Norte, Casilla 1280, Antofagasta, Chile); Munizaga, Rodrigo (Departamento de Ciencias Geológicas, Universidad Católica del Norte, Casilla 1280, Antofagasta, Chile)","Niemeyer, Hans (Catholic University of the North)","Niemeyer, Hans (Catholic University of the North); Munizaga, Rodrigo (Catholic University of the North)",19,3,,1.66,,https://app.dimensions.ai/details/publication/pub.1016051089,37 Earth Sciences; 3705 Geology; 3706 Geophysics,
245,pub.1025967546,10.1016/j.seares.2008.06.002,,,"Active and passive migration in boring isopods Limnoria spp. (Crustacea, Peracarida) from kelp holdfasts","Many boring isopods inhabit positively buoyant substrata (wood and algae), which float after detachment, permitting passive migration of inhabitants. Based on observations from previous studies, it was hypothesized that juvenile, subadult and male isopods migrate actively, and will rapidly abandon substrata after detachment. In contrast, reproductive females and small offspring were predicted to remain in floating substrata and thus have a high probability to disperse passively via rafting. In order to test this hypothesis, a colonization and an emigration experiment were conducted with giant kelp (Macrocystis integrifolia), the holdfasts of which are inhabited by boring isopods from the genus Limnoria. A survey of benthic substrata in the kelp forest confirmed that limnoriids inhabited the holdfasts and did not occur in holdfast-free samples. Results of the colonization experiment showed that all life history stages of the boring isopods immigrated into young, largely uncolonized holdfasts, and after 16 weeks all holdfasts were densely colonized. In the emigration experiment, all life history stages of the isopods rapidly abandoned the detached holdfasts — already 5 min after detachment only few individuals remained in the floating holdfasts. After this initial rapid emigration of isopods, little changes in isopod abundance occurred during the following 24 h, and at the end of the experiment some individuals of all life history stages still remained in the holdfasts. These results indicate that all life history stages of Limnoria participate in both active migration and passive dispersal. It is discussed that storm-related dynamics within kelp forests may contribute to intense mixing of local populations of these burrow-dwelling isopods, and that most immigrants to young holdfasts probably are individuals emigrating from old holdfasts detached during storm events. The fact that some individuals of all life history stages and both sexes remain in floating holdfasts suggests that limnoriids could successfully reproduce during rafting journeys in floating kelp, facilitating long-distance dispersal. We propose that the coexistence of different modes of dispersal (short distance local migrations and long-distance regional dispersal) within these kelp-dwelling isopods might be advantageous in an environment where unpredictable El Niño events can cause extinction of local kelp forests.","AcknowledgementsWe are grateful for the help from I. Hinojosa, E. Macaya, E. Rothäusler, N. Vásquez and K. Wichmann in the field. Support and constructive suggestions from Pilar Haye are greatly appreciated. Two anonymous reviewers and especially Lars Gutow gave many helpful comments on the manuscript. Financial support for this study provided by projects FONDECYT 1051076 (P. Haye) and 1010356 (M. Thiel).",,Journal of Sea Research,,,,2008-10,2008,,2008-10,60,3,176-183,Closed,Article,"Miranda, Leonardo; Thiel, Martin","Miranda, Leonardo (Facultad de Ciencias del Mar, Universidad Católica del Norte, Larrondo 1281, Coquimbo, Chile); Thiel, Martin (Facultad de Ciencias del Mar, Universidad Católica del Norte, Larrondo 1281, Coquimbo, Chile; Centro de Estudios Avanzados en Zonas Áridas (CEAZA), Coquimbo, Chile)","Thiel, Martin (Catholic University of the North; Centro de Estudios Avanzados en Zonas Áridas (CEAZA), Coquimbo, Chile)","Miranda, Leonardo (Catholic University of the North); Thiel, Martin (Catholic University of the North; Centro de Estudios Avanzados en Zonas Áridas (CEAZA), Coquimbo, Chile)",34,1,,2.69,,https://app.dimensions.ai/details/publication/pub.1025967546,31 Biological Sciences; 3103 Ecology,
245,pub.1019705885,10.1093/icesjms/fsn099,,,"Megafauna community structure and trophic relationships at the recently discovered Concepción Methane Seep Area, Chile, ∼36°S","Abstract
                  Sellanes, J., Quiroga, E., and Neira, C. 2008. Megafauna community structure and trophic relationships at the recently discovered Concepción Methane Seep Area, Chile, ∼36°S. – ICES Journal of Marine Science, 65: 1102–1111. The fauna, community composition, and trophic support of the newly discovered Concepción Methane Seep Area (CMSA) are compared with those at a nearby non-seep control. The assemblage of chemosymbiotic bivalves is defined by eight species, including the families Lucinidae, Thyasiridae, Solemyidae, and Vesicomyidae. Seep polychaetes are represented by Lamellibrachia sp. and two commensal species of the vesicomyid Calyptogena gallardoi. Although taxonomic analysis is still under way, most of the chemosymbiotic species seem to be endemics. The CMSA is a hotspot for non-seep benthic megafauna too; 101 taxa were present, but most of them are colonists or vagrants (i.e. not endemics of methane seeps). Isotope analysis supported the belief that non-symbiont-bearing species utilize photosynthetically fixed carbon, because they were isotopically distinct from the chemosymbiotic bivalve species present. It is our opinion that, at this site, which underlies one of the most productive coastal upwelling regions of the world, spatial heterogeneity and the availability of hard substratum, generated by the presence of authigenic carbonate crusts, are more important factors in attracting non-seep fauna than the availability of locally produced chemosynthetic food.","We thank the captain and crew of the Chilean Navy’s RV “Vidal Gormáz” for support at sea, and R. Coffin and J. Díaz-Naveas, who acted as co-chief scientists in the first expedition (VG-04 cruise). Special thanks for help during SeepOx cruise go to V. A. Gallardo, G. Guzmán, L. Dezileau, W. Alarcón, L. Cárdenas, S. Fuentes, J. González, J. Inostroza, P. Inostroza, L. Muñoz, J. Maturana, and M. Silva. Elena Krylova is acknowledged for her help with the taxonomy of vesicomyids, and we are also grateful to L. A. Levin and A. Thurber (Scripps Institution of Oceanography), D. Desbruyères (IFREMER), and two anonymous referees for providing valuable comments on earlier versions of the manuscript. The work was funded by FONDECYT project No. 1061217 to JS, the Research Direction of the University of Concepción and the Centre of Oceanographic Research in the Eastern-South Pacific (COPAS) of the University of Concepción. Additional support was provided by FONDECYT project No. 1061214 to Práxedes Muñoz, Scripps Institution of Oceanography through NOAA Ocean Exploration program Grant # NOAA NA17RJ1231 to L. A. Levin (for ship’s time and cruise participation of CN and J. González).",,ICES Journal of Marine Science,,,,2008-06-19,2008,2008-06-19,2008-10-01,65,7,1102-1111,All OA; Bronze,Article,"Sellanes, J.; Quiroga, E.; Neira, C.","Sellanes, J. (Facultad de Ciencias del Mar, Departamento de Biología Marina, Universidad Católica del Norte, Larrondo 1281, Coquimbo, Chile, and Centro de Investigación Oceanográfica en el Pacífico Sur-Oriental (COPAS), Universidad de Concepción, Casilla 160-C, Concepción, Chile); Quiroga, E. (Centro de Investigación en Ecosistemas de la Patagonia (CIEP), Bilbao 449, Coyhaique, Chile); Neira, C. (Integrative Oceanography Division, Scripps Institution of Oceanography, 9500 Gilman Drive, La Jolla, CA 92093-0218, USA)","Sellanes, J. (Catholic University of the North; University of Concepción)","Sellanes, J. (Catholic University of the North; University of Concepción); Quiroga, E. (Patagonian Ecosystems Investigation Research Center); Neira, C. (Scripps Institution of Oceanography)",79,5,,6.26,https://academic.oup.com/icesjms/article-pdf/65/7/1102/29131625/fsn099.pdf,https://app.dimensions.ai/details/publication/pub.1019705885,31 Biological Sciences; 3103 Ecology; 37 Earth Sciences,
245,pub.1006984820,10.1016/j.jembe.2007.10.005,,,In situ tests on inducible defenses in Dictyota kunthii and Macrocystis integrifolia (Phaeophyceae) from the Chilean coast,"Numerous experimental studies have reported inducible defenses in macroalgae, but most of them have been conducted in laboratory environments where algae were maintained detached from the substratum and in artificial flow regimes. The results of those experiments might not reflect the natural situation, which can only be studied in situ. We examined whether the brown macroalgae Dictyota kunthii (C. Agardh) Greville and Macrocystis integrifolia (Bory) show inducible defenses following exposure to different grazing levels (direct, water-borne cues from nearby grazed conspecifics, presence of a non-grazing herbivore and natural grazing) in field experiments, striving to maintain natural conditions as much as possible. We measured palatability of algae after exposure to different grazing levels by using live algae and agar-based food containing non-polar extracts. M. integrifolia showed no induction of defenses (at least not of non-polar compounds), suggesting constitutive defenses, absence of defenses (tolerance) or use of another strategy to avoid herbivory. These results are similar to those from previous laboratory experiments. In D. kunthii, defense was induced after two weeks of direct grazing by amphipods under field conditions. Water-borne cues from nearby grazed conspecifics, presence of a non-grazing herbivore and natural grazing did not induce defenses. Induction of defense in response to direct grazing agrees with results from a previous laboratory study, but while indirect cues induced defenses in the laboratory, there was no measurable induced defense in the field. Probably chemical cues from grazers are diluted quickly in the field, not reaching concentrations that cause induction of defenses. This might be the reason why in some algae induction by direct grazing is a more important defensive strategy than induction by water-borne cues. The results from our study also suggest that laboratory experiments showing induced defenses in response to grazed neighbours or mere grazer presence need to be interpreted with caution.","AcknowledgmentsWe are most grateful to S. Boltaña, I. Hinojosa, N. Valdivia, M. Cifuentes, N. Vásquez, L. Miranda, P. Ugalde, M. Weiβ, E. Rothäusler and C. Wichmann for their invaluable help in the field. We also thank M. Molis and particularly two anonymous reviewers for many highly constructive and helpful comments on the manuscript. Joe Buchanan kindly checked the language of the final manuscript. Funding was provided through FONDECYT 1010356. The experiments comply with the current laws of the Republic of Chile. This work was carried out as part fulfillment to obtain the degree of Magister en Ciencias del Mar (M.Sc.) of the first author in the Facultad de Ciencias del Mar, Universidad Católica del Norte, Coquimbo, Chile. [ST]",,Journal of Experimental Marine Biology and Ecology,,,,2008-01,2008,,2008-01,354,1,28-38,Closed,Article,"Macaya, Erasmo C.; Thiel, Martin","Macaya, Erasmo C. (Facultad Ciencias del Mar, Universidad Católica del Norte, Larrondo 1281, Casilla 117, Coquimbo, Chile); Thiel, Martin (Facultad Ciencias del Mar, Universidad Católica del Norte, Larrondo 1281, Casilla 117, Coquimbo, Chile; Centro de Estudios Avanzados en Zonas Áridas (CEAZA), Coquimbo, Chile)","Thiel, Martin (Catholic University of the North; Centro de Estudios Avanzados en Zonas Áridas (CEAZA), Coquimbo, Chile)","Macaya, Erasmo C. (Catholic University of the North); Thiel, Martin (Catholic University of the North; Centro de Estudios Avanzados en Zonas Áridas (CEAZA), Coquimbo, Chile)",22,1,,1.79,,https://app.dimensions.ai/details/publication/pub.1006984820,31 Biological Sciences; 3103 Ecology; 3108 Plant Biology,
244,pub.1093763316,10.1109/sccc.2008.18,,,"A Framework of Composable Access Control Definition, Enforcement and Assurance","This paper proposes an approach for secure software design and coding; and, it provides a formal underpinning for security assurance, i.e., a proof that the generated code correctly realizes security specifications. The base of the proposed approach is a set of security features [17] that separate security concerns from the main design. To create specific access control models, designers can select the features they require, compose them, and represent them through security diagrams [17], i.e., extensions to UML to represent security concerns. These security specifications are then transitioned into aspect-oriented enforcement code. To provide security assurance, this paper formalizes the application behavior using labeled transition systems and structural operational semantics; and it uses simulation relations to demonstrate the correctness of the secure code.",,,,2008 International Conference of the Chilean Computer Science Society,,,2008-11-01,2008,,2008-11-01,,,13-22,Closed,Proceeding,"Pavlich-Mariscal, Jaime A.; Demurjian, Steven A.; Michel, Laurent D.","Pavlich-Mariscal, Jaime A. (Depto. de Ing. de Sistemas y Computacion, Universidad Catolica del Norte, Angamos 0610, Antofagasta, Chile); Demurjian, Steven A. (Depto. de Ing. de Sistemas y Computacion, Universidad Catolica del Norte, Angamos 0610, Antofagasta, Chile); Michel, Laurent D. (Depto. de Ing. de Sistemas y Computacion, Universidad Catolica del Norte, Angamos 0610, Antofagasta, Chile)",,"Pavlich-Mariscal, Jaime A. (Catholic University of the North); Demurjian, Steven A. (Catholic University of the North); Michel, Laurent D. (Catholic University of the North)",5,0,,1.25,,https://app.dimensions.ai/details/publication/pub.1093763316,46 Information and Computing Sciences; 4604 Cybersecurity and Privacy; 4612 Software Engineering; 4613 Theory Of Computation,
