839,pub.1120436477,10.17081/psico.22.42.3546,,,Adaptación al español de cuatro instrumentos para evaluar la teoría de la mente en niños y adolescentes:,"Introduction: Theory of Mind (ToM) is one of the most important dimensions of Social Cognition (SC); it is of great interest for research in Development Psychology, Cognitive Psychology, Neuropsychology, and Social Neuroscience as well as for clinical practice. It has stimulated the creation and validation of instruments to asses this dimension as a cognitive process, but there are few instruments like these in Spanish and less to evaluating children and adolescents. Objective: This paper reports the adaptation into Spanish of four instruments to asses ToM: The Theory of Mind Battery, The Theory of Mind Inventory-2, the Reading the Mind in the Eyes and the Faux Pas Test. Method: The adaptation process was made in two steps first, translation and, second, cultural adaptation. To verify the results a pilot testing was carried out in two groups, one with children between 4 and 13 years old and other with children and adolescents between 6 and 17 years old. Results: Instruments adapted into Spanish are presented as results highlighting the main adjustments made to each tool. Discussion: The importance of creating a protocol with statistical validation to asses ToM are discussed.",,,Psicogente,,,,2019-08-20,2019,2019-08-20,,22,42,1-27,All OA; Gold,Article,"Pineda-Alhucema, Wilmar; Rubio, Rosmira; Aristizábal, Edith T.; Ossa, Julio","Pineda-Alhucema, Wilmar (Universidad Simón Bolívar, Barranquilla, Colombia); Rubio, Rosmira (Universidad Simón Bolívar, Barranquilla, Colombia); Aristizábal, Edith T. (Universidad del Norte, Barranquilla, Colombia); Ossa, Julio (Universidad de San Buenaventura, Cali, Colombia)",,"Pineda-Alhucema, Wilmar (Universidad Simón Bolívar); Rubio, Rosmira (Universidad Simón Bolívar); Aristizábal, Edith T. (Universidad del Norte); Ossa, Julio (Universidad de San Buenaventura)",4,2,,1.08,http://revistas.unisimon.edu.co/index.php/psicogente/article/download/3546/4231,https://app.dimensions.ai/details/publication/pub.1120436477,52 Psychology; 5203 Clinical and Health Psychology,
835,pub.1123714739,10.24265/liberabit.2019.v25n2.04,,,Adaptación y validación del Inventario de Burnout de Maslach en profesionales argentinos de la salud mental,"Objective: the aim of this instrumental study was to adapt the Spanish version of the Maslach Burnout Inventory - Human Services Survey (MBI-HSS) in a sample (n = 544) of Argentinian psychologists and psychiatrists aged 23 to 71. Method: a confirmatory factor analysis (CFA) was conducted to evaluate the internal structure of the instrument using the robust maximum likelihood estimation. Additionally, the internal consistency was calculated using the composite reliability (CR) coefficient. Results: the original structure provided an acceptable ût to the data (CFI = .87, TLI = .86, RMSEA = .06, SRMR = .07). However, the three-factor model had a closer fit to the data after excluding item 12 from the analysis (CFI = .91, TLI = .90, RMSEA = .05, SRMR = .06). The internal consistency yielded very good values (CR > .70). Conclusion: it is concluded that the MBIHSS is a reliable and valid scale to measure burnout in Argentinian psychologists and psychiatrists. The results and their possible implications for future investigations are discussed in this paper.",,,Liberabit Revista Peruana de Psicología,,,,2019-12-15,2019,2019-12-15,2019-12-15,25,2,179-193,All OA; Gold,Article,"Gilla, María Antonella; Giménez, Silvina Belén; Moran, Valeria E.; Olaz, Fabián O.","Gilla, María Antonella (Facultad de Psicología, Universidad Nacional de Córdoba, Argentina); Giménez, Silvina Belén (Facultad de Psicología, Universidad Nacional de Córdoba, Argentina); Moran, Valeria E. (Instituto de Investigaciones Psicológicas (IIPsi) , Universidad Nacional de Córdoba, Argentina; Consejo Nacional de Investigaciones Científicas y Técnicas, Argentina); Olaz, Fabián O. (Facultad de Psicología, Universidad Nacional de Córdoba, Argentina)",,"Gilla, María Antonella (National University of Córdoba); Giménez, Silvina Belén (National University of Córdoba); Moran, Valeria E. (Instituto de Investigaciones Psicológicas; National Scientific and Technical Research Council); Olaz, Fabián O. (National University of Córdoba)",12,6,,3.25,http://ojs3.revistaliberabit.com/index.php/Liberabit/article/download/248/206,https://app.dimensions.ai/details/publication/pub.1123714739,52 Psychology; 5203 Clinical and Health Psychology,3 Good Health and Well Being
834,pub.1120135685,10.18046/recs.iespecial.3223,,,"“Yo me defiendo”: entendiendo la informalidad laboral a partir del trabajo de las mujeres mototaxistas en Barranquilla, Colombia","Through the lens of the subjective experience of women who drive moto-taxis in Barranquilla, Colombia, this article explores the interaction between labor informality, precarious working conditions, and gender. Based on the information obtained from in-depth interviews, ethnographic observation, and focus groups, the article questions the usual approaches to city, gender, and labor informality to the extent that they do not represent properly the subjective experiences of the workers, they flatten the analysis of the differential consequences for women in this type of work, and they produce images of insecurity and instability that are not necessarily perceived by these women. The article proposes a change of perspective in terms of analyses of gender and cities in general through a mobile perspective of the mobility analyses. We explore three movements on mobility: (i) the movement of work in cities outside its margins, (ii) the mobility of identities, and (iii) the paradox of care as a circular movement.
Este artículo explora la interacción entre la informalidad laboral, las condiciones precarias del trabajo y el género, a través del lente de la experiencia subjetiva de las mujeres mototaxistas en Barranquilla, Colombia. A partir de la información obtenida de entrevistas en profundidad, observación etnográfica y grupos focales, el artículo pone en cuestión las aproximaciones usuales sobre ciudad, género e informalidad laboral. Lo anterior, en la medida en que no representan adecuadamente las experiencias subjetivas de las trabajadoras, aplanan el análisis sobre las consecuencias diferenciales para las mujeres en este tipo de trabajos y producen imágenes de inseguridad e inestabilidad no necesariamente percibidas por ellas. El artículo propone cambiar la mirada de los análisis de género y ciudad, en general, a través de una perspectiva itinerante de los análisis de movilidad. Se exploran aquí tres movimientos: 1) el del trabajo en las ciudades fuera de sus márgenes; 2) la movilidad de las identidades; y 3) la paradoja del cuidado como movimiento circular.",,,Revista CS,,,,2019-07-03,2019,2019-07-03,,,Especial,23-47,All OA; Gold,Article,"Buchely, Lina; Castro, María Victoria","Buchely, Lina (Universidad Icesi, Cali); Castro, María Victoria (Universidad de los Andes, Bogotá)",,"Buchely, Lina (Icesi University); Castro, María Victoria (Universidad de Los Andes)",6,4,,,https://www.icesi.edu.co/revistas/index.php/revista_cs/article/download/3223/3689,https://app.dimensions.ai/details/publication/pub.1120135685,,
834,pub.1111302404,10.19130/iifl.litmex.30.1.2019.1161,,,Ambigüedad de la imagen: la dimensión pulsional en El diablo en el ojo de Jesús Gardea,"As Jesús Gardea was developing his narrative, the poetic image became one of his main stylistic resources as in the novel El diablo en el ojo (1989). His handiwork in the narrative reveals a zone of ambiguity from which emerges a dimension of driving forces in history. This article analyzes how this dimension is stylistically expressed in two initial passages of the novel, understood from the notions of Freud(life and death impulses), with the aim of investigating the ambiguous character of the image and the world vision that is projected. Prior to this, the complexity of the language and the way of narrating through images (metaphorical development) of Gardea is examined based on a necessary review of his conception of writing.",,,Literatura Mexicana,,,,2019-01-08,2019,2019-01-08,,30,1,115-140,All OA; Gold,Article,"Jiménez, Daniel Samperio","Jiménez, Daniel Samperio (Universidad Autónoma Metropolitana –Azcapotzalco)",,"Jiménez, Daniel Samperio (Universidad Autónoma Metropolitana)",0,0,,0.0,https://revistas-filologicas.unam.mx/literatura-mexicana/index.php/lm/article/download/1161/1154,https://app.dimensions.ai/details/publication/pub.1111302404,"47 Language, Communication and Culture; 4705 Literary Studies",
829,pub.1117949630,10.14718/acp.2019.22.2.6,,,Relación entre estilos parentales disfuncionales empatía y variables sociodemográficas en estudiantes de enfermería medicina humana y psicología.,"The objective of this study was to establish the relationship between dysfunctional parenting styles and empathy in Nursing, Human Medicine and Psychology students. The study’s sample consisted of 599 students, from both genders, and from different cycles of their university studies. Their ages ranged between 21 and 25 years. To assess them, the Dysfunctional Parenting Styles Scale by Parker, et al. (1979) was used, previously adapted to Peruvian population. The participants were also evaluated with the Personal and Professional Empathy Scale designed by Yaraskavitch (2009), and completed a socio-demographic data sheet created ad hoc. General results showed no significant relationships between the dysfunctional parenting styles and empathy total scores. In contrast, considering the father figure, an inverse relationship between the authoritarian-controlling dysfunctional parenting style and the personal and professional cognitive empathy was found, while the indifference – negligence dysfunctional parenting style was inversely associated with the emotive personal empathy. As to the mother figure, there is a significant and direct relationship between authoritarian-controlling dysfunctional parenting style and personal and professional emotive empathy. It was also found that regarding gender, women have higher levels of empathy. With respect to professional degree courses, nursing students have a higher level of empathy than Medicine and Psychology students, while Medicine students have more dysfunctional parenting styles than the Nursing and Psychology groups. Finally, students that had taken personal development courses showed a higher level of empathy.",,,Acta Colombiana de Psicología,,,,2019,2019,2019,2019,22,2,99-124,All OA; Gold,Article,"Calvet, Maria Luisa Matalinares; Díaz-Acosta, Ana Gloria; Rivas-Díaz, Luisa Hortensia; Arenas-Iparraguirre, Carlos Alberto; Baca-Romero, Deyvi; Raymundo-Villalva, Ornella; Rodas-Vera, Nikolai","Calvet, Maria Luisa Matalinares (Universidad Nacional Mayor de San Marcos); Díaz-Acosta, Ana Gloria (Universidad Nacional Mayor de San Marcos); Rivas-Díaz, Luisa Hortensia (Universidad Nacional Mayor de San Marcos); Arenas-Iparraguirre, Carlos Alberto (Universidad Nacional Mayor de San Marcos); Baca-Romero, Deyvi (Universidad Inca Garcilaso de la Vega); Raymundo-Villalva, Ornella (Universidad Científica del Sur); Rodas-Vera, Nikolai (Universidad Cesar Vallejo)",,"Calvet, Maria Luisa Matalinares (National University of San Marcos); Díaz-Acosta, Ana Gloria (National University of San Marcos); Rivas-Díaz, Luisa Hortensia (National University of San Marcos); Arenas-Iparraguirre, Carlos Alberto (National University of San Marcos); Baca-Romero, Deyvi (Universidad Inca Garcilaso de la Vega); Raymundo-Villalva, Ornella (Scientific University of the South); Rodas-Vera, Nikolai (Universidad César Vallejo)",1,0,,0.27,https://actacolombianapsicologia.ucatolica.edu.co/article/download/2108/2603,https://app.dimensions.ai/details/publication/pub.1117949630,52 Psychology; 5203 Clinical and Health Psychology,3 Good Health and Well Being
805,pub.1127028532,10.21158/01208160.n86.2019.2292,,,Intención emprendedora en Colombia: el caso de los estudiantes de Maestría en Administración,"Rev.esc.adm.neg The objective of this investigation was to determine how the factors that influence the entrepreneurial intention (EI) in Colombia are associated and which of them are of greater relevance. The methodology that was used was descriptive with a correlational focus. This study was based on the Theory of Planned Behavior,, involving socioeconomic variables and the facility to do business according to Doing Business.  To this end, an information collection instrument was used on a sample of 485 students enrolled in 36 Master of Business Administration (MBA) degree programs in Colombia. Data were processed using two statistic methods: Multiple Correspondence Analysis (MCA) and Logistic Regression (LR). This research led to establish nine factors that characterize the Colombian entrepreneurial intention (EI) in MBA students in Colombia, from which three correspond to social norms, two of them are associated with attitudes, two of them belong to behavior control, and two others involving socioeconomic issues. Similarly, according to MCA, it was found that students with a higher EI are closely related with cities that have high and medium facilities to do business. This relationship may be based on the fact that the populations in which there are more opportunities to create companies have a more appropriate context that facilitates entrepreneurial activity. In conclusion, a higher entrepreneurial intention is determined by the combination of these variables, which in order of importance correspond to social norms, attitudes, and behavior control together with some socioeconomic issues.",,,Revista Escuela de Administracion de Negocios,,,,2019-09-03,2019,2019-09-03,,,86,93-113,All OA; Gold,Article,"Tarapuez-Chamorro, Edwin; Flórez-Laiseca, Adriana María; Giraldo-Correa, María Patricia","Tarapuez-Chamorro, Edwin (Universidad del Quindío); Flórez-Laiseca, Adriana María (Universidad del Quindío); Giraldo-Correa, María Patricia (Universidad del Quindío)",,"Tarapuez-Chamorro, Edwin (University of Quindío); Flórez-Laiseca, Adriana María (University of Quindío); Giraldo-Correa, María Patricia (University of Quindío)",1,0,,0.37,https://journal.ean.edu.co/index.php/Revista/article/download/2292/1891,https://app.dimensions.ai/details/publication/pub.1127028532,"35 Commerce, Management, Tourism and Services; 3507 Strategy, Management and Organisational Behaviour",
805,pub.1120860129,10.4067/s0717-73562019005001801,,,"CRONOLOGA DEL PERIODO MEDIO EN EL VALLE DE AZAPA, NORTE DE CHILE: ESTILOS, FECHADOS Y CONTEXTOS CULTURALES DEL POBLAMIENTO HUMANO","Resumen: Se presentan los resultados del anlisis de 116 fechados radiomtricos obtenidos por medio del mtodo de Carbono 14 (C14) y Termoluminiscencia (TL). Los fechados fueron tomados de nueve estudios publicados, desarrollados en el Valle de Azapa. Las muestras datadas fueron obtenidas de entierros (cuerpos) y ofrendas (cermicas) de cementerios vinculados al periodo Medio. Cronolgicamente este periodo ha sido asociado a la presencia del Horizonte Tiwanaku en los Valles Occidentales, 500 al 1000 DC, cuyo rasgo ms representativo es la presencia de cermica decorada con formas de keros, tazones, pucos y jarras. Sin embargo, los fechados obtenidos vinculados con estos estilos cermicos corresponden mayormente a dataciones tardas, en un rango desde los 900 al 1100 DC cal. Por otra parte, la informacin reciente obtenida del cementerio Az-115 sobre nuevas dataciones, muestran que en los primeros ocho siglos del primer milenio de la Era Cristiana en el poblamiento azapeo no se observa una presencia Tiwanaku, sino ms bien una continuidad aldeana vinculada a una historia local con races en el periodo Formativo. El presente estudio, apunta a: (a) caracterizar los inicios y el desarrollo del periodo Medio en el Valle de Azapa, tomando como indicadores diagnsticos los registros de los cementerios Az-115 y Az-75, los que presentan evidencias de un proceso agrcola aldeano de carcter local, incluso con evidencias relacionadas al periodo Formativo, abarcando el periodo Medio hasta el siglo VIII, y (b) definir una segunda etapa o fase II para periodo Medio en el Valle de Azapa, caracterizada por la consolidacin de un poblamiento local aldeano. En esta segunda fase, los estilos corresponden a Cabuza, Maitas y Chiribaya, que caracterizaran los estilos cermicos locales y habran coexistido con estilos vinculados con Tiwanaku. Al parecer es en esta etapa en donde las poblaciones locales comienzan a definir una identidad regional en nuestros valles cuya expresin final la observamos en lo que se conoce como Cultura Arica, alfarera que caracteriza el periodo Intermedio Tardo (PIT) en los valles y costa de Arica. Abstract: The results are presented of the analysis of a set of 116 radiometric dates obtained through the method of Carbon 14 (C14) and thermoluminescence (TL) dating. These datings were taken from nine published studies carried out in the Azapa Valley. Regarding dated samples, these were mostly taken from burials (bodies) and offerings (ceramic) from cemeteries in the Azapa Valley linked to the Middle period. Chronologically this period has been associated with the presence of the Tiwanaku Horizon in the western valleys, 500 to 1000 AD, and its most representative feature is the presence of painted pottery with forms of keros, bowls, pucos and jars. However, the datings obtained for these ceramics mostly correspond to late datings within a range from Cal 900 to 1100 AD. On the other hand, recent information obtained from cemetery Az-115 on new dates indicates that in the first eight centuries of the first millennium of the Christian era there is no Tiwanaku presence in the Azapeo settlement, but rather a type of village continuity linked to a local history with roots in the Formative period. The present study aims: (a) to characterize the beginnings and development of the Middle period in the Azapa Valley, taking as diagnostic elements the site records of cemeteries Az -115 and Az-75, which present evidence of a local village agricultural process, including evidence related to the Formative period, spanning the Middle period until the eighth century AD; and (b) to define a second stage or phase II of the Middle period in the Azapa Valley, characterized by the consolidation of a local village settlement. In this second phase, the Cabuza, Maitas and Chiribaya styles would characterize the local ceramic styles and would also coexist mainly with styles related to Tiwanaku. Apparently, this is the stage in which local people began to define their own regional identity, whose final expression can be observed in our valleys in what is known as Arica Culture, pottery that characterizes the late Intermediate period (LIP) in the valleys and coast of Arica.",,,Chungara - Revista de Antropología Chilena,,,,2019,2019,2019,,51,ahead,595-611,All OA; Gold,Article,"Ovalle, Ivn Muoz","Ovalle, Ivn Muoz ()",,"Ovalle, Ivn Muoz ()",13,7,,3.65,https://scielo.conicyt.cl/pdf/chungara/v51n4/0717-7356-chungara-01801.pdf,https://app.dimensions.ai/details/publication/pub.1120860129,44 Human Society; 4406 Human Geography,
801,pub.1120860132,10.4067/s0717-73562019005001804,,,LAS CAJAS DE SANTOS Y SU RELACIN CON LOS CIRCUITOS DE LA MEMORIA (ESTACIN SAN PEDRO),"Resumen: Este trabajo se refiere a las cajas de madera de San Antonio de Padua existentes en la localidad de San Pedro Estacin o Estacin San Pedro (Cuenca San Pedro-Inacaliri, II regin, Antofagasta, Chile). El artculo se inserta en la discusin actual sobre la vida social de los objetos, siendo la etnografa, la visualidad y la etnohistoria las puertas de acceso para dar cuenta de estos cajones porttiles y sus vnculos con antiguos y actuales circuitos de gentes, memorias e historias diversas y compartidas. Se explora el cajn porttil en tanto manufactura europea y su insercin en los Andes del Sur, adquiriendo caractersticas propias tanto en Bolivia como en Per. Se reconoce cmo los cajones de santos llegaron a San Pedro Estacin, dando cuenta de sus vnculos y relacin significativa con los circuitos de la memoria, sus viajes, el pasado, el presente y lo cosmolgico. Abstract: This work refers to the San Antonio de Padua wooden boxes existing in San Pedro Estacin or San Pedro Station (Cuenca San Pedro-Inacaliri, II region, Antofagasta, Chile). The article is inserted in the current discussion about the social life of objects, being ethnography, visuality and ethnohistory the access doors to account for these portable drawers and their links with ancient and current circuits of people, memories and stories diverse and shared. The portable drawer is explored in both Eu- ropean manufacturing and its insertion in the Southern Andes, acquiring its own characteristics in both Bolivia and Peru. It is recognized how the boxes of saints arrived at San Pedro Estacin, giving an account of their links and significant relationship with the circuits of memory, their travels, the past, the present and the cosmological.",,,Chungara - Revista de Antropología Chilena,,,,2019,2019,2019,,51,ahead,639-660,All OA; Gold,Article,"Odone-Correa, Mara-Carolina","Odone-Correa, Mara-Carolina ()",,"Odone-Correa, Mara-Carolina ()",2,1,,,https://scielo.conicyt.cl/pdf/chungara/v51n4/0717-7356-chungara-01804.pdf,https://app.dimensions.ai/details/publication/pub.1120860132,,
799,pub.1123703109,10.35305/lt.v23i1.687,,,Radio Diferencia: significados sobre el uso terapéutico de la comunicación,"La siguiente investigación explora, desde una perspectiva cualitativa, el rol de un medio de comunicación radiofónico como complemento terapéutico de usuarios y usuarias de salud mental. Considerando la comunicación una actividad inherente al ser humano y, en consecuencia, sus ejercicios a disposición de las comunidades, se admite la existencia de múltiples experiencias periodísticas que permiten el desarrollo de iniciativas como la expuesta en este texto. El trabajo se sitúa en Valparaíso, donde, en dependencias del Hospital Del Salvador, hace 13 años transmite Radio Diferencia, una agrupación comunitaria sin fines de lucro impulsada por personas con diagnóstico psicopatológico. La contribución que la radiofonía realiza al proceso terapéutico de sus integrantes se entiende desde la valoración de los propios miembros de la organización como un espacio para el desarrollo de habilidades sociales, comunicativas y expresivas, junto con la vinculación de los usuarios con su entorno y un apoyo multidimensional de recuperación e inserción social.",,,La Trama de la Comunicación,,,,2019-04-17,2019,2019-04-17,,23,1,123-142,All OA; Gold,Article,"Saavedra, Moisés Valenzuela; Lazcano-Peña, Daniela","Saavedra, Moisés Valenzuela (Pontificia Universidad Católica de Valparaíso); Lazcano-Peña, Daniela (Pontificia Universidad Católica de Valparaíso)",,"Saavedra, Moisés Valenzuela (Pontificial Catholic University of Valparaiso); Lazcano-Peña, Daniela (Pontificial Catholic University of Valparaiso)",0,0,,,https://latrama.fcpolit.unr.edu.ar/index.php/trama/article/download/687/469,https://app.dimensions.ai/details/publication/pub.1123703109,,
799,pub.1117811318,10.15446/anpol.v32n95.80827,,,"Argumentación para la paz. Avances y desafíos para su enseñanza, como parte de los acuerdos sobre participación política entre el Estado colombiano y las Farc-Ep","The second item of the Peace Agreement between the Farc-Ep and the Colombian State involves education for peace, within the framework of the recognition of political opposition and the divergence of opinions. The Cátedra de la Paz, as a public policy, is central to achieving that goal insofar as it mandates a curricular space for all levels of education in the country. This paper analyzes the vision of the conflict in the main documents of this policy, reviews in them the emotions / reasons antithesis and interrelates these two elements with the teaching project of the argumentation in the guidelines and curricula. In the conclusions, emphasis is placed on the link between the Cátedra de la Paz and the implementation of the Agreement signed in 2016, especially with regard to cultural transformations at the level of dissent, conflict and argumentative dialogue.",,,Análisis Político,,,,2019-01-01,2019,2019-01-01,,32,95,23-41,All OA; Gold,Article,"Gómez, Yulia Katherine Cediel; Arias, Giohanny Olave; Estupiñán, Mireya Cisneros","Gómez, Yulia Katherine Cediel (Universidad Tecnológica, Pereira, Colombia); Arias, Giohanny Olave (Universidad Industrial, Santander, Colombia); Estupiñán, Mireya Cisneros (Universidad Tecnológica, Pereira, Colombia; Universidad Industrial, Santander, Colombia)",,"Gómez, Yulia Katherine Cediel (Technological University of Pereira); Arias, Giohanny Olave (Universidad Industrial, Santander, Colombia); Estupiñán, Mireya Cisneros (Technological University of Pereira; Universidad Industrial, Santander, Colombia)",5,2,,2.98,https://revistas.unal.edu.co/index.php/anpol/article/download/80827/71449,https://app.dimensions.ai/details/publication/pub.1117811318,39 Education; 44 Human Society; 4408 Political Science,"16 Peace, Justice and Strong Institutions"
