"About the data: Exported on Oct 01, 2024. Criteria: '""Universidad del Norte"" OR ""universidad del norte"" OR ""University of the North"" OR ""university of the north"" OR ""Uninorte"" OR ""uninorte""' in full data; Publication Year is 2019; Publication Type is Article; Journal List is SciELO; Open Access is Gold.  Note: For hyper-authorship publications with more than 100 authors the export does not include author names and affiliations. © 2024 Digital Science &amp; Research Solutions Inc. All rights reserved. Parts of this work may also be protected by copyright of content providers and other third parties, which together with all rights of Digital Science, user agrees not to violate. Redistribution / external use of this work (or parts thereof) is prohibited without prior written approval. Please contact info@dimensions.ai for further information.",,,,,,,,,,,,,,,,,,,,,,,,,,,,,,,,,
Rank,Publication ID,DOI,PMID,PMCID,Title,Abstract,Acknowledgements,Funding,Source title,Anthology title,Book editors,MeSH terms,Publication date,PubYear,Publication date (online),Publication date (print),Volume,Issue,Pagination,Open Access,Publication Type,Authors,Authors (Raw Affiliation),Corresponding Authors,Authors Affiliations,Times cited,Recent citations,RCR,FCR,Source Linkout,Dimensions URL,Fields of Research (ANZSRC 2020),Sustainable Development Goals
8963,pub.1120953319,10.7705/biomedica.v39i2.4428,31529826,,Evaluación de un método de amplificación isotérmica medida por bucle para la detección rápida del virus sincitial respiratorio en niños con infección respiratoria aguda,"Introduction: Human respiratory syncytial virus (hRSV) is the most frequent cause of acute respiratory infection of the lower respiratory tract in children under the age of five. The development of molecular techniques able to identify hRSV is one of the current challenges in the field of clinical research.
Objective: To evaluate the ability of an isothermal amplification method to rapidly detect hRSV in children with acute respiratory infection.
Materials and methods: We collected 304 nasopharyngeal swab samples from children with symptoms of acute respiratory infection who attended the emergency unit at Hospital de la Universidad del Norte in Barranquilla from April, 2016, to July, 2017. After extracting viral RNA from the samples, we evaluated the ability of the reverse transcriptase-loop-mediated isothermal amplification (RT-LAMP) M assay to rapidly detect hRSVA and hRSVB compared to other molecular techniques: quantitative PCR (qPCR), reverse transcriptase-LAMP L assay, and as a standard, the multiplex nested reverse transcriptase polymerase chain reaction (nested RT-PCR).
Results: The RT-LAMP M assay had a sensitivity of 93.59% and a specificity of 92.92%, and a concordance of 0.83 ± 0.036 as compared with the nested RT-PCR test. While the Kappa index of the RT-LAMP M assay was higher than the values for the RT-LAMP L assay and the qPCR, the values of the latter two methods were in agreement (0.75 ± 0.043 and 0.71 ± 0.045, respectively).
Conclusion: Due to the shorter running times, lower costs and better performance of the RT-LAMP M assay, it can be considered as a useful clinical tool for the detection of RSVA.",,,Biomédica,,,"Child, Preschool; Cross-Sectional Studies; Early Diagnosis; Female; Humans; Infant; Male; Nasopharynx; Nucleic Acid Amplification Techniques; Polymerase Chain Reaction; RNA, Viral; Respiratory Syncytial Virus Infections; Respiratory Syncytial Virus, Human; Sensitivity and Specificity",2019-06-15,2019,2019-06-15,,39,2,415-426,All OA; Gold,Article,"Bettin-Martínez, Alfonso; Villareal-Camacho, José; Cervantes-Acosta, Guillermo; Acosta-Reyes, Jorge; Barbosa, Juliana; San Juan, Homero","Bettin-Martínez, Alfonso (Departamento de Medicina, Universidad del Norte, Barranquilla, Colombia; Posgrado de Microbiología, Universidad Metropolitana, Barranquilla, Colombia); Villareal-Camacho, José (Programa de Medicina, Universidad Libre, Barranquilla, Colombia); Cervantes-Acosta, Guillermo (Departamento de Medicina, Universidad del Norte, Barranquilla, Colombia); Acosta-Reyes, Jorge (Departamento de Salud Pública, Universidad del Norte, Barranquilla, Colombia); Barbosa, Juliana (Grupo de Virología, Instituto Nacional de Salud, Bogotá, D.C., Colombia); San Juan, Homero (Departamento de Medicina, Universidad del Norte, Barranquilla, Colombia)",,"Bettin-Martínez, Alfonso (Universidad del Norte; Universidad Metropolitana); Villareal-Camacho, José (Free University of Colombia); Cervantes-Acosta, Guillermo (Universidad del Norte); Acosta-Reyes, Jorge (Universidad del Norte); Barbosa, Juliana (Instituto Nacional de Salud); San Juan, Homero (Universidad del Norte)",1,1,,0.24,https://revistabiomedica.org/index.php/biomedica/article/download/4428/4037,https://app.dimensions.ai/details/publication/pub.1120953319,32 Biomedical and Clinical Sciences; 3202 Clinical Sciences; 3207 Medical Microbiology,
7921,pub.1121231439,10.1590/0001-3765201920180860,31553367,,"Seroprevalence of Zika virus among blood donors before the epidemic in Barranquilla, Colombia, 2015-2016.","The first cases of Zika virus infection in Colombia were reported and confirmed in October 2015. The objective of the study was estimate the seroprevalence of ZIKV infection during the pre-epidemic phase in Barranquilla, Colombia, and demonstrate the presence of virus before the Colombian Ministry of Health confirmed the first case. We conducted a descriptive study of the seroprevalence of Zika virus in 390 samples obtained from a blood bank located in Barranquilla, Colombia - a city endemic for dengue, and with a recent history of a Chikungunya disease epidemic. The serum pools were tested using Euroimmun ZIKV ELISA kit. Seroprevalence of Zika virus IgG were: May 2015: 0%, June and July 2015: 2.62% (95% CI = 0.28-12.13) and August 2015: 5.35% (95% CI = 1.74-16.74). This brings to our attention the need for extending the surveillance period of this virus in order to adequately assess its teratogenic effects.","We would like to thank to the Banco Nacional de Sangre and to the Universidad del Norte, Barranquilla, Colombia.",,Anais da Academia Brasileira de Ciências,,,"Antibodies, Viral; Blood Donors; Colombia; Enzyme-Linked Immunosorbent Assay; Humans; Immunoglobulin G; Seroepidemiologic Studies; Zika Virus; Zika Virus Infection",2019,2019,2019,,91,03,e20180860,All OA; Gold,Article,"Bayona-Pacheco, Brayan; Acosta-Reyes, Jorge; Navarro, Edgar; San-Juan, Homero; Bula, Johan; Baquero, Hernando","Bayona-Pacheco, Brayan (Departamento de Medicina, División Ciencias de la Salud, Universidad del Norte, Km 5, vía Puerto Colombia, Área Metropolitana de Barranquilla, Colombia.); Acosta-Reyes, Jorge (Departamento de Salud Pública, División Ciencias de la Salud, Universidad del Norte, Km 5, vía Puerto Colombia, Área Metropolitana de Barranquilla, Colombia.); Navarro, Edgar (Departamento de Salud Pública, División Ciencias de la Salud, Universidad del Norte, Km 5, vía Puerto Colombia, Área Metropolitana de Barranquilla, Colombia.); San-Juan, Homero (Departamento de Medicina, División Ciencias de la Salud, Universidad del Norte, Km 5, vía Puerto Colombia, Área Metropolitana de Barranquilla, Colombia.); Bula, Johan (Banco Nacional de Sangre, Carrera, 50 # 80-192, Barranquilla, Atlántico, Colombia.); Baquero, Hernando (Departamento de Medicina, División Ciencias de la Salud, Universidad del Norte, Km 5, vía Puerto Colombia, Área Metropolitana de Barranquilla, Colombia.)",,"Bayona-Pacheco, Brayan (Universidad del Norte); Acosta-Reyes, Jorge (Universidad del Norte); Navarro, Edgar (Universidad del Norte); San-Juan, Homero (Universidad del Norte); Bula, Johan (Banco Nacional de Sangre, Carrera, 50 # 80-192, Barranquilla, Atlántico, Colombia.); Baquero, Hernando (Universidad del Norte)",6,1,0.2,1.07,http://www.scielo.br/pdf/aabc/v91n3/0001-3765-aabc-91-03-e20180860.pdf,https://app.dimensions.ai/details/publication/pub.1121231439,32 Biomedical and Clinical Sciences; 3207 Medical Microbiology,3 Good Health and Well Being
7772,pub.1124085687,10.15446/rsap.v21n1.77725,33206929,,"Health-Related Quality of Life of an adult population sample in Barranquilla, Colombia","OBJECTIVE: The aim of this study was to estimate values of health-related quality of life (HRQOL) by focusing on the physical and mental health of an adult population sample in the city of Barranquilla, Colombia.
MATERIALS AND METHODS: Cross-sectional study with 368 adults representing an adult population. The questionnaires included the health-related quality of life ""CDC-Healthy Days"", the Zung Self-Rating Depression Scale, and the Overall Disability Sum Score. The prevalence of fair or poor health status (FPH), frequent physical distress (FPD), frequent mental distress (FMD), and frequent activity limitation (FAL) was estimated according to socio-demographic characteristics, presence of depression, and physical disability.
RESULTS: The mean age of 368 adults was 45.6 ± 18.3 years; 55.7% were males. Only 21% of this population considered their general health to be fair or poor. The prevalence of FPH, FPD, FMD and FAL was higher in women than in men, and increased with greater severity of depression and higher physical disability. Moreover, 12% of the population presented with mild depression, 3.8% with moderate depression, and less than 1% with severe depression. 94% of this population did not have an arms or legs disability.
DISCUSSION: This study provides HRQOL values for an adult sample of the population of Barranquilla, Colombia. Overall, the HRQOL of this population, with subtle differences, is similar to other reports from Colombia. In general, women and people with depression and physical disabilities had a worse quality of life.",,,Revista de Salud Pública,,,"Activities of Daily Living; Adult; Aged; Aged, 80 and over; Colombia; Cross-Sectional Studies; Depression; Disability Evaluation; Female; Health Status; Health Status Indicators; Humans; Male; Mental Health; Middle Aged; Quality of Life; Self Report; Urban Health",2019-01-01,2019,2019-01-01,2019-01-01,21,1,70-76,All OA; Gold,Article,"Acosta-Reyes, Jorge; Navarro-Lechuga, Edgar; Benitez, Juan C; Bravo, Elsa; Goenaga, Eloina; Galindo, José I; Walteros-Acero, Diana M","Acosta-Reyes, Jorge (JA: MD. M.Sc Clinical Epidemiology. Department of Public Health, Universidad del Norte. Barranquilla, Colombia. acostajl@uninorte.edu.co.); Navarro-Lechuga, Edgar (EN: MD. M.Sc Epidemiology. Department of Public Health, Universidad del Norte. Barranquilla, Colombia. enavarro@uninorte.edu.co.); Benitez, Juan C (JCB: Psicología, M.Sc Epidemiology. Universidad del Norte. Barranquilla, Colombia. benitezcj@uninorte.edu.co.); Bravo, Elsa (EB: Bacteriology, Epidemiology Specialist. Secretaría de Salud de Barranquilla. Barranquilla, Colombia. ebravo@barranquilla.gov.co.); Goenaga, Eloina (EG: MD. M.Sc Epidemiology. Secretaría de Salud de Barranquilla. Barranquilla, Colombia. egoenaga@barranquilla.gov.co.); Galindo, José I (JIG: Dentistry. M.Sc Epidemiology, Ph. D. Epidemiology and Public Health Interventions Network TEPHINET, Institute for Global Health. Georgia, USA. jgalindo@taskforce.org.); Walteros-Acero, Diana M (DW: MD. M.Sc Epidemiology. Field Epidemiology Training Program (FETP). Instituto Nacional de Salud. Bogotá, Colombia. dwalteros@ins.gov.co.)",,"Acosta-Reyes, Jorge (Universidad del Norte); Navarro-Lechuga, Edgar (Universidad del Norte); Benitez, Juan C (Universidad del Norte); Bravo, Elsa (EB: Bacteriology, Epidemiology Specialist. Secretaría de Salud de Barranquilla. Barranquilla, Colombia. ebravo@barranquilla.gov.co.); Goenaga, Eloina (EG: MD. M.Sc Epidemiology. Secretaría de Salud de Barranquilla. Barranquilla, Colombia. egoenaga@barranquilla.gov.co.); Galindo, José I (JIG: Dentistry. M.Sc Epidemiology, Ph. D. Epidemiology and Public Health Interventions Network TEPHINET, Institute for Global Health. Georgia, USA. jgalindo@taskforce.org.); Walteros-Acero, Diana M (DW: MD. M.Sc Epidemiology. Field Epidemiology Training Program (FETP). Instituto Nacional de Salud. Bogotá, Colombia. dwalteros@ins.gov.co.)",3,0,0.13,0.9,https://revistas.unal.edu.co/index.php/revsaludpublica/article/download/77725/72994,https://app.dimensions.ai/details/publication/pub.1124085687,42 Health Sciences; 4203 Health Services and Systems,3 Good Health and Well Being
6803,pub.1113831585,10.1590/0037-8682-0194-2018,31038620,,"Prevalence of cryptococcosis in Atlántico, department of Colombia assessed with an active epidemiological search","INTRODUCTION: Cryptococcosis is the second most frequent cause of opportunistic infections in human immunodeficiency virus (HIV) patients in Colombia. We aimed to determine the prevalence of cryptococcosis in the Colombian department of Atlántico.
METHODS: An active search for cryptococcosis cases was conducted between 2015 and 2017 in health institutions by distributing surveys to clinicians and characterizing samples phenotypically and genotypically.
RESULTS: Thirty-eight cryptococcosis cases were identified (81.6% men, 76.3% HIV patients). The calculated annual prevalence was 5.08/1 million inhabitants. Cryptococcus neoformans var. grubii VNI was isolated in 34 cases.
CONCLUSIONS: These results provide the basis for passive surveillance of cryptococcosis.","Financial Support: Financial support was received by the Universidad Metropolitana (Acuerdo 067 of April 19, 2016). We would like to express our gratitude to the laboratory personnel and clinicians at the participating public and private health institutions: Adriana Marín, Clínica General del Norte; Samir Viloria, Hospital Universidad del Norte; Dr. Iván Zuluaga and Rosa Barraza, Hospital General de Barranquilla; Juana Escorcia, Fundación Hospital Universitario Metropolitano; Ilda Jaimes, Clínica Reina Catalina; Johanna Soto, Clínica de la Costa and Alejandrina Gómez, Clínica La Misericordia. We also thank Dr. Simon Dingsdag for reviewing the manuscript.",,Revista da Sociedade Brasileira de Medicina Tropical,,,Adolescent; Adult; Child; Colombia; Cryptococcosis; Cryptococcus gattii; Cryptococcus neoformans; Female; Genotype; Humans; Male; Middle Aged; Molecular Typing; Phenotype; Prevalence; Young Adult,2019,2019,2019,,52,,e20180194,All OA; Gold,Article,"Noguera, María Clara; Escandón, Patricia; Arévalo, Merle; García, Yina; Suárez, Luz Estela; Castañeda, Elizabeth","Noguera, María Clara (Grupo Caribe de Enfermedades Infecciosas, Universidad Metropolitana, Barranquilla, Atlántico, Colombia., Grupo Caribe de Enfermedades Infecciosas, Universidad Metropolitana, Barranquilla, Atlántico, Colombia); Escandón, Patricia (Grupo Microbiología, Instituto Nacional de Salud, Bogotá, Colombia., Grupo Microbiología, Instituto Nacional de Salud, Bogotá, Colombia); Arévalo, Merle (Grupo Caribe de Enfermedades Infecciosas, Universidad Metropolitana, Barranquilla, Atlántico, Colombia., Grupo Caribe de Enfermedades Infecciosas, Universidad Metropolitana, Barranquilla, Atlántico, Colombia); García, Yina (Grupo Caribe de Enfermedades Infecciosas, Universidad Metropolitana, Barranquilla, Atlántico, Colombia., Grupo Caribe de Enfermedades Infecciosas, Universidad Metropolitana, Barranquilla, Atlántico, Colombia); Suárez, Luz Estela (Programa Maestría en Microbiología, Universidad Metropolitana, Barranquilla, Atlántico, Colombia., Programa Maestría en Microbiología, Universidad Metropolitana, Barranquilla, Atlántico, Colombia); Castañeda, Elizabeth (Grupo Microbiología, Instituto Nacional de Salud, Bogotá, Colombia., Grupo Microbiología, Instituto Nacional de Salud, Bogotá, Colombia)",,"Noguera, María Clara (Universidad Metropolitana); Escandón, Patricia (Instituto Nacional de Salud); Arévalo, Merle (Universidad Metropolitana); García, Yina (Universidad Metropolitana); Suárez, Luz Estela (Universidad Metropolitana); Castañeda, Elizabeth (Instituto Nacional de Salud)",2,0,0.25,0.47,http://www.scielo.br/pdf/rsbmt/v52/1678-9849-rsbmt-52-e20180194.pdf,https://app.dimensions.ai/details/publication/pub.1113831585,32 Biomedical and Clinical Sciences; 3202 Clinical Sciences; 3207 Medical Microbiology,3 Good Health and Well Being
6398,pub.1124418371,10.24875/gmm.19005350,32026882,PMC8785358,Factores de riesgo cardiovascular en Estados Unidos y México: comparación de los estudios HABLE y ENASEM,"INTRODUCTION: In the United States, information on the Mexican-American population is available through the Health and Aging Brain among Latino Elders (HABLE) study; in Mexico, the results of the Mexican Health and Aging Study (MHAS) are available.
OBJECTIVE: To compare the prevalence of cardiovascular risk factors between men and women of the HABLE and MHAS studies.
METHOD: The prevalence of hypertension, diabetes, hypercholesterolemia and abdominal obesity was transversely analyzed in 559 HABLE participants and compared with data from 13,663 MHAS participants. The comparison was made using Student's t-test and the chi-square test, according to the type of variable.
RESULTS: The analysis showed that the prevalence of hypertension (50 %, 95 % CI = 41.8-51.8), diabetes (35.5 %, 95 % CI = 27.6-43.8) and abdominal obesity (59.3 %, 95 % CI = 50.5-68.1) were significantly higher in HABLE males, whereas females had a higher prevalence of diabetes (36.8 %, 95 % CI = 32.2-41.5) and abdominal obesity (89.6 %, 95 % CI = 86.6-92.5). Hypercholesterolemia had a higher prevalence in MHAS females (53.3%, 95% CI = 50.3-56.2).
CONCLUSION: The prevalence of cardiovascular risk factors was higher in Mexican American HABLE participants, than in Mexican MHAS participants.","La investigación reportada aquí fue apoyada por el Instituto Nacional del Envejecimiento, parte de los Institutos Nacionales de Salud. El contenido es responsabilidad de los autores y no representa necesariamente la visión oficial de los Institutos Nacionales de Salud. El equipo de investigación quiere agradecer a la comunidad local de Fort Worth y a los participantes de HABLE y ENASEM. Los archivos de datos y la documentación son de uso público y están disponibles en www.ENASEM.org.",,Gaceta Médica de México,,,"Aged; Aged, 80 and over; Cardiovascular Diseases; Cross-Sectional Studies; Diabetes Mellitus; Female; Health Surveys; Humans; Hypercholesterolemia; Hypertension; Longitudinal Studies; Male; Mexican Americans; Mexico; Middle Aged; Obesity, Abdominal; Risk Factors; Sex Distribution; United States",2019-12-18,2019,2019-12-18,2019-12-18,156,1,17-21,All OA; Gold,Article,"Vintimilla, Raúl; Reyes, Miguel; Johnson, Leigh; Hall, James; O'Bryant, Sid","Vintimilla, Raúl (Universidad del Norte de Texas, Centro de Ciencias de la Salud, Instituto de Investigación Traslacional, Texas, Estados Unidos.); Reyes, Miguel (Universidad del Norte de Texas, Centro de Ciencias de la Salud, Instituto de Investigación Traslacional, Texas, Estados Unidos.); Johnson, Leigh (Universidad del Norte de Texas, Centro de Ciencias de la Salud, Instituto de Investigación Traslacional, Texas, Estados Unidos.); Hall, James (Universidad del Norte de Texas, Centro de Ciencias de la Salud, Instituto de Investigación Traslacional, Texas, Estados Unidos.); O'Bryant, Sid (Universidad del Norte de Texas, Centro de Ciencias de la Salud, Instituto de Investigación Traslacional, Texas, Estados Unidos.)","Vintimilla, Raúl (University of North Texas)","Vintimilla, Raúl (University of North Texas); Reyes, Miguel (University of North Texas); Johnson, Leigh (University of North Texas); Hall, James (University of North Texas); O'Bryant, Sid (University of North Texas)",5,3,0.22,1.35,https://gacetamedicademexico.com/files/es/gmm_20_156_1_017-021.pdf,https://app.dimensions.ai/details/publication/pub.1124418371,32 Biomedical and Clinical Sciences; 42 Health Sciences; 4203 Health Services and Systems; 4206 Public Health,3 Good Health and Well Being
5731,pub.1113853512,10.4067/s0034-98872019000200190,31095167,,Diabetes gestacional: implementacin de una gua para su deteccin en la atencin primaria de salud,"BACKGROUND: Gestational diabetes (GD) impacts maternal and fetal morbidity. In 2012, the World Diabetes Foundation provided financing project in Barranquilla (Colombia), aimed to implement a clinical guide for the diagnosis and treatment of this condition.
AIM: To estimate the adherence of the guide in primary care centers.
MATERIAL AND METHODS: A Cross-sectional study of pregnant women suspected of having gestational diabetes. Pregnant women were classified according to the week of admission to the prenatal control program: < week 24 or later. Women with a fasting blood glucose over 92 mg/dL and under 126 mg/dL or with some positive result to the oral glucose tolerance test were included.
RESULTS: Nine percent (1,887 women) of 21,699 registries of pregnant women, were at risk for gestational diabetes. Of these, 1,880 registries with complete data were analyzed. Sixty nine entered the program at less than 24 weeks of pregnancy and 71% had had a fasting blood glucose measured in the first control. In 69.2% of these women, criteria for gestational diabetes was met. A glucose tolerance test was suggested to women with a blood glucose below 92 mg/dl. Among 72% of the latter, the glucose tolerance test met the criteria for gestational diabetes. Among the 498 women who entered the program after 24 weeks of gestation, 68% met the criteria for gestational diabetes with the fasting blood glucose levels. In 90 women, a glucose tolerance test was performed and 80% met the criteria for gestational diabetes.
CONCLUSIONS: An adequate adherence to guidelines favors the detection of pregnant women with gestational diabetes.",,,Revista Medica de Chile,,,"Adult; Blood Glucose; Colombia; Cross-Sectional Studies; Diabetes, Gestational; Female; Gestational Age; Guideline Adherence; Humans; Mass Screening; Practice Guidelines as Topic; Pregnancy; Prenatal Care; Primary Health Care",2019-02,2019,2019-02,2019-02,147,2,190-198,All OA; Gold,Article,"Tuesca Molina, Rafael; Acosta Vergara, Tania; Domínguez Lozano, Brayan; Ricaurte, Carlos; Mendoza Charris, Humberto; Flórez-Lozano, Karen; Florez-García, Víctor","Tuesca Molina, Rafael (Departamento de Salud Pública, Universidad del Norte, Barranquilla, Colombia.); Acosta Vergara, Tania (Departamento de Salud Pública, Universidad del Norte, Barranquilla, Colombia.); Domínguez Lozano, Brayan (Universidad Simón Bolívar, Barranquilla, Colombia.); Ricaurte, Carlos (Fundación Vida Nueva, Barranquilla, Colombia.); Mendoza Charris, Humberto (Despacho del alcalde distrital de Barranquilla, Colombia.); Flórez-Lozano, Karen (Departamento de matemática y estadística, Universidad del Norte, Barranquilla, Colombia.); Florez-García, Víctor (Departamento de Salud Pública, Universidad del Norte, Barranquilla, Colombia.)",,"Tuesca Molina, Rafael (Universidad del Norte); Acosta Vergara, Tania (Universidad del Norte); Domínguez Lozano, Brayan (Universidad Simón Bolívar); Ricaurte, Carlos (Fundación Vida Nueva, Barranquilla, Colombia.); Mendoza Charris, Humberto (Despacho del alcalde distrital de Barranquilla, Colombia.); Flórez-Lozano, Karen (Universidad del Norte); Florez-García, Víctor (Universidad del Norte)",9,7,0.24,3.33,https://scielo.conicyt.cl/pdf/rmc/v147n2/0717-6163-rmc-147-02-0190.pdf,https://app.dimensions.ai/details/publication/pub.1113853512,32 Biomedical and Clinical Sciences; 3215 Reproductive Medicine,
5706,pub.1123651765,10.17843/rpmesp.2019.364.4742,31967268,,Leptospirosis en ardillas (Sciurus stramineus) en una universidad del norte de Perú,,,,Revista Peruana de Medicina Experimental y Salud Pública,,,"Animals; Animals, Wild; Disease Reservoirs; Leptospirosis; Peru; Sciuridae; Seroepidemiologic Studies; Universities; Zoonoses",2019-12-06,2019,2019-12-06,2019,36,4,710-2,All OA; Gold,Article,"Gomez-Lama, Raphael Sandro; Elera-Ojeda, Rosario Nelly","Gomez-Lama, Raphael Sandro (Universidad Nacional de Piura. Piura, Perú.); Elera-Ojeda, Rosario Nelly (Universidad Nacional de Piura. Piura, Perú.)",,"Gomez-Lama, Raphael Sandro (Universidad Nacional de Piura); Elera-Ojeda, Rosario Nelly (Universidad Nacional de Piura)",0,0,,,https://rpmesp.ins.gob.pe/index.php/rpmesp/article/download/4742/3441,https://app.dimensions.ai/details/publication/pub.1123651765,,
