1053,pub.1122114111,10.4067/s0034-98872019000801024,31859967,,"Asociacin entre programa de intervencin educativa integral y control metablico de usuarios diabticos tipo 2 insulino requirentes de Centro de Salud Familiar Cardenal Ral Silva Henrquez, perodo 2015-2016 Chile","BACKGROUND: Diabetic patients have a poor adherence to lifestyle changes and a low compliance with medications.
AIM: To study the effect of an educational intervention on the metabolic control of patients with diabetes mellitus.
PATIENTS AND METHODS: We studied insulin requiring diabetic patients attended at a primary health care clinic, who were randomly divided in two groups. One group participated in four modules of an educative intervention, carried out in four occasions. The other group did not participate in the educational sessions. Clinical, anthropometric and laboratory variables of the participants were obtained from their medical records, at three and six months after the intervention.
RESULTS: We recruited 22 men aged 64 ± 14 years and 48 women aged 63 ± 10 years. Thirty-six of these received the educational intervention. Eighty four percent were overweight or obese. The proportion of compensated patients, defined as those having a glycosylated hemoglobin between 7 and 9%, increased significantly after the educational intervention (χ2 = 7.9 p < 0.01, odds ratio: 0.2).
CONCLUSIONS: A educational intervention in patients with insulin requiring diabetes mellitus improved the metabolic control of their disease.",,,Revista Medica de Chile,,,Aged; Anthropometry; Chile; Diabetes Mellitus; Educational Status; Female; Glycated Hemoglobin; Healthy Lifestyle; Humans; Longitudinal Studies; Male; Middle Aged; Patient Education as Topic; Program Evaluation; Sex Factors; Treatment Outcome,2019-08,2019,2019-08,2019-08,147,8,1024-1028,All OA; Gold,Article,"Olivares, Dayna; Flores, Jacqueline","Olivares, Dayna (Centro de Salud Familiar Cardenal Raúl Silva Henríquez, Chile.); Flores, Jacqueline (Facultad de Medicina, Universidad Católica del Norte, Coquimbo, Chile.)",,"Olivares, Dayna (Centro de Salud Familiar Cardenal Raúl Silva Henríquez, Chile.); Flores, Jacqueline (Catholic University of the North)",1,0,0.1,0.31,http://www.scielo.cl/pdf/rmc/v147n8/0717-6163-rmc-147-08-1024.pdf,https://app.dimensions.ai/details/publication/pub.1122114111,32 Biomedical and Clinical Sciences; 3202 Clinical Sciences; 42 Health Sciences; 4203 Health Services and Systems,
1049,pub.1123734662,10.15381/anales.v80i4.16441,,,Carga de trabajo del cuidador según el nivel de funcionalidad de la persona con discapacidad en un distrito de Lima,"Introduction. According to the National Institute of Statistics and Informatics (INEI), in 2017 there were three million people with disabilities in our country. Of these, 5% have a significant functional limitation, so they have to require a caregiver; who can see affected his physical and emotional activity, and eventually, they get sick. Objective. To establish the relationship between the burden of the caregiver and level of functionality of the person with disabilities. Methods. 50 caregivers and 50 people with disabilities were included. The Functional Independence Measure (FIM) is an accepted instrument for measuring disability, in three categories: complete dependence, relative dependence and independence. The Zarit and Zarit Test measures the burden of caregiver; classifying it into three categories: absence of burden, light burden and intense burden. Results. The majority of caregivers of people with disabilities reported having an intense burden, this being greater when caring for a person with complete dependence and lower when caring for a person with functional independence. However, no statistically significant association was found. Conclusion. It is common for caregivers with intense burden to be in charge of patients with complete or relative dependence, in people registered in the Comprehensive Care Service for People with Disabilities (SAIPD) of the Instituto Nacional de Bienestar Familiar (INABIF), during the year 2018. Future studies, with a better methodology, could corroborate a possible relationship between these variables.",,,Anales de la Facultad de Medicina,,,,2019-12-27,2019,2019-12-27,,80,4,451-456,All OA; Gold,Article,"del Pilar Asencios-Ortiz, Rocio; Pereyra-Zaldívar, Héctor","del Pilar Asencios-Ortiz, Rocio (Universidad Nacional Mayor de San Marcos. Lima, Perú); Pereyra-Zaldívar, Héctor (Universidad Nacional Mayor de San Marcos. Lima, Perú)",,"del Pilar Asencios-Ortiz, Rocio (National University of San Marcos); Pereyra-Zaldívar, Héctor (National University of San Marcos)",3,2,,0.9,https://revistasinvestigacion.unmsm.edu.pe/index.php/anales/article/download/16441/14510,https://app.dimensions.ai/details/publication/pub.1123734662,42 Health Sciences; 4203 Health Services and Systems,4 Quality Education
1044,pub.1121417809,10.15446/revfacmed.v67n3.69536,,,Impacto de las condiciones sociodemográficas sobre el control prenatal en Latinoamérica,"Introduction: Prenatal care is a strategy aimed at preventing the possible complications of pregnancy, childbirth and the postpartum period. Several isolated studies have been conducted to identify factors that may negatively affect prenatal care.",,,Revista de la Facultad de Medicina,,,,2019-07-01,2019,2019-07-01,,67,3,519-523,All OA; Gold,Article,"Ipia-Ordóñez, Nasly Violedy; Ortega-Vallejo, Darío Fernando; Acosta-Mora, Piedad Andrea; López-Lasso, William Andrés; Martínez-Rodríguez, Jhon Edward; Corrales-Zúñiga, Norma Constanza; Rosero-Montero, Carlos Andrés; Cedeño-Burbano, Anuar Alonso","Ipia-Ordóñez, Nasly Violedy (Clínica la Estancia, Popayán, Colombia); Ortega-Vallejo, Darío Fernando (Clínica DESA, Santiago de Cali, Colombia); Acosta-Mora, Piedad Andrea (Fundación Hospital San Pedro, San Juan de Pasto, Colombia); López-Lasso, William Andrés (Hospital Universitario San José, Colombia); Martínez-Rodríguez, Jhon Edward (Hospital Universitario San José, Colombia); Corrales-Zúñiga, Norma Constanza (Clínica Comfandi, Santiago de Cali, Colombia); Rosero-Montero, Carlos Andrés (Clínica la Estancia, Popayán, Colombia); Cedeño-Burbano, Anuar Alonso (Universidad del Cauca, Popayán, Colombia; Clínica la Estancia, Popayán, Colombia; Clínica DESA, Santiago de Cali, Colombia; Fundación Hospital San Pedro, San Juan de Pasto, Colombia; Hospital Universitario San José, Colombia; Clínica Comfandi, Santiago de Cali, Colombia)",,"Ipia-Ordóñez, Nasly Violedy (Clínica la Estancia, Popayán, Colombia); Ortega-Vallejo, Darío Fernando (Clínica DESA, Santiago de Cali, Colombia); Acosta-Mora, Piedad Andrea (Fundación Hospital San Pedro); López-Lasso, William Andrés (Hospital Universitario San José, Colombia); Martínez-Rodríguez, Jhon Edward (Hospital Universitario San José, Colombia); Corrales-Zúñiga, Norma Constanza (Clínica Comfandi, Santiago de Cali, Colombia); Rosero-Montero, Carlos Andrés (Clínica la Estancia, Popayán, Colombia); Cedeño-Burbano, Anuar Alonso (University of Cauca; Clínica la Estancia, Popayán, Colombia; Clínica DESA, Santiago de Cali, Colombia; Fundación Hospital San Pedro; Hospital Universitario San José, Colombia; Clínica Comfandi, Santiago de Cali, Colombia)",3,0,,1.11,https://revistas.unal.edu.co/index.php/revfacmed/article/download/69536/72445,https://app.dimensions.ai/details/publication/pub.1121417809,32 Biomedical and Clinical Sciences; 3215 Reproductive Medicine; 42 Health Sciences,
1035,pub.1120634074,10.18601/01229893.n44.08,,,Principios del derecho ambiental en el Acuerdo de París sobre Cambio Climático,"Este artículo se concentra en el último instrumento jurídico del régimen internacional de cambio climático, el Acuerdo de París, y en los principios ambientales que recoge. Se contextualiza con ese fin el fenómeno climático, su régimen propio y el largo camino que se ha seguido en las negociaciones climáticas para arribar a este acuerdo ambiental de última generación; luego se abordan los siete principios identificados como relevantes en el Acuerdo, así como otros temas de interés, para derivar algunas consecuencias que pueden generarse a la luz de este nuevo instrumento multilateral que está en proceso de implementación.",,,Revista Derecho del Estado,,,,2019-08-27,2019,2019-08-27,,,44,195-226,All OA; Gold,Article,"Lucas Garín, Andrea","Lucas Garín, Andrea ()",,"Lucas Garín, Andrea ()",3,1,,,https://revistas.uexternado.edu.co/index.php/derest/article/download/6148/7904,https://app.dimensions.ai/details/publication/pub.1120634074,,
1028,pub.1122560250,10.11606/issn.1806-6976.smad.2019.151483,,,Alterações mentais em trabalhadores de unidades de terapia intensiva,"Objetivo: investigar as evidências científicas sobre alterações mentais em trabalhadores de Unidades de Terapia Intensiva (UTI). Método: revisão integrativa cuja busca aconteceu nas bases de dados EMBASE, MEDLINE e SCOPUS e nas bibliotecas virtuais/coleções BVS e SCIENCE DIRECT. De 141 artigos primários identificados, 33 (23,4%) atenderam aos critérios de inclusão e foram publicados em 29 periódicos de várias áreas de conhecimento. Resultados: as alterações mentais identificadas foram: estresse, sofrimento e tensão no trabalho, depressão, astenia, fadiga, sobrecarga mental e Burnout. No trabalho, também acontecemconflitos, violência e maus tratos e os trabalhadores das UTI apresentaram predisposição ao uso de psicotrópicos. Conclusão: o tema é relevante pois há um rol de alterações mentais dos trabalhadores de UTI que podem levá-los aos absenteísmos.",,,SMAD Revista Eletrônica Saúde Mental Álcool e Drogas (Edição em Português),,,,2019-11-07,2019,2019-11-07,,15,3,1-10,All OA; Gold,Article,"Silva, Andressa Fernanda; do Carmo Cruz Robazzi, Maria Lúcia","Silva, Andressa Fernanda (Universidade de São Paulo. Escola de Enfermagem de Ribeirão Preto); do Carmo Cruz Robazzi, Maria Lúcia (Universidade de São Paulo. Escola de Enfermagem de Ribeirão Preto)",,"Silva, Andressa Fernanda (Universidade de São Paulo); do Carmo Cruz Robazzi, Maria Lúcia (Universidade de São Paulo)",2,1,,,https://www.revistas.usp.br/smad/article/download/163923/157421,https://app.dimensions.ai/details/publication/pub.1122560250,,
1027,pub.1127886302,10.22395/seec.v22n52a7,,,Pronóstico de ventas de las empresas del sector alimentos: una aplicación de redes neuronales,"The goal of this research is to forecast the sales of the following companies: Industrias Bachoco, Grupo Bafar, Grupo Bimbo, Gruma, Grupo Herdez, Grupo Lala y Grupo Industrial Maseca in the period 2006-2015 through a linear model (linear regression) and a non-linear model (artificial neural networks, decision tables, decision tress and gaussian process) for measuring the performance of each of these models and selecting for each company the model which adjusts more precisely to the historical data. As a result, in the 2006-2015 period the multiple linear regression models show a better performance in determining the sales of Bachoco, Bafar, Herdez, Lala and Maseca with more than 90% of the data recovered within this period.",,,Semestre Económico,,,,2019-07-01,2019,2019-07-01,,22,52,161-177,All OA; Gold,Article,"Castro, Arturo Morales; Reyes, Eliseo Ramirez; Albor, Gustavo Rodríguez","Castro, Arturo Morales (Universidad Nacional Autónoma de México); Reyes, Eliseo Ramirez (Universidad Nacional Autónoma de México); Albor, Gustavo Rodríguez (Universidad Autónoma del Caribe)",,"Castro, Arturo Morales (National Autonomous University of Mexico); Reyes, Eliseo Ramirez (National Autonomous University of Mexico); Albor, Gustavo Rodríguez (Universidad Autónoma del Caribe)",0,0,,0.0,https://revistas.udem.edu.co/index.php/economico/article/download/3064/2777,https://app.dimensions.ai/details/publication/pub.1127886302,"35 Commerce, Management, Tourism and Services; 46 Information and Computing Sciences; 4611 Machine Learning",
1027,pub.1120853495,10.15517/am.v30i3.36307,,,Evaluation of irrigation and pruning on the phenology and yield of Theobroma cacao L.,"Introduction. It is believed that only 0.5 % of the area planted worldwide with cocoa is irrigated. Water availability influences the rate of expansion of the tree canopy and thus light interception. Another extremely important factor is pruning, which influences the production of floral sprouts that will give rise to new fruits, influencing productivity. Objective. The objective of this study was to evaluate the effect of drip irrigation and pruning on the performance, phenology and phytosanitary behavior of cacao trees. Materials and methods. The study was developed between 2015 and 2016 in the Cauca department, Colombia. The six-year-old trees were subjected to two watering layers: L-100 % and L-0 % and two pruning levels: soft and strong. Total number of fruits, number of healthy and sick fruits, kg of wet and dry cocoa, fruit index and seed index, longitudinal and equatorial diameters and incidence of Moniliopthora roreri, Phytophthora palmivora and Monalonion dissimulatum were evaluated. The growth and development curves of the fruit throughout time were built. An experimental design of complete random blocks was used in an arrangement of divide plots. Results. Fruit index varied from 22 (T2) up to 33 fruits (T3), the seed index varied from 0.91 g (T4) to 1.14 g (T2). There were no other significant results for other variables. Conclusion. From a technical and economic point of view an optimal response to the interaction of irrigation with the two levels of pruning was observed because, with a timely application of watering and an adequate pruning management, crop performance can be increased, harvests can be programmed and better quality fruits can be obtained.",,,Agronomía Mesoamericana,,,,2019-08-07,2019,2019-08-07,,,,681-693,All OA; Gold,Article,"Meneses-Buitrago, Diego Hernán; Bolaños-Benavides, Martha Marina; Gómez-Gil, Luis Fernando; Ramos-Zambrano, Housseman Steven","Meneses-Buitrago, Diego Hernán (Corporación colombiana de investigación agropecuaria (AGROSAVIA)); Bolaños-Benavides, Martha Marina (Corporación Colombiana de Investigación Agropecuaria (AGROSAVIA)); Gómez-Gil, Luis Fernando (Corporación Colombiana de Investigación Agropecuaria (AGROSAVIA)); Ramos-Zambrano, Housseman Steven (Corporación Colombiana de Investigación Agropecuaria (AGROSAVIA))",,"Meneses-Buitrago, Diego Hernán (Corporación colombiana de investigación agropecuaria (AGROSAVIA)); Bolaños-Benavides, Martha Marina (Corporación Colombiana de Investigación Agropecuaria (AGROSAVIA)); Gómez-Gil, Luis Fernando (Corporación Colombiana de Investigación Agropecuaria (AGROSAVIA)); Ramos-Zambrano, Housseman Steven (Corporación Colombiana de Investigación Agropecuaria (AGROSAVIA))",3,1,,0.65,https://revistas.ucr.ac.cr/index.php/agromeso/article/download/36307/39492,https://app.dimensions.ai/details/publication/pub.1120853495,"30 Agricultural, Veterinary and Food Sciences; 3004 Crop and Pasture Production",
1020,pub.1130014531,10.15446/rsap.v21n6.83539,,,"Aplicación de la metodología de las ""Fuerzas Motrices"" y el modelo OMS de Determinantes Sociales de la Salud tomando como ejemplo la Criptosporidiosis en Colombia",Objectives To analyze the relationship between water contaminated with Cryptosporidium spp. oocysts and its effects on the health of human and animal populations in Colombia.,,,Revista de Salud Pública,,,,2019-11-01,2019,2019-11-01,,21,6,1-8,All OA; Gold,Article,"Hernández-Gallo, Nicolás; Hernández-Flórez, Luis J.; Cortés-Vecino, Jesús A.","Hernández-Gallo, Nicolás (Fundación Universitaria Agraria de Colombia, Bogotá, Colombia); Hernández-Flórez, Luis J. (Universidad de los Andes, Bogotá, Colombia); Cortés-Vecino, Jesús A. (Universidad Nacional de Colombia, Bogotá, Colombia; Fundación Universitaria Agraria de Colombia, Bogotá, Colombia; Universidad de los Andes, Bogotá, Colombia)",,"Hernández-Gallo, Nicolás (Universitaria Agraria de Colombia); Hernández-Flórez, Luis J. (Universidad de Los Andes); Cortés-Vecino, Jesús A. (National University of Colombia; Universitaria Agraria de Colombia; Universidad de Los Andes)",2,0,,,https://revistas.unal.edu.co/index.php/revsaludpublica/article/download/83539/74595,https://app.dimensions.ai/details/publication/pub.1130014531,,
1020,pub.1118157360,10.17151/hpsal.2019.24.2.5,,,Validez y fiabilidad en Colombia del Font Roja,"Objective: to determine the validity and reliability of Font-Roja job satisfaction questionnaire designed by Aranaz and Mira, 1988, to measure job satisfaction in health professionals in Colombia. Methodology: psychometric instrumental study that determined the facial validity of content and construct with statistical methods and reliability of the questionnaire. The sample (n = 120) for construct validity was collected by intern nurses linked with institutions providing health services in various cities of Colombia. Results: Font-Roja job satisfaction questionnaire reported validity higher than 0.71 in content and facial; 8 factors were extracted that explain 67.5% of the variance by factor analysis. The instrument is reliable with a Cronbach’s alpha of 0.80. It is necessary to maintain the scale in its entirety without deleting items. Conclusion: the Spanish version of Font-Roja job satisfaction questionnaire as an instrument to measure job satisfaction is valid and reliable in the Colombian context.",,,Hacia la Promoción de la Salud,,,,2019-07-01,2019,,2019-07-01,24,2,46-59,All OA; Gold,Article,"Abril, Fred G. Manrique; Amaya, Giomar Maritza Herrera; Fandiño, Yardany Rafael Méndez","Abril, Fred G. Manrique (Universidad Pedagógica y Tecnológica de Colombia); Amaya, Giomar Maritza Herrera (Universidad Pedagógica y Tecnológica de Colombia); Fandiño, Yardany Rafael Méndez (Universidad Pedagógica y Tecnológica de Colombia)",,"Abril, Fred G. Manrique (Pedagogical and Technological University of Colombia); Amaya, Giomar Maritza Herrera (Pedagogical and Technological University of Colombia); Fandiño, Yardany Rafael Méndez (Pedagogical and Technological University of Colombia)",6,5,,1.8,https://doi.org/10.17151/hpsal.2019.24.2.5,https://app.dimensions.ai/details/publication/pub.1118157360,42 Health Sciences; 4203 Health Services and Systems,
1018,pub.1125765095,10.22267/rus.202201.178,,,Patrón de consumo de verduras en una población infantil de Pamplona: Estudio Cualitativo,"Introduction: Adequate nutrition is fundamental for the physical and intellectual development of children. Objective: To analyze the vegetable consumption pattern of a child population in Pamplona (Colombia). Materials and methods: We conducted a qualitative research with mothers that used children’s day care facilities applying the focus group discussion methodology. The information was analyzed with the Attride-Stirling tool. Results: Participating mothers considered that vegetable consumption is important and has a positive effect on children’s health. A poor consumption is caused by low quantity and frequency of supply, limited preferences for some food preparations, and inadequate examples set by parents. The purchasing frequency, place, price and organoleptic characteristics of vegetables are important factors that limit their purchase at home. Some positive and negative strategies are suggested to encourage the ingestion of vegetables in children. Conclusions: Mothers have  assertive knowledge about vegetable consumption and its relation to children’s health. The level of vegetable consumption was low as it differs from the established recommendations. Praise, motivation and companionship of parents are positive strategies to encourage vegetable consumption, although some prefer punishment and reward.",,,Universidad y Salud,,,,2019-12-30,2019,2019-12-30,,22,1,84-90,All OA; Gold,Article,"Botía-Rodríguez, Irene; Cardona-Arguello, Gabriel Antonio; Carvajal-Suárez, Lennys","Botía-Rodríguez, Irene (Facultad de Salud, Universidad de Pamplona, Pamplona, Colombia); Cardona-Arguello, Gabriel Antonio (Facultad de Salud, Universidad de Pamplona, Pamplona, Colombia); Carvajal-Suárez, Lennys (Facultad de Salud, Universidad de Pamplona, Pamplona, Colombia)",,"Botía-Rodríguez, Irene (University of Pamplona); Cardona-Arguello, Gabriel Antonio (University of Pamplona); Carvajal-Suárez, Lennys (University of Pamplona)",3,1,,0.7,https://revistas.udenar.edu.co/index.php/usalud/article/download/4515/5723,https://app.dimensions.ai/details/publication/pub.1125765095,32 Biomedical and Clinical Sciences; 3210 Nutrition and Dietetics; 42 Health Sciences; 4206 Public Health,
1018,pub.1118157344,10.17151/hpsal.2019.24.1.10,,,Actividad física y su relación con la carga académica de estudiantes universitarios,"Objective: To characterize the dimension of exercise and physical activity as well as its relation to the academic responsibilities of university students of Popayán-Colombia. Methodology: Quantitative descriptive-correlational type sstudy, with a random sample of 350 students from nine faculties of a Higher Education institution during the second period of 2016. The Lifestyles Questionnaire for Young University Students (CEVJU-R) was used. Results: “Unhealthy” practices were identified whose motivation to exercise was “ health maintenance” and the first inspiration for not performing these practices was “laziness”. There was also a significant difference in practices between men and women (p ≤0, 05) establishing a positive relationship between academic responsibility and level of physical activity. Conclusions: Men presented healthier practices than women. It was also found that the students presenting a high academic responsibility obtained high scores in this dimension, so it was placed in the range of “unhealthy” practices which is associated with little or low physical activity.",,,Hacia la Promoción de la Salud,,,,2019-01-01,2019,,2019-01-01,24,1,112-120,All OA; Gold,Article,"Tobar, Nancy Janneth Molano; Tobar, Raquel Amalia Vélez; Galvis, Efraín Alirio Rojas","Tobar, Nancy Janneth Molano (Universidad del Cauca); Tobar, Raquel Amalia Vélez (Universidad del Cauca); Galvis, Efraín Alirio Rojas (Universidad del Cauca)",,"Tobar, Nancy Janneth Molano (University of Cauca); Tobar, Raquel Amalia Vélez (University of Cauca); Galvis, Efraín Alirio Rojas (University of Cauca)",7,2,,2.6,https://doi.org/10.17151/hpsal.2019.24.1.10,https://app.dimensions.ai/details/publication/pub.1118157344,39 Education; 3901 Curriculum and Pedagogy; 42 Health Sciences; 4206 Public Health,
