1073,pub.1017881247,10.1002/oby.20816,24957884,,Maternal hypertriglyceridemia: A link between maternal overweight‐obesity and macrosomia in gestational diabetes,"OBJECTIVE: Infants born from overweight and obese mothers with glucose-controlled gestational diabetes (GDM) tend to be large-for-gestational age (LGA). It is hypothesized that this is due to an excessive rise in maternal triglyceride levels.
METHODS: Two-hundred and seventy nine singleton GDM pregnancies were divided into three groups according to prepregnancy BMI: normal weight (BMI = 20-24.9; n = 128), overweight (BMI = 25-29.9; n = 105), and obese (BMI ≥ 30; n = 46). Individual z-scores (ZS) of maternal triglycerides and of newborn weight (NWZS) were calculated as deviations from published 50th percentiles. Mean z-scores (MZS) were the average of triglyceride ZSs. MZS of triglycerides, HbA1c and NWZS were compared. Variables are expressed as mean ± SD.
RESULTS: In the three groups respectively: LGA (%) = 10.1%, 19.0% and 30.4% (P = 0.015). Birth weight (g) = 3274.2 ± 501.3, 3342.4 ± 620.2 and 3366.3±644.7 (RSPEARMAN  = 0.111, P = 0.027). HbA1c (%) = 5.2 ± 0.39, 5.3 ± 0.50 and 5.4 ± 0.47 (P = NS). Triglyceride MZS = 1.20 ± 1.13, 1.52 ± 1.37 and 1.62 ± 1.42 (RSPEARMAN = 0.116, P = 0.024). Correlations between triglyceride MZS and NWZS were, respectively: r = 0.12 (P = NS), r = 0.42 (P <0.001), and r = 0.47 (P < 0.001).
CONCLUSIONS: In overweight and obese GDM mothers, maternal triglycerides are partially responsible for LGA infants despite good maternal glucose control during pregnancy.",We acknowledge Mrs Carolina Torres for her excellent secretarial assistance.,Funding agencies: This study was financed in part by “Fondo Nacional de Ciencia y Tecnología” (FONDECYT) No. 1120682.,Obesity,,,"Adult; Body Weight; Diabetes, Gestational; Female; Fetal Macrosomia; Gestational Age; Humans; Hypertriglyceridemia; Infant, Newborn; Obesity; Pregnancy; Pregnancy Complications; Prospective Studies",2014-06-23,2014,2014-06-23,2014-10,22,10,2156-2163,All OA; Bronze,Article,"Olmos, Pablo R.; Rigotti, Attilio; Busso, Dolores; Berkowitz, Loni; Santos, José L.; Borzone, Gisella R.; Poblete, José A.; Vera, Claudio; Belmar, Cristián; Goldenberg, Denisse; Samith, Bárbara; Acosta, Ana M.; Escalona, Manuel; Niklitschek, Ian; Mandiola, Jorge R.; Mertens, Nicolás","Olmos, Pablo R. (Department of Obstetrics & Gynecology, College of Medicine, Pontificia Universidad Católica de Chile, Alameda, 340, Santiago, Chile; Department of Nutrition, College of Medicine, Pontificia Universidad Católica de Chile, Alameda, 340, Santiago, Chile); Rigotti, Attilio (Department of Nutrition, College of Medicine, Pontificia Universidad Católica de Chile, Alameda, 340, Santiago, Chile; Department of Gastroenterology, College of Medicine, Pontificia Universidad Católica de Chile, Alameda, 340, Santiago, Chile); Busso, Dolores (Department of Nutrition, College of Medicine, Pontificia Universidad Católica de Chile, Alameda, 340, Santiago, Chile); Berkowitz, Loni (Department of Nutrition, College of Medicine, Pontificia Universidad Católica de Chile, Alameda, 340, Santiago, Chile); Santos, José L. (Department of Nutrition, College of Medicine, Pontificia Universidad Católica de Chile, Alameda, 340, Santiago, Chile); Borzone, Gisella R. (Department of Respiratory Diseases, College of Medicine, Pontificia Universidad Católica de Chile, Alameda, 340, Santiago, Chile); Poblete, José A. (Department of Obstetrics & Gynecology, College of Medicine, Pontificia Universidad Católica de Chile, Alameda, 340, Santiago, Chile); Vera, Claudio (Department of Obstetrics & Gynecology, College of Medicine, Pontificia Universidad Católica de Chile, Alameda, 340, Santiago, Chile); Belmar, Cristián (Department of Obstetrics & Gynecology, College of Medicine, Pontificia Universidad Católica de Chile, Alameda, 340, Santiago, Chile); Goldenberg, Denisse (Department of Nutrition, College of Medicine, Pontificia Universidad Católica de Chile, Alameda, 340, Santiago, Chile); Samith, Bárbara (Department of Obstetrics & Gynecology, College of Medicine, Pontificia Universidad Católica de Chile, Alameda, 340, Santiago, Chile; Department of Nutrition, College of Medicine, Pontificia Universidad Católica de Chile, Alameda, 340, Santiago, Chile); Acosta, Ana M. (Department of Nutrition, College of Medicine, Pontificia Universidad Católica de Chile, Alameda, 340, Santiago, Chile); Escalona, Manuel (Department of Nutrition, College of Medicine, Pontificia Universidad Católica de Chile, Alameda, 340, Santiago, Chile); Niklitschek, Ian (Department of Nutrition, College of Medicine, Pontificia Universidad Católica de Chile, Alameda, 340, Santiago, Chile); Mandiola, Jorge R. (College of Medicine, Universidad Católica del Norte, Avda Angamos, 0610, Antofagasta, Chile); Mertens, Nicolás (Department of Nutrition, College of Medicine, Pontificia Universidad Católica de Chile, Alameda, 340, Santiago, Chile)","Olmos, Pablo R. (Pontificia Universidad Católica de Chile; Pontificia Universidad Católica de Chile)","Olmos, Pablo R. (Pontificia Universidad Católica de Chile; Pontificia Universidad Católica de Chile); Rigotti, Attilio (Pontificia Universidad Católica de Chile; Pontificia Universidad Católica de Chile); Busso, Dolores (Pontificia Universidad Católica de Chile); Berkowitz, Loni (Pontificia Universidad Católica de Chile); Santos, José L. (Pontificia Universidad Católica de Chile); Borzone, Gisella R. (Pontificia Universidad Católica de Chile); Poblete, José A. (Pontificia Universidad Católica de Chile); Vera, Claudio (Pontificia Universidad Católica de Chile); Belmar, Cristián (Pontificia Universidad Católica de Chile); Goldenberg, Denisse (Pontificia Universidad Católica de Chile); Samith, Bárbara (Pontificia Universidad Católica de Chile; Pontificia Universidad Católica de Chile); Acosta, Ana M. (Pontificia Universidad Católica de Chile); Escalona, Manuel (Pontificia Universidad Católica de Chile); Niklitschek, Ian (Pontificia Universidad Católica de Chile); Mandiola, Jorge R. (Catholic University of the North); Mertens, Nicolás (Pontificia Universidad Católica de Chile)",50,8,1.92,10.7,https://doi.org/10.1002/oby.20816,https://app.dimensions.ai/details/publication/pub.1017881247,32 Biomedical and Clinical Sciences; 3215 Reproductive Medicine,
1057,pub.1155004115,10.17533/udea.hm.18740,,,Hoja de ruta metodológica para validar los resultados de investigación,"The construction of the objectives is one of the first steps to take in structuring a research project. This phase, like the into account first jump in the roadmap methodology, is continued by the operational definition for each of the variables, choosing the appropriate research study design and finished with the selection of the most suitable statistical tools. This article tries to illustrate with examples, the logic of this methodologies that, like a road map, can mark the difference in the validity of the investigation outcomes.",,,Hechos Microbiológicos,,,,2014-03-03,2014,2014-03-03,,3,2,81-90,All OA; Bronze,Article,"O., Raimundo Castro; Alayón, Alicia Norma","O., Raimundo Castro (Universidad de San Buenaventura); Alayón, Alicia Norma (Universidad de San Buenaventura)",,"O., Raimundo Castro (Universidad de San Buenaventura); Alayón, Alicia Norma (Universidad de San Buenaventura)",0,0,,0.0,https://revistas.udea.edu.co/index.php/hm/article/download/18740/16058,https://app.dimensions.ai/details/publication/pub.1155004115,33 Built Environment and Design; 3302 Building; 40 Engineering,
1054,pub.1068028296,10.15665/rj.v9i2.86,,,El papel creador del juez en el Estado Social de Derecho,"A partir de las normas integrantes del sistema jurídico una sociedad civil organizada a través de la participación en acciones colectivas puede convertirse en la alternativa ideal para la construcción de un modelo de democracia deliberativa que permita un mayor dinamismo y una efectividad de los procesos de decisiones que crean y modifican las políticas públicas, en este artículo de reflexión se analiza el papel definitivo que juega el juez en la construcción de la sociedad moderna.",,,Justicia juris,,,,2014-07-31,2014,2014-07-31,,9,2,13-19,All OA; Bronze,Article,"López, José Gabriel Nieves","López, José Gabriel Nieves (Universidad Autónoma del Caribe)",,"López, José Gabriel Nieves (Universidad Autónoma del Caribe)",1,0,,,http://ojs.uac.edu.co/index.php/justicia-juris/article/download/86/71,https://app.dimensions.ai/details/publication/pub.1068028296,,
1054,pub.1091946753,10.22579/20112629.304,,,La imagen y la expectativa frente a la realidad de Villavicencio como destino turístico,"El objetivo de la investigación fue analizar las dinámicas de consumo que presenta el turista en la ciudad de Villavicencio (Colombia). En esta ciudad la planeación turística se ha estructurado teniendo en cuenta elementos de la oferta, sin involucrar la demanda, representada en las expectativas y deseos de los consumidores turistas, lo que dificulta la generación de estrategias tendientes a su fidelización. Se utilizó la metodología cuantitativa. Se plantearon tres hipótesis, los datos recolectados de las 385 encuestas se procesaron en SPSS versión 18. Los resultados permiten observar que la expectativa de los turistas respecto al destino varía según las imágenes que se tienen de forma a priori y a posteriori, para ajustarse, finalmente, a las condiciones reales encontradas en Villavicencio.",,,Orinoquia,,,,2014-07-01,2014,2014-07-01,,18,2,108,All OA; Hybrid,Article,"Otero-Gómez, María C; Giraldo-Pérez, Wilson; Ospina, Duván E Ramírez","Otero-Gómez, María C (); Giraldo-Pérez, Wilson (); Ospina, Duván E Ramírez ()",,"Otero-Gómez, María C (); Giraldo-Pérez, Wilson (); Ospina, Duván E Ramírez ()",1,0,,,https://orinoquia.unillanos.edu.co/index.php/orinoquia/article/download/304/pdf_5,https://app.dimensions.ai/details/publication/pub.1091946753,,
1054,pub.1091946750,10.22579/20112629.301,,,Determinantes sociales de la salud y su asociación con el sobrepeso y obesidad en adolescentes,"El propósito de este estudio es precisar la asociación entre los determinantes sociales de la salud,  con el  sobrepeso y la obesidad en adolescentes entre 15 y 19 años del municipio de Manizales. Es un estudio analítico de casos y controles, en 256 adolescentes (128 casos y 128 controles), residentes en el municipio de Manizales. Los grupos de investigación son personas entre 15 a 19 años con IMC >=25 kg/m2  (sobrepeso y obeso); el grupo control está compuesto por personas de 15 a 19 años de edad con IMC entre 18,5 y 24,99 Kg/m2. Fueron pareados por edad y género 1:1. El promedio de edad de los adolescentes fue de 17 años, 57,8% mujeres, promedio de  IMC 24,27 kg/m2 +/-3,82 kg/m2. En relación a los determinantes sociales de la salud, no se encontró  asociación entre el nivel de escolaridad, Seguridad Social en Salud o el estrato socioeconómico, y  el sobrepeso y la  obesidad. El nivel de escolaridad del tutor resultó ser un factor preventivo ante la presencia de obesidad en el adolescente OR 0,44 IC 95% (0,21; 0,94) p=0,031. Se concluye que el nivel de escolaridad del tutor del adolescente se asocia con el sobrepeso y la obesidad.",,,Orinoquia,,,,2014-07-01,2014,2014-07-01,,18,2,66,All OA; Hybrid,Article,"Vélez, Paula A Aristizábal-; Chamorro, Diana Andrea García-; Vélez-Alvarez, Consuelo","Vélez, Paula A Aristizábal- (); Chamorro, Diana Andrea García- (); Vélez-Alvarez, Consuelo ()",,"Vélez, Paula A Aristizábal- (); Chamorro, Diana Andrea García- (); Vélez-Alvarez, Consuelo ()",1,0,,,https://orinoquia.unillanos.edu.co/index.php/orinoquia/article/download/301/pdf_2,https://app.dimensions.ai/details/publication/pub.1091946750,,
1051,pub.1045487063,10.1177/1359183514540067,,,"Death, personhood, and relatedness in the South Andes a thousand years ago","This article examines the nature of personhood in the Calchaquí region, in the South Andes, during the second part of the Late Intermediate Period (AD 1250–1450). Through the study of the location of graves, architecture, and offerings, the authors explore the type of personhood that Calchaquí communities built and represented through the materiality of funerary practice. They claim that in this cultural and historical context, death became a realm in which relatedness was interwoven. Death, symbolically and materially, built bridges, connecting and entangling people with place and with each other. The funerary sphere was not strategically used to celebrate particular biographies and personal accomplishments, but rather it was another realm, like daily life, where individual identity dissolved into place and into the collective.",We would like to thank the perceptive and helpful comments of the Journal of Material Culture editors and two anonymous reviewers.,,Journal of Material Culture,,,,2014-07-08,2014,2014-07-08,2014-09,19,3,303-326,All OA; Green,Article,"Acuto, Félix A; Kergaravat, Marisa; Amuedo, Claudia","Acuto, Félix A (IMHICIHU-CONICET, Buenos Aires, Argentina; Anthropology Graduate Program, Universidad de Tarapacá / Universidad Católica del Norte, Chile); Kergaravat, Marisa (IMHICIHU-CONICET, Buenos Aires, Argentina); Amuedo, Claudia (Instituto de Investigaciones Arquelógicas y Museo, Universidad Católica del Norte, San Pedro de Atacama)","Acuto, Félix A (IMHICIHU-CONICET, Buenos Aires, Argentina; Anthropology Graduate Program, Universidad de Tarapacá / Universidad Católica del Norte, Chile; Catholic University of the North)","Acuto, Félix A (IMHICIHU-CONICET, Buenos Aires, Argentina; Anthropology Graduate Program, Universidad de Tarapacá / Universidad Católica del Norte, Chile; Catholic University of the North); Kergaravat, Marisa (IMHICIHU-CONICET, Buenos Aires, Argentina); Amuedo, Claudia (Catholic University of the North)",7,1,,3.74,https://ri.conicet.gov.ar/bitstream/11336/33035/2/CONICET_Digital_Nro.6ffb8255-8504-48f8-8bf4-e9ad4ee2d0c7_A.pdf,https://app.dimensions.ai/details/publication/pub.1045487063,"43 History, Heritage and Archaeology; 4301 Archaeology; 4303 Historical Studies; 44 Human Society",
1030,pub.1036464104,10.1093/jac/dku412,25315364,,Tetracycline resistance gene tet(39) identified in three new genera of bacteria isolated in 1999 from Chilean salmon farms,,We thank Dr Felipe C. Cabello for suggesting we examine the isolates.,This study was supported by internal funding.,Journal of Antimicrobial Chemotherapy,,,"Animals; Bacteria; Chile; Environmental Microbiology; Genes, Bacterial; Salmon; Tetracycline; Tetracycline Resistance",2014-10-14,2014,2014-10-14,2015-02-01,70,2,619-621,All OA; Bronze,Article,"Roberts, Marilyn C.; No, David; Kuchmiy, Ella; Miranda, Claudio D.","Roberts, Marilyn C. (Department of Environmental & Occupational Health Sciences, University of Washington, Seattle, WA, USA); No, David (Department of Environmental & Occupational Health Sciences, University of Washington, Seattle, WA, USA); Kuchmiy, Ella (Department of Environmental & Occupational Health Sciences, University of Washington, Seattle, WA, USA); Miranda, Claudio D. (Department of Aquaculture, Universidad Católica del Norte, Coquimbo, Chile)","Roberts, Marilyn C. (University of Washington)","Roberts, Marilyn C. (University of Washington); No, David (University of Washington); Kuchmiy, Ella (University of Washington); Miranda, Claudio D. (Catholic University of the North)",19,1,0.54,3.1,https://academic.oup.com/jac/article-pdf/70/2/619/9529450/dku412.pdf,https://app.dimensions.ai/details/publication/pub.1036464104,32 Biomedical and Clinical Sciences; 3202 Clinical Sciences; 3214 Pharmacology and Pharmaceutical Sciences,
1030,pub.1156114588,10.22463/24221783.2217,,,"Políticas públicas, cohesión social y desarrollo local. Revisión de buenas prácticas EURO-LATINOAMERICANAS","The main purposes of this paper are to provide some reading keys on the links between social cohesion policies and local development, on one hand, and analyse some best practices of the Euro-LatinAmerican cooperation in this field, on the other hand. With this target, the article approaches a brief review of the conceptual focus of the public policies, also analysing the recent diffusion in Latin America and their growing application at the sub-national level. Finally, after a brief analysis of the social cohesion concept, the last part of the paper presents some good practices and successful experiences of the Euro-Latin American cooperation, identifying and promoting public policies made by local authorities and based on a good governance, social cohesion and democratic participation.",,,Revista científica profundidad construyendo futuro,,,,2014-12-30,2014,2014-12-30,,1,1,10-17,All OA; Hybrid,Article,"Tassara, Carlo","Tassara, Carlo (Universidad de Roma Sapienza)",,"Tassara, Carlo (Universidad de Roma Sapienza)",0,0,,0.0,https://revistas.ufps.edu.co/index.php/profundidad/article/download/2217/2207,https://app.dimensions.ai/details/publication/pub.1156114588,44 Human Society; 4407 Policy and Administration,
1030,pub.1068027859,10.15665/ad.v11i1.258,,,Lineamientos para el ordenamiento turístico territorial de los municipios costeros del departamento del atlántico,"Este artículo sintetiza los resultados de un trabajo de investigación que se realizó entre 2010 y 2012 a lo largo de la franja costera de los municipios de Puerto Colombia, Tubará, Juan de Acosta y Piojó en el norte del departamento del Atlántico y se desarrolla en el ámbito del manejo integrado costero, la planificación estratégica, la sostenibilidad ambiental y el desarrollo sostenible. Desde una metodología que parte de un marco conceptual actual acerca de lo que significa la gestión integrada de zonas costeras y que involucra técnicas e instrumentos de planificación prospectiva estratégica, se pretende lograr un estudio desde paradigmas integrales y participativos que permitan la utilización de nuevas herramientas de planificación y posibiliten la construcción de una visión de desarrollo que logre a futuro su adecuado manejo. Como resultado concreto de la implementación de las Directrices y Orientaciones de Ordenamiento Turístico Territorial para los municipios costeros de la Zona Norte del departamento del Atlántico, se espera lograr la conservación de los recursos costeros promoviendo un manejo integrado participativo y construyendo capacidades en las entidades territoriales a nivel municipal y departamental.",,,Arte & Diseño,,,,2014-09-12,2014,2014-09-12,,11,1,17-37,All OA; Bronze,Article,"Príncipe, Alfredo Arrieta","Príncipe, Alfredo Arrieta (Universidad Autónoma del Caribe)",,"Príncipe, Alfredo Arrieta (Universidad Autónoma del Caribe)",0,0,,,http://ojs.uac.edu.co/index.php/arte-diseno/article/download/258/242,https://app.dimensions.ai/details/publication/pub.1068027859,,
1030,pub.1062065404,10.11144/javeriana.iyu18-2.mpmr,,,Mathematical Programming Modeling and Resolution of the Location-Routing Problem in Urban Logistics,"The implementation of urban distribution centers nearto city centers to allow freight consolidation is a widelyextended initiative worldwide, seeking to improve trafficcongestion and quality of life in downtown, among others.This paper considers the problem of locating urbandistribution centers and proposes an exact method, basedon integer linear programming for strategic, tactical andoperational decision-making. The aim is to solve, in aninteger manner, location, sizing and operation (vehiclerouting) problems in these logistics platforms. The modelis validated using real-data taken from the city of SaintÉtienne,France. Computational experiments are alsocarried out in order to compare the proposed model withexisting procedures from the literature. Results show theefficiency and effectiveness of the proposed model and itsapplicability in real decision-making for medium sizeddata sets.",,,Ingenieria y Universidad,,,,2014-11-20,2014,2014-11-20,,18,2,271-290,All OA; Bronze,Article,"Muñoz-Villamizar, Andrés Felipe; Montoya-Torres, Jairo Rafael; Herazo-Padilla, Nilson","Muñoz-Villamizar, Andrés Felipe (Universidad de la Sabana); Montoya-Torres, Jairo Rafael (Universidad de La Sabana); Herazo-Padilla, Nilson (Universidad de La Sabana y Fundación Centro de Investigación en Modelación Empresarial del Caribe)",,"Muñoz-Villamizar, Andrés Felipe (University of La Sabana); Montoya-Torres, Jairo Rafael (University of La Sabana); Herazo-Padilla, Nilson (University of La Sabana)",14,2,,3.57,https://revistas.javeriana.edu.co/index.php/iyu/article/download/4776/9018,https://app.dimensions.ai/details/publication/pub.1062065404,"35 Commerce, Management, Tourism and Services; 3509 Transportation, Logistics and Supply Chains; 40 Engineering; 46 Information and Computing Sciences; 4605 Data Management and Data Science; 49 Mathematical Sciences; 4901 Applied Mathematics",11 Sustainable Cities and Communities
1026,pub.1068027939,10.15665/esc.v11i2.123,,,Desarrollo de la competencia de razonamiento y argumentación en estudiantes de quinto grado de Educación Básica Primaria,"Se presenta la problemática centrada en la dificultad que presentan los estudiantes en su desempeño respecto a la competencia matemática de razonamiento y argumentación; esto evidenciado en los bajos resultados en pruebas externas (SABER y prueba diagnóstica Programa Todos a Aprender) así como en un diagnóstico aplicado a una muestra de cuatros grupos, que oscilaba en 38 estudiantes de 5º del IETT Simón Bolívar de Puerto Colombia. Se aborda como objetivo diagnosticar la problemática a partir de identificar las falencias relacionadas con la competencia de razonamiento y argumentación en la resolución de problemas. Por tanto se realiza una investigación cuantitativa orientada bajo un diseño pre-experimental de grupo intacto con pre-test y pos-test, que tiene como sustentos teóricos los aportes de Carlos Vasco en cuanto al enfoque de competencias y G. Polya en lo referente a la resolución de problemas. A partir del diagnóstico realizado a docentes en cuanto a los referentes que abordan para la enseñanza,y a la revisión de los resultados de evaluaciones locales, nacionales e internacionales aplicadas a los estudiantes, se denotan falencias en lo referente al desarrollo de la competencia matemáticas de razonamiento y argumentación; hecho que resalta la necesidad de elaborar e implementar estrategias pedagógicas que propendan por el desarrollo de las competencias matemáticas y contribuyan a fortalecer el trabajo de los docentes en aras de potenciar en los estudiantes dichas competencias.",,,Escenarios,,,,2014-08-04,2014,2014-08-04,,11,2,87-97,All OA; Hybrid,Article,"Peña., Eusebio Campo","Peña., Eusebio Campo (Colegio Comunitario Distrital Pablo Neruda de Barranquilla)",,"Peña., Eusebio Campo (Colegio Comunitario Distrital Pablo Neruda de Barranquilla)",1,0,,,http://ojs.uac.edu.co/index.php/escenarios/article/download/123/108,https://app.dimensions.ai/details/publication/pub.1068027939,,
