1702,pub.1120297874,10.15446/innovar.v29n73.78028,,,Toma de decisiones: intuición y deliberación en la experiencia de los decisores,"Decision-making (DM) and the related types of thought (intuitive and deliberative) are characterized for presenting different phenomenological components. Considering the absence of prior work with Spanish-speaking populations, and the construction of knowledge in this regard, we conducted 11 non-structured surveys to seven directors expert in heterogeneous organizations in Colombia. We analyzed data through the phenomenological-hermeneutic method and explored the phenomenological components of previously made work decisions in order to identify experiences and meanings, nourishing the current knowledge. This allowed identifying seven modular categories, six inherent categories, and four contextual categories, which were integrated through a qualitative scheme. Based on this scheme and on an intuition analysis methodology, we presented a proposal for training in dm. As limitations, we point out the need to contrast the data presented on the expert directors with novices and decision-makers in non-managerial positions, as well as to contrast endogenous factors of decision-making with exogenous factors.",,,Innovar,,,,2019-07-01,2019,2019-07-01,,29,73,149-164,All OA; Gold,Article,"Manrique-Tisnés, Horacio; De Castro-Correa, Alberto","Manrique-Tisnés, Horacio (Universidad Eafit, Medellín, Colombia); De Castro-Correa, Alberto (Universidad del Norte, Barranquilla, Colombia; Universidad Eafit, Medellín, Colombia)",,"Manrique-Tisnés, Horacio (EAFIT University); De Castro-Correa, Alberto (Universidad del Norte; EAFIT University)",5,2,,1.23,https://revistas.unal.edu.co/index.php/innovar/article/download/78028/71459,https://app.dimensions.ai/details/publication/pub.1120297874,"35 Commerce, Management, Tourism and Services; 46 Information and Computing Sciences; 4605 Data Management and Data Science",
1686,pub.1117026615,10.15446/revfacmed.v67n1.65645,,,Validacin de una herramienta para revelar diagnstico de VIH a nios y adolescentes,"Resumen Introduccin. La revelacin del diagnstico de VIH/Sida a nios y adolescentes ha tenido beneficios y desafos para las familias afectadas. Objetivo. Validar la herramienta ""Mi Dragn Dormido"" para el proceso de revelacin del diagnstico de VIH/Sida a menores de 15 aos. Materiales y mtodos. Se seleccionaron 10 jueces expertos y 40 cuidadores de nios seropositivos y seronegativos para VIH mediante muestreo no probabilstico intencional. Se administraron cuestionarios estructurados para evaluar cinco componentes de eficacia y se realiz anlisis descriptivo de los datos y tabulacin mediante el programa IBM SPSS Versin 24. Resultados. Jueces expertos y cuidadores determinaron que el formato y los mensajes fueron claros y favorecieron la identificacin y aceptacin. Tambin indicaron que la herramienta permiti un cambio de comportamiento en el pblico objetivo. Conclusin. La herramienta es vlida para apoyar el proceso de revelacin de diagnstico a nios con VIH y demostr aceptacin en poblacin seronegativa, lo que sugiere que puede ser utilizada en hogares y contextos educativos para promover comportamientos que respalden la salud, el bienestar general y la reduccin de prcticas discriminatorias hacia las personas con VIH. Abstract Introduction: The disclosure of the HIV/AIDS diagnosis to children and adolescents has benefits and challenges for affected families. Objective: To validate the tool Mi Dragn Dormido (My Sleeping Dragon) during the process of disclosing an HIV/AIDS diagnosis to children under the age of 15. Materials and methods: 10 expert judges and 40 caregivers of HIV-positive and HIV-negative children were selected using non-probability purposive sampling. Structured questionnaires were applied to evaluate five efficacy components. A descriptive analysis of data and tabulation were performed using IBM SPSS Version 24 software. Results: Expertjudges and caregivers determined that the format and the messages were clear and favored identification and acceptance. They also stated that the tool enabled behavior change in the target audience. Conclusion: The tool is valid for supporting the process of disclosure of diagnosis to children with HIV and demonstrated acceptance in HIV-negative populations, suggesting that it can be used in homes and educational settings to promote behaviors that support health, general well-being and the reduction of discriminatory practices towards people with HIV.",,,Revista de la Facultad de Medicina,,,,2019-01-01,2019,2019-01-01,,67,1,37-43,All OA; Gold,Article,"Trejos-Herrera, Ana María; Alarcón-Vásquez, Yolima; Pino-Melgarejo, Mariana; Mebarak-Chams, Moises","Trejos-Herrera, Ana María (); Alarcón-Vásquez, Yolima (); Pino-Melgarejo, Mariana (); Mebarak-Chams, Moises ()",,"Trejos-Herrera, Ana María (); Alarcón-Vásquez, Yolima (); Pino-Melgarejo, Mariana (); Mebarak-Chams, Moises ()",0,0,,0.0,https://doi.org/10.15446/revfacmed.v67n1.65645,https://app.dimensions.ai/details/publication/pub.1117026615,42 Health Sciences; 4203 Health Services and Systems,3 Good Health and Well Being
1681,pub.1129926836,10.18041/1909-2458/ingeniare.26.6564,,,Protocolo para realizar análisis factorial en variables que afectan las condiciones laborales,"This work describes the steps that must be carried out to  apply the multivariate factor analysis technique. It presents  the  list  of  statistics  and  criteria  that  must  be  taken  into  account to validate whether the factor analysis technique is  appropriate  for  the  case  study.  The  target  population  is  individuals of working age from the city of Monteria, Córdoba  department, Colombia. The sample was 642 individuals. The  goals of the study included the construction of the protocol,  the  description  of  the  variables  that  influence  working  conditions and finally a proposal for a measurement model  in order to relate the indexes or observed variables and the  latent variables or factors",,,Ingeniare,,,,2019-05-30,2019,2019-05-30,,,26,13-33,All OA; Gold,Article,"López, Luz Elena Gutiérrez","López, Luz Elena Gutiérrez (Universidad del Norte)",,"López, Luz Elena Gutiérrez (Universidad del Norte)",2,0,,0.98,https://revistas.unilibre.edu.co/index.php/ingeniare/article/download/6564/5891,https://app.dimensions.ai/details/publication/pub.1129926836,"35 Commerce, Management, Tourism and Services; 3505 Human Resources and Industrial Relations",
1657,pub.1113198036,10.7440/res68.2019.06,,,On the Nature and Endings of Latin America’s Industrial Policies: Interview with Robert Kaufman and Adolfo Meisel,,,,Revista de Estudios Sociales,,,,2019-04-01,2019,2019-04-01,2019-04-01,,68,69-73,All OA; Gold,Article,"Kaufman, Robert; Meisel, Adolfo; Álvarez, Andrés; Brando, Carlos Andrés","Kaufman, Robert (Rutgers University (Estados Unidos)); Meisel, Adolfo (Universidad del Norte (Colombia)); Álvarez, Andrés (Universidad de los Andes (Colombia)); Brando, Carlos Andrés (Universidad Jorge Tadeo Lozano (Colombia))",,"Kaufman, Robert (Rutgers, The State University of New Jersey); Meisel, Adolfo (Universidad del Norte); Álvarez, Andrés (Universidad de Los Andes); Brando, Carlos Andrés (Universidad de Bogotá Jorge Tadeo Lozano)",2,0,,1.24,https://doi.org/10.7440/res68.2019.06,https://app.dimensions.ai/details/publication/pub.1113198036,44 Human Society; 4404 Development Studies,
1645,pub.1118069625,10.11144/javeriana.vj138.rndu,,,Reflexiones sobre la naturaleza del derecho urbanístico y propuesta de definición,"The issue of the Ninth (9th) Law of 1989 consolidated a novel discipline within the Colombian legal system: Urban Law. Since then, such discipline has been presented from different perspectives, either as set of public and private relationships, as general component of Public Law, as a specific discipline of Administrative Law, or even as a brand new discipline. This article considers Urban Law's nature, purposes, principles and its enforcement; it also deals with its placement within the legal sciences. Finally, according to the previously studied subjects, we present a proposal of Urban Law's definition.",,,Vniversitas,,,,2019-05-24,2019,2019-05-24,,68,138,,All OA; Gold,Article,"Gómez, Felipe Arbouin","Gómez, Felipe Arbouin (Pontificia Universidad Javeriana)",,"Gómez, Felipe Arbouin (Pontificia Universidad Javeriana)",2,0,,1.81,https://revistas.javeriana.edu.co/index.php/vnijuri/article/download/26152/22489,https://app.dimensions.ai/details/publication/pub.1118069625,48 Law and Legal Studies; 4802 Environmental and Resources Law; 4807 Public Law,"16 Peace, Justice and Strong Institutions"
1641,pub.1119884947,10.5294/edu.2019.22.2.4,,,Enseñanza a partir de saberes tradicionales de las comunidades de la etnia Wayuu,"Este artículo presenta una exploración acerca de las posibilidades de diálogo entre los conocimientos científicos escolares y los saberes locales tradicionales que son trabajados en las escuelas de la comunidad de la etnia Wayuu, a partir del reconocimiento de las plantas medicinales nativas presentes en el territorio. La metodología fue de tipo cualitativo, con observación participante, en la que, mediante la elaboración de un cuento, los niños generan respuestas sobre los saberes tradicionales de las plantas nativas. El análisis de la experiencia permite concluir que las plantas nativas y los saberes locales tradicionales permiten el diálogo entre conocimientos mediados por un cuento cultural en las escuelas de la comunidad Wayuu.",,,Educación y Educadores,,,,2019-07-26,2019,2019-07-26,2019-07-26,22,2,237-255,All OA; Gold,Article,"Melo, Nadenka Beatriz","Melo, Nadenka Beatriz (Universidad Distrital Francisco José de Caldas)",,"Melo, Nadenka Beatriz (District University of Bogotá)",9,3,,,https://educacionyeducadores.unisabana.edu.co/index.php/eye/article/download/10198/5261,https://app.dimensions.ai/details/publication/pub.1119884947,,
1605,pub.1122931496,10.15332/22563067.5401,,,Validación de un Inventario de roles de masculinidad hegemónica en varones colombianos,"The object of this study was to evaluate the psychometric properties of an inventory to measure the hegemonic masculinity in men residing in an intermediate city in Colombia. A total of 600 participants aged 18 to 65 years were selected using a non-probabilistic sampling for availability (M = 29, SD = 10.7). An inventory of 30 items that measure the adherence to the roles of hegemonic masculinity modified version MNRI-M was applied. Exploratory Factor Analysis EFA revealed five factors that explain 64% of the common variance. Confirmatory Factor Analysis CFA confirmed very good fit of this penta-factorial model in a reduced version of 17 items S-B χ2 = 343.29, gl = 109, NNFI = 0.97; CFI = 0.98. RMSEA = 0.06 IC95% (0.053, 0.067). Alpha and Omega coefficients obtained to estimate internal consistency were between 0.70 and 0.79. Constructed roles of hegemonic masculinity discriminated adequately according to age, educational level, socioeconomic classification, and occupation. It is concluded that MNRI-M possesses adequate psychometric properties.",,,Diversitas,,,,2019-11-25,2019,2019-11-25,,15,2,257-270,All OA; Gold,Article,"Roa, Carlos Alejandro Pineda; Ascanio, Geydi Katherine Galindo; González-Moreno, Diana Paola; Clavijo, Reynel Alexander Chaparro","Roa, Carlos Alejandro Pineda (Universidad del Norte, Colombia); Ascanio, Geydi Katherine Galindo (Universidad Pedagógica y Tecnológica de Colombia); González-Moreno, Diana Paola (Universidad Pedagógica y Tecnológica de Colombia); Clavijo, Reynel Alexander Chaparro (Universidad Nacional de Colombia)",,"Roa, Carlos Alejandro Pineda (Universidad del Norte); Ascanio, Geydi Katherine Galindo (Pedagogical and Technological University of Colombia); González-Moreno, Diana Paola (Pedagogical and Technological University of Colombia); Clavijo, Reynel Alexander Chaparro (National University of Colombia)",2,1,,0.6,https://revistas.usantotomas.edu.co/index.php/diversitas/article/download/5401/5431,https://app.dimensions.ai/details/publication/pub.1122931496,42 Health Sciences; 4203 Health Services and Systems; 52 Psychology,
1598,pub.1125123622,10.22518/usergioa/jour/ccsh/2019.1/a04,,,El Derecho a la Consulta Previa a los Pueblos Indígenas en el Sistema Interamericano de Derechos Humanos,"This article analyzed the contributions of ILO Convention 169 concerning Indigenous and Tribal Peoples in Independent Countries, regarding the right to prior consultation as a tool for the protection of indigenous peoples in the Inter-American Human Rights System. This analysis was based on a qualitative methodology, following the analytical-descriptive approach and using tools such as jurisprudential analysis. The research focused, particularly, on studying the sentence of the Inter-American Court of Human Rights in the case of Sarayaku v. Ecuador.  From this sentence, some legal realities can be deduced that foresee the consequences of adopting the prior consultation in the legal systems of Ecuador and Colombia, as well as its impact on the socio-economic reality of those states and their indigenous peoples.",,,Civilizar,,,,2019-02-04,2019,2019-02-04,2019-06-30,19,36,59-76,All OA; Gold,Article,"Figuera-Vargas, Sorily Carolina; Ortiz-Torres, Meylin Heleana","Figuera-Vargas, Sorily Carolina (Academia Mexicana de Derecho Internacional Privado y Comparado, México); Ortiz-Torres, Meylin Heleana (Universidad Sergio Arboleda, Barranquilla, Colombia)",,"Figuera-Vargas, Sorily Carolina (Academia Mexicana de Derecho Internacional Privado y Comparado, México); Ortiz-Torres, Meylin Heleana (Sergio Arboleda University)",1,0,,1.62,https://revistas.usergioarboleda.edu.co/index.php/ccsh/article/download/v19n36a04/958,https://app.dimensions.ai/details/publication/pub.1125123622,44 Human Society; 48 Law and Legal Studies; 4807 Public Law,"16 Peace, Justice and Strong Institutions"
1575,pub.1112170483,10.14482/sun.34.2.616.07,,,Granulomatosis eosinofílica con poliangitis: un desafío para el diagnóstico diferencial,,,,Salud Uninorte,,,,2019-02-15,2019,2019-02-15,2019-02-15,34,2,527-530,All OA; Gold,Article,"Forero Illera, Elías; Lechuga Ortiz, Jorge","Forero Illera, Elías (); Lechuga Ortiz, Jorge ()",,"Forero Illera, Elías (); Lechuga Ortiz, Jorge ()",0,0,,,https://doi.org/10.14482/sun.34.2.616.07,https://app.dimensions.ai/details/publication/pub.1112170483,,
1572,pub.1112170508,10.14482/sun.34.3.616.21,,,"Environmental factors associated with chronic Rhinosinusitis. Hospital Universitario del Caribe, Cartagena, Colombia",,,,Salud Uninorte,,,,2019-02-15,2019,2019-02-15,2019-02-15,34,3,727-736,All OA; Gold,Article,"Vargas Duque, Rafael; Milanés Pérez, Rosa; Carmona Meza, Zenen","Vargas Duque, Rafael (); Milanés Pérez, Rosa (); Carmona Meza, Zenen ()",,"Vargas Duque, Rafael (); Milanés Pérez, Rosa (); Carmona Meza, Zenen ()",0,0,,0.0,https://doi.org/10.14482/sun.34.3.616.21,https://app.dimensions.ai/details/publication/pub.1112170508,42 Health Sciences; 48 Law and Legal Studies; 4802 Environmental and Resources Law,
1570,pub.1112170517,10.14482/sun.34.3.616.93,,,Psychosocial factors and psychic wear in labor environment,,,,Salud Uninorte,,,,2019-02-15,2019,2019-02-15,2019-02-15,34,3,705-714,All OA; Gold,Article,"Carrión-García, María Ángeles; Hernández Gracia, Tirso-Javier","Carrión-García, María Ángeles (); Hernández Gracia, Tirso-Javier ()",,"Carrión-García, María Ángeles (); Hernández Gracia, Tirso-Javier ()",2,0,,,https://doi.org/10.14482/sun.34.3.616.93,https://app.dimensions.ai/details/publication/pub.1112170517,,
1568,pub.1112170512,10.14482/sun.34.3.616.467,,,"Emotional impact on the way to learn to live with the illness, ‘’la diabetes’’",,,,Salud Uninorte,,,,2019-02-15,2019,2019-02-15,2019-02-15,34,3,696-704,All OA; Gold,Article,"Leitón-Espinoza, Zoila Esperanza","Leitón-Espinoza, Zoila Esperanza ()",,"Leitón-Espinoza, Zoila Esperanza ()",0,0,,,https://doi.org/10.14482/sun.34.3.616.467,https://app.dimensions.ai/details/publication/pub.1112170512,,
1568,pub.1112170490,10.14482/sun.34.2.616.98,,,Molecular mechanisms of heat shock proteins (HSPs) involved in neoplasm development,,,,Salud Uninorte,,,,2019-02-15,2019,2019-02-15,2019-02-15,34,2,455-474,All OA; Gold,Article,"Guerrero-Rojas, Rafael; Guerrero-Fonsecaz, Carlos","Guerrero-Rojas, Rafael (); Guerrero-Fonsecaz, Carlos ()",,"Guerrero-Rojas, Rafael (); Guerrero-Fonsecaz, Carlos ()",3,1,,,https://doi.org/10.14482/sun.34.2.616.98,https://app.dimensions.ai/details/publication/pub.1112170490,,
1568,pub.1112170501,10.14482/sun.34.3.305.9,,,Social value of motorcycle related deaths in Colombia,,,,Salud Uninorte,,,,2019-02-15,2019,2019-02-15,2019-02-15,34,3,806-813,All OA; Gold,Article,"Roselli, Diego","Roselli, Diego ()",,"Roselli, Diego ()",1,0,,,https://doi.org/10.14482/sun.34.3.305.9,https://app.dimensions.ai/details/publication/pub.1112170501,,
1568,pub.1112170495,10.14482/sun.34.2.618.97,,,Learning to live with chronic pain in old age,,,,Salud Uninorte,,,,2019-02-15,2019,2019-02-15,2019-02-15,34,2,349-362,All OA; Gold,Article,"Alvarado García, Alejandra María; Salazar Maya, Ángela María","Alvarado García, Alejandra María (); Salazar Maya, Ángela María ()",,"Alvarado García, Alejandra María (); Salazar Maya, Ángela María ()",0,0,,,https://doi.org/10.14482/sun.34.2.618.97,https://app.dimensions.ai/details/publication/pub.1112170495,,
1567,pub.1112170489,10.14482/sun.34.2.616.75,,,Flexor tendon injuries in children. About a series of cases,,,,Salud Uninorte,,,,2019-02-15,2019,2019-02-15,2019-02-15,34,2,253-262,All OA; Gold,Article,"Vergara Amador, Enrique; Hernández Solano, Manuel A.","Vergara Amador, Enrique (); Hernández Solano, Manuel A. ()",,"Vergara Amador, Enrique (); Hernández Solano, Manuel A. ()",0,0,,,https://doi.org/10.14482/sun.34.2.616.75,https://app.dimensions.ai/details/publication/pub.1112170489,,
1566,pub.1112170497,10.14482/sun.34.2.658.48,,,Inventory of Violence and Psychological Harassment in the Workplace (IVAPT) for Colombia,,,,Salud Uninorte,,,,2019-02-15,2019,2019-02-15,2019-02-15,34,2,538-540,All OA; Gold,Article,"Pando Moreno, Manuel; Calderón Mafud, José Luis","Pando Moreno, Manuel (); Calderón Mafud, José Luis ()",,"Pando Moreno, Manuel (); Calderón Mafud, José Luis ()",2,0,,,https://doi.org/10.14482/sun.34.2.658.48,https://app.dimensions.ai/details/publication/pub.1112170497,,
1566,pub.1112170502,10.14482/sun.34.3.613.71,,,"Componente de mercadeo del programa de evaluación “Chécate, mídete, muévete” en comunidades rurales de Tabasco, México",,,,Salud Uninorte,,,,2019-02-15,2019,2019-02-15,2019-02-15,34,3,675-686,All OA; Gold,Article,"Ramón-Bautista, Cynthia Selene; Priego-Álvarez, Heberto Romeo","Ramón-Bautista, Cynthia Selene (); Priego-Álvarez, Heberto Romeo ()",,"Ramón-Bautista, Cynthia Selene (); Priego-Álvarez, Heberto Romeo ()",0,0,,,https://doi.org/10.14482/sun.34.3.613.71,https://app.dimensions.ai/details/publication/pub.1112170502,,
1566,pub.1112170471,10.14482/sun.34.2.001,,,Editorial. Pensar en el cuidado de la salud,,,,Salud Uninorte,,,,2019-02-15,2019,2019-02-15,2019-02-15,34,2,viii-x,All OA; Gold,Article,"Huerta-González, Sara","Huerta-González, Sara ()",,"Huerta-González, Sara ()",0,0,,,https://doi.org/10.14482/sun.34.2.001,https://app.dimensions.ai/details/publication/pub.1112170471,,
1565,pub.1112170519,10.14482/sun.34.3.617.05,,,Use of low power laser as an adjuvant in the treatment of periapical lesions. Systematic review,,,,Salud Uninorte,,,,2019-02-15,2019,2019-02-15,2019-02-15,34,3,797-805,All OA; Gold,Article,"Quesada Maldonado, Edison; Covo Morales, Eduardo; Herrera Herrera, Alejandra","Quesada Maldonado, Edison (); Covo Morales, Eduardo (); Herrera Herrera, Alejandra ()",,"Quesada Maldonado, Edison (); Covo Morales, Eduardo (); Herrera Herrera, Alejandra ()",2,1,,,https://doi.org/10.14482/sun.34.3.617.05,https://app.dimensions.ai/details/publication/pub.1112170519,,
1565,pub.1112170511,10.14482/sun.34.3.616.46,,,Macronutrient intake in patients with type 2 diabetes mellitus in primary care en Xalapa (México),,,,Salud Uninorte,,,,2019-02-15,2019,2019-02-15,2019-02-15,34,3,541-550,All OA; Gold,Article,"González Jiménez, Alberto","González Jiménez, Alberto ()",,"González Jiménez, Alberto ()",1,1,,,https://doi.org/10.14482/sun.34.3.616.46,https://app.dimensions.ai/details/publication/pub.1112170511,,
1565,pub.1112170503,10.14482/sun.34.3.614.4,,,Epidemiology of pulmonary hypertension in colombia,,,,Salud Uninorte,,,,2019-02-15,2019,2019-02-15,2019-02-15,34,3,607-624,All OA; Gold,Article,"Miranda M., Pablo A.; Guzmán Sáenz, Roberto C.; Baños A., Ivan; Alvarez B., Álvaro","Miranda M., Pablo A. (); Guzmán Sáenz, Roberto C. (); Baños A., Ivan (); Alvarez B., Álvaro ()",,"Miranda M., Pablo A. (); Guzmán Sáenz, Roberto C. (); Baños A., Ivan (); Alvarez B., Álvaro ()",2,0,,,https://doi.org/10.14482/sun.34.3.614.4,https://app.dimensions.ai/details/publication/pub.1112170503,,
1565,pub.1112170525,10.14482/sun.34.3.617.63,,,"Survey of health undergraduates’ knowledge on pregnant women’ oral health and its association with pregnancy outcomes. Cali, 2015",,,,Salud Uninorte,,,,2019-02-15,2019,2019-02-15,2019-02-15,34,3,652-663,All OA; Gold,Article,"Corchuelo Ojeda, Jairo; Mambuscay, Juan Carlos","Corchuelo Ojeda, Jairo (); Mambuscay, Juan Carlos ()",,"Corchuelo Ojeda, Jairo (); Mambuscay, Juan Carlos ()",2,1,,0.74,https://doi.org/10.14482/sun.34.3.617.63,https://app.dimensions.ai/details/publication/pub.1112170525,32 Biomedical and Clinical Sciences; 3215 Reproductive Medicine,3 Good Health and Well Being
1563,pub.1112170510,10.14482/sun.34.3.616.34,,,Evaluation of the antimicrobial activity of calcium hydroxide combined omeprazole against enterococcus faecalis,,,,Salud Uninorte,,,,2019-02-15,2019,2019-02-15,2019-02-15,34,3,551-557,All OA; Gold,Article,"Alvear Pérez, Javier; Pupo Marrugo, Stella; Romero, Andrés","Alvear Pérez, Javier (); Pupo Marrugo, Stella (); Romero, Andrés ()",,"Alvear Pérez, Javier (); Pupo Marrugo, Stella (); Romero, Andrés ()",0,0,,0.0,https://doi.org/10.14482/sun.34.3.616.34,https://app.dimensions.ai/details/publication/pub.1112170510,32 Biomedical and Clinical Sciences; 3203 Dentistry,
1563,pub.1112170522,10.14482/sun.34.3.617.55,,,Paraesophageal hernia: a diagnostic challenge,,,,Salud Uninorte,,,,2019-02-15,2019,2019-02-15,2019-02-15,34,3,814-818,All OA; Gold,Article,"Vargas-De la Puente, David; Álvarez-Jimenez, Jarib; Iglesias-Acosta, Jesús","Vargas-De la Puente, David (); Álvarez-Jimenez, Jarib (); Iglesias-Acosta, Jesús ()",,"Vargas-De la Puente, David (); Álvarez-Jimenez, Jarib (); Iglesias-Acosta, Jesús ()",0,0,,,https://doi.org/10.14482/sun.34.3.617.55,https://app.dimensions.ai/details/publication/pub.1112170522,,
1563,pub.1112170527,10.14482/sun.34.3.649.8,,,La telaraña del cuidado familiar para el adulto mayor en situación de discapacidad y pobreza,,,,Salud Uninorte,,,,2019-02-15,2019,2019-02-15,2019-02-15,34,3,597-606,All OA; Gold,Article,"Galvis-Palacios, Luisa; López-Díaz, Lucero; Florisa-Velásquez, Vilma","Galvis-Palacios, Luisa (); López-Díaz, Lucero (); Florisa-Velásquez, Vilma ()",,"Galvis-Palacios, Luisa (); López-Díaz, Lucero (); Florisa-Velásquez, Vilma ()",3,2,,,https://doi.org/10.14482/sun.34.3.649.8,https://app.dimensions.ai/details/publication/pub.1112170527,,
1562,pub.1112170516,10.14482/sun.34.3.616.92,,,Evaluación del conocimiento de estudiantes de enfermería sobre la enfermedad de Chagas,,,,Salud Uninorte,,,,2019-02-15,2019,2019-02-15,2019-02-15,34,3,565-580,All OA; Gold,Article,"Montaño Bohórquez, Yuli; Galvis Pabón, Jairo; García Rueda, Alexandra; Mendoza Becerra, Jessica; Roa Díaz, Zayne; Camargo Ramírez, Martha","Montaño Bohórquez, Yuli (); Galvis Pabón, Jairo (); García Rueda, Alexandra (); Mendoza Becerra, Jessica (); Roa Díaz, Zayne (); Camargo Ramírez, Martha ()",,"Montaño Bohórquez, Yuli (); Galvis Pabón, Jairo (); García Rueda, Alexandra (); Mendoza Becerra, Jessica (); Roa Díaz, Zayne (); Camargo Ramírez, Martha ()",1,0,,,https://doi.org/10.14482/sun.34.3.616.92,https://app.dimensions.ai/details/publication/pub.1112170516,,
1562,pub.1112170520,10.14482/sun.34.3.617.43,,,Calidad de vida en pacientes sometidos a cirugia bariatrica,,,,Salud Uninorte,,,,2019-02-15,2019,2019-02-15,2019-02-15,34,3,625-632,All OA; Gold,Article,"Sánchez-Piedrahita, Lina María; Castañeda-Avilés, Erika Alejandra; Núñez-Gómez, Nicolás Arturo","Sánchez-Piedrahita, Lina María (); Castañeda-Avilés, Erika Alejandra (); Núñez-Gómez, Nicolás Arturo ()",,"Sánchez-Piedrahita, Lina María (); Castañeda-Avilés, Erika Alejandra (); Núñez-Gómez, Nicolás Arturo ()",2,0,,,https://doi.org/10.14482/sun.34.3.617.43,https://app.dimensions.ai/details/publication/pub.1112170520,,
1562,pub.1112170475,10.14482/sun.34.2.610.73,,,"Enfermeras, ¿perciben el trabajo emocional?",,,,Salud Uninorte,,,,2019-02-15,2019,2019-02-15,2019-02-15,34,2,518-526,All OA; Gold,Article,"Ramos Guajardo, Sandra Elena; Ceballos Vásquez, Paula","Ramos Guajardo, Sandra Elena (); Ceballos Vásquez, Paula ()",,"Ramos Guajardo, Sandra Elena (); Ceballos Vásquez, Paula ()",3,0,,,https://doi.org/10.14482/sun.34.2.610.73,https://app.dimensions.ai/details/publication/pub.1112170475,,
